Title,Movie Link,Year,Duration,MPA,Rating,Votes,Description,budget,grossWorldWide,gross_US_Canada,opening_weekend_Gross,directors,writers,stars,genres,countries_origin,filming_locations,production_companies,Languages,wins,nominations,oscars,release_date
87. Secret Ceremony,https://www.imdb.com/title/tt0063571/?ref_=sr_t_87,1968,1h 49m,R,6.2,2.8K,"A penniless woman meets a strange girl who insists she is her long-lost mother, and becomes enmeshed in a web of deception, and perhaps madness.",3200000.0,580.0,,,['Joseph Losey'],"['Marco Denevi', 'George Tabori']","['Elizabeth Taylor', 'Robert Mitchum', 'Mia Farrow']","['Erotic Thriller', 'Psychological Drama', 'Psychological Thriller', 'Drama', 'Thriller']",['United Kingdom'],"['Debenham House, Addison Road, Holland Park, London, England, UK']",['World Film Services'],['English'],0,3,0,1968
88. Inspector Clouseau,https://www.imdb.com/title/tt0063135/?ref_=sr_t_88,1968,1h 36m,G,4.8,3.4K,A string of robberies has occurred in Britain and it's up to Inspector Clouseau to catch the criminal.,,,1900000.0,,['Bud Yorkin'],"['Blake Edwards', 'Maurice Richlin', 'Tom Waldman']","['Alan Arkin', 'Frank Finlay', 'Delia Boccardo']","['Bumbling Detective', 'Caper', 'Farce', 'Slapstick', 'Comedy', 'Crime', 'Mystery']","['United Kingdom', 'United States']","['Billingsgate, Trafalgar Way, Isle of Dogs, London, England, UK']","['Mirisch Films', 'The Mirisch Corporation']",['English'],0,0,0,1968
89. The Lost Continent,https://www.imdb.com/title/tt0063240/?ref_=sr_t_89,1968,1h 37m,G,5.5,2.4K,"The captain, crew, and passengers of an old freighter-all of them with dark secrets to keep-find themselves adrift in a mysterious land full of monsters, conquistadors, and killer seaweed.",,,,,"['Michael Carreras', 'Leslie Norman']","['Michael Carreras', 'Dennis Wheatley']","['Eric Porter', 'Hildegard Knef', 'Suzanna Leigh']",['Adventure'],"['United Kingdom', 'United States']","['Elstree Studios, Borehamwood, Hertfordshire, England, UK']","['Seven Arts Productions', 'Hammer Films']",['English'],0,0,0,1968
90. Succubus,https://www.imdb.com/title/tt0062032/?ref_=sr_t_90,1968,1h 19m,X,5.3,1.3K,"A performer at an S&M nightclub begins to lose her grip on reality, and is plunged into a nightmarish mental landscape.",,,,,['Jesús Franco'],"['Pier A. Caminnecci', 'Jesús Franco', 'Gert Günther Hoffmann']","['Janine Reynaud', 'Jack Taylor', 'Howard Vernon']","['Psychological Horror', 'Psychological Thriller', 'Horror', 'Mystery', 'Thriller']",['West Germany'],"['Lisbon, Portugal']","['Aquila Film Enterprises', 'Montana-Film']","['German', 'English']",0,0,0,1968
91. Isadora,https://www.imdb.com/title/tt0063141/?ref_=sr_t_91,1968,2h 11m,M/PG,6.8,2.7K,"A biography of the 1920s dancer Isadora Duncan, who forever changed people's ideas of ballet. Her nude, semi-nude, and pro-Soviet dance projects as well as her attitude and lifestyle shocked the public of her time.",,,,,['Karel Reisz'],"['Melvyn Bragg', 'Margaret Drabble', 'Isadora Duncan']","['Vanessa Redgrave', 'James Fox', 'Jason Robards']","['Period Drama', 'Biography', 'Drama', 'Music', 'Romance']","['United Kingdom', 'France']","['Kingsdown, Deal, Kent, England, UK']","['Hakim', 'Paris Film']","['English', 'Russian', 'French', 'German']",3,6,1,1968
92. The Night They Raided Minsky's,https://www.imdb.com/title/tt0063348/?ref_=sr_t_92,1968,1h 39m,PG-13,6.0,1.9K,"A naive young Amish woman runs away from her home in Pennsylvania to New York City, where she hopes to act in religious stage plays but ends up performing in Burlesque theatre.",3000000.0,,,,['William Friedkin'],"['Arnold Schulman', 'Sidney Michaels', 'Norman Lear']","['Jason Robards', 'Britt Ekland', 'Norman Wisdom']",['Comedy'],['United States'],"['Myrtle Avenue Elevated Subway, Brooklyn, New York City, New York, USA']",['Tandem Productions'],['English'],0,0,0,1968
93. The Crimson Cult,https://www.imdb.com/title/tt0062833/?ref_=sr_t_93,1968,1h 27m,R,5.5,3.2K,"Robert Manning visits the remote country house where his brother Peter was last seen. While his host seems outwardly friendly and his niece more demonstrably so, Robert detects a feeling of menace in the air.",,,,,['Vernon Sewell'],"['Mervyn Haisman', 'Henry Lincoln', 'Jerry Sohl']","['Boris Karloff', 'Christopher Lee', 'Mark Eden']",['Horror'],['United Kingdom'],"[""Grim's Dyke House, Old Redding, Harrow Weald, Middlesex, England, UK""]",['Tigon British Film Productions'],['English'],0,0,0,1968
94. The Killing of Sister George,https://www.imdb.com/title/tt0063185/?ref_=sr_t_94,1968,2h 18m,R,7.0,2.6K,The life of a soap opera actress begins to unravel as she fears her character will be written out of the series.,,,,,['Robert Aldrich'],"['Frank Marcus', 'Lukas Heller']","['Beryl Reid', 'Susannah York', 'Coral Browne']",['Drama'],['United States'],"['Paramount Studios - 5555 Melrose Avenue, Hollywood, Los Angeles, California, USA']","['Palomar Pictures (I)', 'The Associates & Aldrich Company']",['English'],0,0,0,1968
95. The Olsen Gang,https://www.imdb.com/title/tt0063386/?ref_=sr_t_95,1968,1h 20m,Not Rated,6.6,2.7K,"Egon Olsen's criminal trio always gets into unlucky, comical situations when executing Egon's genius plans. After release from prison, he already has a new plan: steal a valuable German item from a secured museum in Copenhagen.",1000000.0,,,,['Erik Balling'],"['Erik Balling', 'Henning Bahs']","['Ove Sprogøe', 'Morten Grunwald', 'Poul Bundgaard']","['Comedy', 'Crime', 'Family']",['Denmark'],"['Prinsesse Charlottes Gade, Copenhagen, Sjælland, Denmark']",['Nordisk Film'],['Danish'],0,0,0,1968
96. Asterix and Cleopatra,https://www.imdb.com/title/tt0062687/?ref_=sr_t_96,1968,1h 12m,TV-Y7-FV,7.2,15K,"Cleopatra decides to prove to Julius Caesar that her people are not decadent by building a palace in less than three months. When Cleopatra's architect asks the Gallic druid Getafix for help, Asterix and Obelix accompany him to Egypt.",,1090041.0,,,"['René Goscinny', 'Albert Uderzo']","['René Goscinny', 'Albert Uderzo', 'Pierre Tchernia']","['Roger Carel', 'Jacques Morel', 'Micheline Dax']","['Adventure', 'Animation', 'Comedy', 'Family', 'History']","['France', 'Belgium']",[],"['Belvision', 'Dargaud Films']",['French'],0,0,0,1968
97. Jet Generation,https://www.imdb.com/title/tt0061839/?ref_=sr_t_97,1968,1h 38m,,4.9,136,"In the ""Swinging Munich"" of the late 1960s: The young millionaire daughter Carroll Buchheim, an American, flew from the United States to Germany to visit her brother, who lives here.",,,,,['Eckhart Schmidt'],"['Roger Fritz', 'Eckhart Schmidt']","['Dginn Moeller', 'Roger Fritz', 'Jürgen Draeger']","['Drama', 'Romance']",['West Germany'],"['Hofbräuhaus, München, Germany']",['Roger Fritz Filmproduktion'],['German'],0,0,0,1968
98. 5 Card Stud,https://www.imdb.com/title/tt0062626/?ref_=sr_t_98,1968,1h 43m,Approved,6.4,4.6K,"The players in an ongoing poker game are being mysteriously killed off, one by one.",,,,,['Henry Hathaway'],"['Marguerite Roberts', 'Ray Gaulden']","['Dean Martin', 'Robert Mitchum', 'Inger Stevens']","['Classical Western', 'Whodunnit', 'Drama', 'Mystery', 'Romance', 'Western']",['United States'],"['Durango, Mexico']","['Hal Wallis Productions', 'Paramount Pictures', 'Wallis-Hazen']",['English'],0,0,0,1968
99. Mayerling,https://www.imdb.com/title/tt0064645/?ref_=sr_t_99,1968,2h 20m,PG-13,6.1,1.9K,Based on real life events that led to tragic deaths of Crown Prince Rudolf of Austria and his lover Baroness Mary Vetsera.,5000000.0,,,,['Terence Young'],"['Terence Young', 'Denis Cannan', 'Claude Anet']","['Omar Sharif', 'Catherine Deneuve', 'James Mason']","['Costume Drama', 'Period Drama', 'Drama', 'History', 'Romance']","['United Kingdom', 'France']","['Vienna, Austria']","['Winchester Productions', 'Les Films Corona', 'Alexandra Film']","['English', 'French', 'German']",0,0,0,1968
100. Speedway,https://www.imdb.com/title/tt0063634/?ref_=sr_t_100,1968,1h 34m,G,5.5,2.8K,Poor bookkeeping saddles stock-car driver Steve Grayson with a huge bill for back taxes which hampers his ability to continue racing competitively.,1500000.0,,,,['Norman Taurog'],['Phil Shuken'],"['Elvis Presley', 'Nancy Sinatra', 'Bill Bixby']","['Classic Musical', 'Romantic Comedy', 'Comedy', 'Musical', 'Romance']",['United States'],"['Riverside International Raceway, 22255 Eucalyptus Avenue, Moreno Valley, California, USA']",['Metro-Goldwyn-Mayer (MGM)'],['English'],0,0,0,1968
