Title,Movie Link,Year,Duration,MPA,Rating,Votes,Description,budget,grossWorldWide,gross_US_Canada,opening_weekend_Gross,directors,writers,stars,genres,countries_origin,filming_locations,production_companies,Languages,wins,nominations,oscars,release_date
88. Kagemusha: The Shadow Warrior,https://www.imdb.com/title/tt0080979/?ref_=sr_t_88,1980,2h 42m,PG,7.9,39K,A petty thief with an utter resemblance to a samurai warlord is hired as the lord's double. When the warlord later dies the thief is forced to take up arms in his place.,6000000.0,4018532,4000000,,['Akira Kurosawa'],"['Masato Ide', 'Akira Kurosawa']","['Tatsuya Nakadai', 'Tsutomu Yamazaki', ""Ken'ichi Hagiwara""]","['Epic', 'Historical Epic', 'Period Drama', 'Tragedy', 'War Epic', 'Drama', 'History', 'War']","['Japan', 'United States']","['Himeji Castle, Himeji, Japan']","['Kurosawa Production Co.', 'Toho', 'Twentieth Century Fox']",['Japanese'],20,5,2,1980
89. Resurrection,https://www.imdb.com/title/tt0081414/?ref_=sr_t_89,1980,1h 43m,PG,7.1,3.6K,A woman enters the afterlife briefly after a car crash that kills her husband. But she survives - and finds herself possessing strange powers.,6000000.0,3910019,3910019,308068.0,['Daniel Petrie'],['Lewis John Carlino'],"['Ellen Burstyn', 'Sam Shepard', 'Richard Farnsworth']","['Drama', 'Fantasy']",['United States'],"['Shiner, Texas, USA']",['Universal Pictures'],['English'],3,9,2,1980
90. Hide in Plain Sight,https://www.imdb.com/title/tt0080868/?ref_=sr_t_90,1980,1h 32m,PG,6.4,1.1K,"A divorced factory worker in 1967 Buffalo fights for custody of his children after his ex-wife marries a low-level mobster who enters the witness protection program, battling with government officials who seem to have little sympathy.",,3806930,3806930,810109.0,['James Caan'],"['Leslie Waller', 'Spencer Eastman']","['James Caan', 'Jill Eikenberry', 'Robert Viharo']",['Drama'],['United States'],"['Buffalo, New York, USA']",['Metro-Goldwyn-Mayer (MGM)'],['English'],0,0,0,1980
91. When Time Ran Out...,https://www.imdb.com/title/tt0081747/?ref_=sr_t_91,1980,2h 1m,PG,4.6,3.4K,An active volcano threatens a south Pacific island resort and its guests as a power struggle ensues between the property's developer and a drilling foreman.,20000000.0,3763988,3763988,1400994.0,['James Goldstone'],"['Gordon Thomas', 'Max Morgan Witts', 'Carl Foreman']","['Paul Newman', 'Jacqueline Bisset', 'William Holden']","['Action', 'Adventure', 'Drama', 'Thriller']",['United States'],"['Sheraton Keauhou Bay Resort and Spa - 78-128 Ehukai Street, Kailua-Kona, Hawaii, USA']",['International Cinema'],['English'],0,2,1,1980
92. Heaven's Gate,https://www.imdb.com/title/tt0080855/?ref_=sr_t_92,1980,3h 39m,R,6.7,18K,"During the Johnson County War in 1890 Wyoming, a sheriff born into wealth does his best to protect immigrant farmers from rich cattle interests.",44000000.0,3484523,3484331,,['Michael Cimino'],['Michael Cimino'],"['Kris Kristofferson', 'Christopher Walken', 'John Hurt']","['Costume Drama', 'Epic', 'Period Drama', 'Western Epic', 'Adventure', 'Drama', 'Western']",['United States'],"['Kalispell, Montana, USA']",['Partisan Productions'],"['English', 'Serbo-Croatian', 'Russian', 'French', 'Polish', 'German', 'Ukrainian']",2,9,1,1980
93. The Last Metro,https://www.imdb.com/title/tt0080610/?ref_=sr_t_93,1980,2h 12m,PG,7.3,16K,"In occupied Paris, an actress married to a Jewish theater owner must keep him hidden from the Germans while doing both of their jobs.",,3007945,3007945,11206.0,['François Truffaut'],"['François Truffaut', 'Suzanne Schiffman', 'Jean-Claude Grumberg']","['Catherine Deneuve', 'Gérard Depardieu', 'Jean Poiret']","['Political Drama', 'Workplace Drama', 'Drama', 'Romance', 'War']",['France'],"['Clichy, Hauts-de-Seine, France']","['Les Films du Carrosse', 'Sédif Productions', 'TF1 Films Production']","['French', 'German', 'Italian']",13,7,1,1980
94. North Sea Hijack,https://www.imdb.com/title/tt0081809/?ref_=sr_t_94,1980,1h 35m,PG,6.3,6.1K,"When terrorists take over two oil rigs, and threaten to blow them up if their demands are not met, an eccentric anti-terrorism expert volunteers his unique commando unit to stop them.",,2993772,2993772,805511.0,['Andrew V. McLaglen'],['Jack Davies'],"['Roger Moore', 'James Mason', 'Anthony Perkins']","['Dark Comedy', 'Action', 'Adventure', 'Thriller']",['United Kingdom'],"['Galway City, County Galway, Ireland']","['Cinema Seven Productions', 'Universal Pictures']",['English'],0,0,0,1980
95. Midnight Madness,https://www.imdb.com/title/tt0081159/?ref_=sr_t_95,1980,1h 52m,PG,6.3,4K,Leon picks college students to participate in his all night scavenger hunt. Five teams receive clues to solve leading them to the next clue site hidden in the city.,,2900000,2900000,,"['Michael Nankin', 'David Wechter']","['David Wechter', 'Michael Nankin']","['David Naughton', 'Debra Clinger', 'Joel Kenney']",['Comedy'],['United States'],"['Griffith Observatory - 2800 E Observatory Rd, Los Angeles, California, USA']",['Walt Disney Productions'],['English'],0,0,0,1980
96. Loving Couples,https://www.imdb.com/title/tt0081080/?ref_=sr_t_96,1980,1h 37m,PG,5.1,568,Wife is cheating her husband and the husband is cheating her back with her lover's girlfriend. The two cheating couples decide to go to a resort but they unintentionally pick the same one. Hilarity ensues.,,2806659,2806659,1010181.0,['Jack Smight'],['Martin Donovan'],"['Shirley MacLaine', 'James Coburn', 'Susan Sarandon']",['Comedy'],['United States'],"['Southern California, California, USA']",['Time Life Films'],['English'],0,0,0,1980
97. The Idolmaker,https://www.imdb.com/title/tt0080913/?ref_=sr_t_97,1980,1h 57m,PG,6.9,1.6K,"Based on the life of rock promoter/producer Bob Marcucci, who discovered, among others, Frankie Avalon and Fabian.",,2625716,2625716,318403.0,['Taylor Hackford'],"['Edward Di Lorenzo', 'Taylor Hackford']","['Ray Sharkey', 'Tovah Feldshuh', 'Peter Gallagher']","['Showbiz Drama', 'Biography', 'Drama', 'Music', 'Romance']",['United States'],"['Los Angeles, California, USA']","['Kirkwood', 'Koch Company']","['English', 'Italian']",0,2,0,1980
98. The Black Marble,https://www.imdb.com/title/tt0080442/?ref_=sr_t_98,1980,1h 53m,PG,6.2,941,"A show dog trainer in desperate need of money kidnaps a prized show dog and demands a ransom. The case falls into the hands of a melancholic detective and his new female partner, whose personal relationship develops throughout the case.",3000000.0,2500000,2500000,,['Harold Becker'],['Joseph Wambaugh'],"['Robert Foxworth', 'Paula Prentiss', 'Harry Dean Stanton']","['Romantic Comedy', 'Comedy', 'Crime', 'Drama', 'Romance']",['United States'],"['Los Angeles, California, USA']",['Black Marble Company'],"['English', 'Russian']",0,0,0,1980
99. Gilda Live,https://www.imdb.com/title/tt0080790/?ref_=sr_t_99,1980,1h 36m,R,6.9,917,"A filmed version of the Broadway show starring comedienne Gilda Radner, complete with the characters she made famous on the TV show Saturday Night Live (1975).",,2261507,2261507,344234.0,"['Mike Nichols', 'Lorne Michaels']","['Anne Beatts', 'Lorne Michaels', 'Marilyn Suzanne Miller']","['Gilda Radner', 'Don Novello', 'Paul Shaffer']","['Parody', 'Sketch Comedy', 'Comedy']",['United States'],[],['Broadway Productions'],['English'],0,0,0,1980
100. Windows,https://www.imdb.com/title/tt0081759/?ref_=sr_t_100,1980,1h 36m,R,4.8,1K,A weird woman admires and spies on her shy mousy neighbor with a telescope.,,2128395,2128395,311796.0,['Gordon Willis'],['Barry Siegel'],"['Talia Shire', 'Joe Cortese', 'Elizabeth Ashley']","['Drama', 'Thriller']",['United States'],"['9 Cranberry Street, Brooklyn Heights, Brooklyn, New York City, New York, USA']",['Mike Lobell Productions'],['English'],0,6,0,1980
