Title,Movie Link,Year,Duration,MPA,Rating,Votes,Description
1. Swiss Family Robinson,https://www.imdb.com/title/tt0054357/?ref_=sr_t_1,1960,2h 6m,Approved,7.1,19K,A Swiss family must survive being shipwrecked on a deserted island.
2. Psycho,https://www.imdb.com/title/tt0054215/?ref_=sr_t_2,1960,1h 49m,R,8.5,745K,A secretary on the run for embezzlement takes refuge at a secluded California motel owned by a repressed man and his overbearing mother.
3. The Apartment,https://www.imdb.com/title/tt0053604/?ref_=sr_t_3,1960,2h 5m,Approved,8.3,206K,"A Manhattan insurance clerk tries to rise in his company by letting its executives use his apartment for trysts, but office politics and his own romantic hopes complicate matters."
4. Spartacus,https://www.imdb.com/title/tt0054331/?ref_=sr_t_4,1960,3h 17m,PG-13,7.9,147K,"The slave Spartacus survives brutal training as a gladiator and leads a violent revolt against the decadent Roman Republic, as the ambitious Crassus seeks to gain power by crushing the uprising."
5. Breathless,https://www.imdb.com/title/tt0053472/?ref_=sr_t_5,1960,1h 30m,Not Rated,7.7,90K,"A small-time crook, hunted by the authorities for a car theft and the murder of a police officer, attempts to persuade a hip American journalism student to run away with him to Italy."
6. Mughal-E-Azam,https://www.imdb.com/title/tt0054098/?ref_=sr_t_6,1960,3h 17m,Not Rated,8.1,9.1K,A 16th century prince falls in love with a court dancer and battles with his emperor father.
7. The Big Risk,https://www.imdb.com/title/tt0052698/?ref_=sr_t_7,1960,1h 43m,Not Rated,7.5,4.7K,"A ruthless criminal flees from the pursuit, involving more and more casualties."
8. Eyes Without a Face,https://www.imdb.com/title/tt0053459/?ref_=sr_t_8,1960,1h 30m,Approved,7.6,37K,A surgeon causes an accident which leaves his daughter disfigured and goes to extreme lengths to give her a new face.
9. The Bad Sleep Well,https://www.imdb.com/title/tt0054460/?ref_=sr_t_9,1960,2h 31m,Not Rated,8.0,15K,A vengeful young man marries the daughter of a corrupt industrialist in order to seek justice for his father's suicide.
10. Peeping Tom,https://www.imdb.com/title/tt0054167/?ref_=sr_t_10,1960,1h 41m,Not Rated,7.6,42K,"A young man murders women, using a movie camera to film their dying expressions of terror."
11. The Hole,https://www.imdb.com/title/tt0054407/?ref_=sr_t_11,1960,2h 11m,Not Rated,8.5,22K,Distrust and uncertainty arise when four long-term inmates cautiously induct a new prisoner into their elaborate prison-break scheme.
12. The Passionate Thief,https://www.imdb.com/title/tt0054242/?ref_=sr_t_12,1960,1h 46m,,7.3,971,"Tortorella tries to spend New Year's Eve with her wealthy friends, but ends up with an actor in decay and a pickpocket."
13. Shoot the Piano Player,https://www.imdb.com/title/tt0054389/?ref_=sr_t_13,1960,1h 32m,Not Rated,7.4,21K,"A pianist helps his brother escape from two gangsters, who retaliate by abducting their kid brother."
14. The Pusher,https://www.imdb.com/title/tt0054219/?ref_=sr_t_14,1960,1h 21m,Not Rated,6.2,172,"A detective investigating the murder of a heroin addict discovers that there is a connection between the junkie and his fiancee, who is his boss' daughter."
15. The Magnificent Seven,https://www.imdb.com/title/tt0054047/?ref_=sr_t_15,1960,2h 8m,Approved,7.7,106K,Seven gunfighters are hired by Mexican peasants to liberate their village from oppressive bandits.
16. La Dolce Vita,https://www.imdb.com/title/tt0053779/?ref_=sr_t_16,1960,2h 54m,Not Rated,8.0,82K,A series of stories following a week in the life of a philandering tabloid journalist living in Rome.
17. Ocean's Eleven,https://www.imdb.com/title/tt0054135/?ref_=sr_t_17,1960,2h 7m,Approved,6.5,26K,Danny Ocean gathers a group of his World War II compatriots to pull off the ultimate Las Vegas heist. Together the eleven friends plan to rob five Las Vegas casinos in one night.
18. The Time Machine,https://www.imdb.com/title/tt0054387/?ref_=sr_t_18,1960,1h 43m,G,7.5,46K,A man's vision for a utopian society is disillusioned when travelling forward into time reveals a dark and dangerous society.
19. Purple Noon,https://www.imdb.com/title/tt0054189/?ref_=sr_t_19,1960,1h 58m,PG-13,7.7,22K,"Tom Ripley is a talented mimic, moocher, forger and all-around criminal improviser; but there's more to Tom Ripley than even he can guess."
20. Exodus,https://www.imdb.com/title/tt0053804/?ref_=sr_t_20,1960,3h 28m,Approved,6.7,12K,"The State of Israel is created in 1948, resulting in war with its Arab neighbors."
21. Inherit the Wind,https://www.imdb.com/title/tt0053946/?ref_=sr_t_21,1960,2h 8m,Approved,8.1,34K,"Based on a real-life case in 1925; two great lawyers argue the case for, and against, a Tennessee science teacher accused of the crime of teaching Darwin's theory of evolution."
22. First Spaceship on Venus,https://www.imdb.com/title/tt0053250/?ref_=sr_t_22,1960,1h 19m,Unrated,4.7,3.3K,"When an alien artifact discovered on Earth is found to have come from Venus, an international team of astronauts embarks to investigate its origins."
23. The Little Shop of Horrors,https://www.imdb.com/title/tt0054033/?ref_=sr_t_23,1960,1h 13m,Not Rated,6.2,20K,"A clumsy young man working at an impoverished flower shop discovers that the strange plant he has been nurturing has an insatiable appetite for blood, forcing him to kill to feed it."
24. The Unforgiven,https://www.imdb.com/title/tt0054428/?ref_=sr_t_24,1960,2h 5m,Approved,6.6,10K,The neighbors of a frontier family turn on them when it is suspected that their adopted daughter was stolen from the local Kiowa tribe.
25. The Alamo,https://www.imdb.com/title/tt0053580/?ref_=sr_t_25,1960,2h 42m,Approved,6.8,18K,"In 1836, a small band of soldiers sacrifice their lives in hopeless combat against a massive army in order to prevent a tyrant from smashing the new Republic of Texas."
26. L'Avventura,https://www.imdb.com/title/tt0053619/?ref_=sr_t_26,1960,2h 24m,Not Rated,7.7,35K,"A woman disappears during a Mediterranean boating trip. During the search, her lover and her best friend become attracted to each other."
27. Pollyanna,https://www.imdb.com/title/tt0054195/?ref_=sr_t_27,1960,2h 14m,G,7.4,12K,A young girl comes to an embittered town and confronts its attitude with her determination to see the best in life.
28. Rocco and His Brothers,https://www.imdb.com/title/tt0054248/?ref_=sr_t_28,1960,2h 59m,Not Rated,8.2,24K,"Having recently been uprooted to Milan, Rocco and his four brothers each look for a new way in life when a prostitute comes between Rocco and his brother Simone."
29. Elmer Gantry,https://www.imdb.com/title/tt0053793/?ref_=sr_t_29,1960,2h 26m,Approved,7.7,13K,"A fast-talking traveling salesman with a charming, loquacious manner convinces a sincere evangelist that he can be an effective preacher for her cause."
30. The Virgin Spring,https://www.imdb.com/title/tt0053976/?ref_=sr_t_30,1960,1h 29m,Not Rated,8.0,32K,"In 14th-century Sweden, an innocent yet pampered teenage girl and her family's pregnant and jealous servant set out from their farm to deliver candles to church, but only one returns from events that transpire in the woods along the way."
31. Black Sunday,https://www.imdb.com/title/tt0054067/?ref_=sr_t_31,1960,1h 27m,Approved,7.1,19K,"Decades after being executed for witchcraft, vengeful Princess Asa Vajda and her fiendish servant are resurrected and begin a bloody campaign to possess the body of Asa Vajda's beautiful look-alike descendant Princess Katia."
32. Two Women,https://www.imdb.com/title/tt0054749/?ref_=sr_t_32,1960,1h 41m,Not Rated,7.7,13K,"In WWII Italy, a widow and her lonely daughter seek distance between themselves and the horrors of war."
33. Cimarron,https://www.imdb.com/title/tt0053715/?ref_=sr_t_33,1960,2h 27m,Approved,6.4,3.6K,"The Oklahoma Land Run of April 1889 sets the stage for an epic saga of a frontier adventurer, his wife and family and their friends."
34. Sink the Bismarck!,https://www.imdb.com/title/tt0054310/?ref_=sr_t_34,1960,1h 37m,Approved,7.2,8.6K,The World War II story of the Royal Navy's effort to defeat Nazi Germany's most powerful warship.
35. House of Usher,https://www.imdb.com/title/tt0053925/?ref_=sr_t_35,1960,1h 19m,Approved,6.9,16K,"Upon entering his fiancée's family mansion, a man discovers a savage family curse and fears that his future brother-in-law has entombed his bride-to-be prematurely."
36. The Fugitive Kind,https://www.imdb.com/title/tt0052832/?ref_=sr_t_36,1960,1h 59m,Approved,7.1,7.5K,A guitar-playing drifter wanders into a small Mississippi town and inflames two troubled women.
37. The Brides of Dracula,https://www.imdb.com/title/tt0053677/?ref_=sr_t_37,1960,1h 25m,Approved,6.6,9.4K,"Vampire hunter Dr. Van Helsing returns to Transylvania to destroy handsome bloodsucker Baron Meinster, who has designs on a beautiful young schoolteacher."
38. 13 Ghosts,https://www.imdb.com/title/tt0053559/?ref_=sr_t_38,1960,1h 25m,Approved,6.0,7.7K,A family inherits a house with 12 ghosts who want a 13th.
39. Sergeant Rutledge,https://www.imdb.com/title/tt0054292/?ref_=sr_t_39,1960,1h 51m,Approved,7.4,5.6K,"A respected black cavalry sergeant stands court-martial after being accused of raping and killing a white woman as well as murdering her father, his superior officer."
40. Village of the Damned,https://www.imdb.com/title/tt0054443/?ref_=sr_t_40,1960,1h 17m,Approved,7.3,20K,"In the English village of Midwich, the blonde-haired, glowing-eyed children of uncertain paternity prove to have frightening powers."
41. Circus of Horrors,https://www.imdb.com/title/tt0053717/?ref_=sr_t_41,1960,1h 28m,Approved,6.0,2.6K,"Dr. Rossiter, a plastic surgeon wanted by the police, flees to France and under an assumed name acquires, by murder, a run-down circus. His first recruit is a woman criminal. He transforms her face by surgery and trains her."
42. The Story of Ruth,https://www.imdb.com/title/tt0054343/?ref_=sr_t_42,1960,2h 12m,Approved,6.7,1.5K,"Inspired by the scriptural tale. Moabitess priestess Ruth is drawn both to a Judean man and to his talk of a forgiving God. After tragedy strikes, she begins a new life in Bethlehem."
43. The Lost World,https://www.imdb.com/title/tt0054038/?ref_=sr_t_43,1960,1h 37m,Approved,5.5,4.6K,Professor Challenger leads an expedition of scientists and adventurers to a remote plateau deep in the Amazonian jungle to verify his claim that dinosaurs still live there.
44. North to Alaska,https://www.imdb.com/title/tt0054127/?ref_=sr_t_44,1960,2h 2m,Approved,6.9,8.8K,"During the Alaska gold rush, prospector George sends partner Sam to Seattle to bring his fiancée but when it turns out that she married another man, Sam returns with a pretty substitute, the hostess of the Henhouse dance hall."
45. The Leech Woman,https://www.imdb.com/title/tt0054020/?ref_=sr_t_45,1960,1h 17m,Approved,4.8,2.4K,"An endocrinologist in a dysfunctional marriage with an aging, alcoholic wife journeys to Africa seeking a drug that will restore youth."
46. The Rise and Fall of Legs Diamond,https://www.imdb.com/title/tt0054243/?ref_=sr_t_46,1960,1h 41m,Approved,6.7,1.4K,Neo-noir about a small-time New York City criminal whose ambition is to become a big-time crime boss during the Prohibition era.
47. Never Take Candy from A Stranger,https://www.imdb.com/title/tt0054116/?ref_=sr_t_47,1960,1h 21m,Approved,7.4,2.1K,"In Canada, a British schoolmaster meets official resistance when he learns that his 9-year-old daughter has been the victim of the pedophile patriarch of the town's most powerful family."
48. The City of the Dead,https://www.imdb.com/title/tt0053719/?ref_=sr_t_48,1960,1h 16m,PG-13,6.7,9K,"A young college student arrives in a sleepy Massachusetts town to research witchcraft; during her stay at an eerie inn, she discovers a startling secret about the town and its inhabitants."
49. BUtterfield 8,https://www.imdb.com/title/tt0053622/?ref_=sr_t_49,1960,1h 49m,Not Rated,6.3,7.6K,"A beautiful New York model and socialite enjoys a very active night-life, but all things change when she falls for a married man and the consequences are tragic."
50. Where the Boys Are,https://www.imdb.com/title/tt0054469/?ref_=sr_t_50,1960,1h 39m,Approved,6.7,3.2K,"Four very different college girls drive to Fort Lauderdale, Florida for spring break and seek out various adventures and romance for themselves."
51. Let's Make Love,https://www.imdb.com/title/tt0054022/?ref_=sr_t_51,1960,1h 59m,Approved,6.4,8.3K,"When billionaire Jean-Marc Clement learns that he is to be satirized in an off-Broadway revue, he passes himself off as an actor playing him in order to get closer to the beautiful star of the show, Amanda Dell."
52. Midnight Lace,https://www.imdb.com/title/tt0054084/?ref_=sr_t_52,1960,1h 43m,Approved,6.7,6.2K,"In London, a recently-wed American woman's sanity comes into question after she claims to be the victim of a threatening stalker."
53. Saturday Night and Sunday Morning,https://www.imdb.com/title/tt0054269/?ref_=sr_t_53,1960,1h 29m,Approved,7.5,9.6K,"A rebellious, hard-living factory worker juggles relationships with two women, one of whom is married to another man but pregnant with his child."
54. The Wackiest Ship in the Army,https://www.imdb.com/title/tt0054453/?ref_=sr_t_54,1960,1h 39m,Approved,6.3,2.7K,"During WW2, Lt. Rip Crandall, who was a yachtsman before the war, takes command of the USS Echo, a sailing ship, for a secret mission in waters patrolled by Japanese warships."
55. The Gallant Hours,https://www.imdb.com/title/tt0053849/?ref_=sr_t_55,1960,1h 55m,Approved,7.1,2K,"A semi-documentary dramatization of five weeks in the life of Vice Admiral William F. ""Bull"" Halsey, Jr., from his assignment to command the U.S. naval operations in the South Pacific to the Allied victory at Guadalcanal."
56. Beyond the Time Barrier,https://www.imdb.com/title/tt0053651/?ref_=sr_t_56,1960,1h 14m,Not Rated,5.3,2.2K,"In 1960, a military test pilot is caught in a time warp that propels him to year 2024 where he finds a plague has sterilized the world's population."
57. The Housemaid,https://www.imdb.com/title/tt0150980/?ref_=sr_t_57,1960,1h 49m,Not Rated,7.2,6.2K,A composer and his wife are thrown into turmoil when a housemaid becomes more than they bargained for.
58. Tormented,https://www.imdb.com/title/tt0054393/?ref_=sr_t_58,1960,1h 15m,Approved,4.9,3.1K,"A man lets a former flame fall to her death rather than let her interfere with his new relationship, but her ghost returns to disrupt his impending nuptials."
59. Macario,https://www.imdb.com/title/tt0054042/?ref_=sr_t_59,1960,1h 31m,,8.3,4.7K,"Poor and hungry peasant Macario wishes to have a good meal for All Saint's Day. After his wife cooks him a turkey he has three apparitions: The Devil, God, and the Death."
60. The Sinners of Hell,https://www.imdb.com/title/tt0154683/?ref_=sr_t_60,1960,1h 41m,Not Rated,6.8,4.8K,"A group of sinners involved in interconnected tales of murder, revenge, deceit and adultery all meet at the Gates of Hell."
61. Hideout in the Sun,https://www.imdb.com/title/tt0053908/?ref_=sr_t_61,1960,1h 10m,TV-MA,4.5,478,"Two brothers rob a bank and take a young girl hostage. They find out that the girl is a nudist, so they force her to take them to a nudist colony so they can hide out."
"62. Murder, Inc.",https://www.imdb.com/title/tt0054102/?ref_=sr_t_62,1960,1h 43m,Approved,6.6,1.7K,"The rise and fall of a 1930's Brooklyn crime syndicate, known as Murder Incorporated, led by mobster Lepke Buchalter."
63. Holiday in Spain,https://www.imdb.com/title/tt0054271/?ref_=sr_t_63,1960,2h 5m,Not Rated,5.5,444,Vacationing Englishman Oliver Larker stumbles upon a plot to kill a young American tourist in Spain.
64. Kapo,https://www.imdb.com/title/tt0052961/?ref_=sr_t_64,1960,1h 56m,,7.6,2.7K,A young Jewish girl leads an escape attempt from a concentration camp.
65. The Truth,https://www.imdb.com/title/tt0054452/?ref_=sr_t_65,1960,2h 7m,Not Rated,7.6,4.8K,A liberated small-town girl stands on trial to determine whether she killed her lover in a crime of passion or in premeditation.
66. Tunes of Glory,https://www.imdb.com/title/tt0054412/?ref_=sr_t_66,1960,1h 46m,Not Rated,7.5,4.8K,"After World War II, a Highland Regiment's acting Commanding Officer, who rose from the ranks, is replaced by a peace-time Oxford-educated Commanding Officer, leading to a dramatic conflict between the two."
67. Flaming Star,https://www.imdb.com/title/tt0053825/?ref_=sr_t_67,1960,1h 41m,Approved,6.5,4.2K,"When fighting breaks out between two cultures in West Texas, the mixed-blood Pacer tries to act as a peacemaker, but the ""flaming star of death"" pulls him irrevocably into the deadly violence."
68. G.I. Blues,https://www.imdb.com/title/tt0053848/?ref_=sr_t_68,1960,1h 44m,PG,6.2,4.6K,"Tulsa McLean, a soldier with dreams of running his own nightclub, places a bet with his friend Dynamite that he can win the heart of an untouchable dancer. But when Dynamite is transferred, Tulsa must replace him in the bet."
69. Playgirl After Dark,https://www.imdb.com/title/tt0053365/?ref_=sr_t_69,1960,1h 30m,,5.9,472,A French reporter working on a steamy story about the secret strip joints found in London's Soho district becomes involved in the lives of the owner and star of a famous club.
70. The Grass Is Greener,https://www.imdb.com/title/tt0053877/?ref_=sr_t_70,1960,1h 44m,Approved,6.4,6K,"Victor and Hilary have guided tours in their English mansion. A US oil tycoon ""bumps"" into Hilary during a tour and charms his way into her heart. Meanwhile, Hattie pursues Victor."
71. The League of Gentlemen,https://www.imdb.com/title/tt0052997/?ref_=sr_t_71,1960,1h 56m,Unrated,7.2,5.5K,A disgruntled veteran recruits a group of disgraced colleagues to perform a bank robbery with military precision.
72. Sons and Lovers,https://www.imdb.com/title/tt0054326/?ref_=sr_t_72,1960,1h 43m,Approved,7.1,1.8K,A young man with artistic talent lives in a close-knit coal-mining town and finds himself inhibited by his emotionally manipulative mother.
73. Letter Never Sent,https://www.imdb.com/title/tt0053106/?ref_=sr_t_73,1960,1h 36m,Not Rated,7.8,4.5K,Four geologists search for diamonds in the wilderness of Siberia.
74. The Entertainer,https://www.imdb.com/title/tt0053796/?ref_=sr_t_74,1960,1h 36m,Not Rated,7.1,3.9K,"Archie Rice, an old-time British music hall performer sinking into final defeat, schemes to stay in show business."
75. Sex Kittens Go to College,https://www.imdb.com/title/tt0054298/?ref_=sr_t_75,1960,1h 34m,Approved,3.8,672,A striptease dancer becomes the head of the science department.
76. Home from the Hill,https://www.imdb.com/title/tt0053917/?ref_=sr_t_76,1960,2h 30m,Approved,7.4,4K,Dramatic story of the influential Hunnicutt family set in Texas during the late 1950s.
77. All the Fine Young Cannibals,https://www.imdb.com/title/tt0053582/?ref_=sr_t_77,1960,1h 52m,,6.0,913,"Salome, pregnant by Chad, runs away from her rural-Texas home and marries wealthy Yale student Tony. Years later she runs into Chad, who is now a successful musician in New York."
78. It Started in Naples,https://www.imdb.com/title/tt0053957/?ref_=sr_t_78,1960,1h 40m,Approved,6.3,3.3K,"Days before his wedding, a Philadelphia lawyer travels to Naples in Southern Italy to settle the estate of his late brother, only to find that he has an Italian nephew who is being cared for by his maternal aunt, a cabaret singer."
"79. The 1,000 Eyes of Dr. Mabuse",https://www.imdb.com/title/tt0054371/?ref_=sr_t_79,1960,1h 43m,,6.9,4K,"In 1960s Germany, criminal mastermind Dr. Mabuse uses hypnotized victims and the surveillance equipment of a Nazi-era bugged hotel to steal nuclear technology from a visiting American industrialist."
80. The Millionairess,https://www.imdb.com/title/tt0054086/?ref_=sr_t_80,1960,1h 30m,Approved,5.4,2.1K,A millionairess and a doctor cannot marry until they meet conditions set up by their respective parents.
81. From the Terrace,https://www.imdb.com/title/tt0053841/?ref_=sr_t_81,1960,2h 29m,Approved,6.7,3.3K,An ambitious young executive chooses a loveless marriage and an unfulfilling personal life in exchange for a successful Wall Street career.
82. Never on Sunday,https://www.imdb.com/title/tt0054198/?ref_=sr_t_82,1960,1h 37m,Not Rated,7.3,6.3K,An American scholar in Greece sets about improving the prostitute with whom he is infatuated.
83. Comanche Station,https://www.imdb.com/title/tt0053729/?ref_=sr_t_83,1960,1h 13m,Approved,7.0,4.7K,"A man saves a woman who had been kidnapped by Comanches, then struggles to get both of them home alive."
84. Cinderfella,https://www.imdb.com/title/tt0053716/?ref_=sr_t_84,1960,1h 31m,Not Rated,5.9,3.9K,"A gender-swapped retelling of Charles Perrault's classic, where Cinderfella is visited by a fairy godfather to help him escape from his wicked stepmother and stepbrothers."
85. Zazie in the Metro,https://www.imdb.com/title/tt0054494/?ref_=sr_t_85,1960,1h 33m,Not Rated,6.9,7K,"With her mother away for the weekend, a brash and precocious ten-year-old country girl sets out to explore Paris during a Métro strike under her uncle's not-so-watchful eye. But can a little girl cause so much chaos in the city centre?"
86. Late Autumn,https://www.imdb.com/title/tt0053579/?ref_=sr_t_86,1960,2h 8m,Not Rated,7.9,6.4K,A widow tries to marry off her daughter with the help of her late husband's three friends.
87. Pepe,https://www.imdb.com/title/tt0054172/?ref_=sr_t_87,1960,3h,Unrated,5.4,1.2K,"The young Mexican Pepe's beloved horse is sold to Hollywood director Ted Holt, leading to Pepe's journey to Hollywood to get the horse back, and Pepe's encounter with half the stars working in Hollywood at the time."
88. Four Fast Guns,https://www.imdb.com/title/tt0052819/?ref_=sr_t_88,1960,1h 12m,Approved,6.1,290,"In 1873, the town of Purgatory hires a town-tamer, but the evil saloon owner hires three gunfighters to kill him."
89. Dinosaurus!,https://www.imdb.com/title/tt0053768/?ref_=sr_t_89,1960,1h 23m,Approved,4.9,1.9K,"After undersea explosions near a Caribbean island, prehistoric creatures are unleashed on the population. A boy teams up with a Neanderthal and an irritated dinosaur try to stop the dinosaurs."
90. The Adventures of Huckleberry Finn,https://www.imdb.com/title/tt0053571/?ref_=sr_t_90,1960,1h 47m,Approved,6.2,1.6K,"Mark Twain's 1851 story about two runaway friends, a fostered white boy and an escaped black slave, who sailed on a raft down the Mississippi River in search of freedom and adventure."
91. Can-Can,https://www.imdb.com/title/tt0053690/?ref_=sr_t_91,1960,2h 11m,Approved,6.3,2.6K,"In 1896 Paris, a female nightclub proprietor fights against the forces of public morality for the right to feature her performers doing the risqué dance, the Can-Can."
92. Let No Man Write My Epitaph,https://www.imdb.com/title/tt0054021/?ref_=sr_t_92,1960,1h 45m,Approved,7.0,680,"In this sequel to ""Knock On Any Door"", the residents of a Chicago tenement building band together to insure that the son of Nick Romano does not follow in his father's footsteps...to the electric chair."
93. The World of Suzie Wong,https://www.imdb.com/title/tt0054483/?ref_=sr_t_93,1960,2h 6m,Approved,6.9,2.8K,A businessman moves to Hong Kong to pursue a career as an artist and falls in love with a prostitute he hires as a model.
94. Please Don't Eat the Daisies,https://www.imdb.com/title/tt0054188/?ref_=sr_t_94,1960,1h 52m,Approved,6.4,5.1K,Drama professor turned theater critic balances his home life and career when he moves to the country with his wife and their four sons.
95. The Sundowners,https://www.imdb.com/title/tt0054353/?ref_=sr_t_95,1960,2h 13m,Approved,7.1,5K,"In Australia's Outback during the early twentieth century, the impoverished Carmody family lives a nomadic life out of their wagon, but the mom and son want to settle, while the dad is against it."
96. Strangers When We Meet,https://www.imdb.com/title/tt0054345/?ref_=sr_t_96,1960,1h 57m,Approved,7.1,2.8K,"A suburban architect loves his wife but is bored with his marriage and with his work, so he takes up with the neglected, married beauty who lives down the street."
97. Wild for Kicks,https://www.imdb.com/title/tt0055779/?ref_=sr_t_97,1960,1h 23m,Not Rated,5.9,1.3K,An impetuous teenage girl becomes involved with Soho's beatnik and striptease scenes to spite her staid architect father and her French ex-stripper stepmother.
98. The Private Lives of Adam and Eve,https://www.imdb.com/title/tt0055328/?ref_=sr_t_98,1960,1h 26m,Approved,4.3,194,"Eight travelers on a bus to Reno Nevada have to stop overnight, where they have a dream about the Garden of Eden."
99. Hell to Eternity,https://www.imdb.com/title/tt0053901/?ref_=sr_t_99,1960,2h 11m,Approved,6.9,1.7K,"When his adoptive Japanese-American family is sent to Manzanar after Pearl Harbor, a young Chicano enlists in the marines to become a hero in the Battle of Saipan."
100. The Two Faces of Dr. Jekyll,https://www.imdb.com/title/tt0054416/?ref_=sr_t_100,1960,1h 28m,Approved,6.3,3.6K,"Dr. Henry Jekyll experiments with scientific means of revealing the hidden, dark side of man and releases a murderer from within himself."
