Title,Movie Link,Year,Duration,MPA,Rating,Votes,Description
96. Demon Slayer: Kimetsu No Yaiba - To the Swordsmith Village,https://www.imdb.com/title/tt26537229/?ref_=sr_t_96,2023,1h 50m,R,7.6,14K,"Tanjiro needs to bring a definitive end to Upper Rank Six. After the dust settles, he goes with his sister Nezuko to the Swordsmith Village in search of a new sword."
97. Late Night with the Devil,https://www.imdb.com/title/tt14966898/?ref_=sr_t_97,2023,1h 33m,R,7.0,116K,"A live television broadcast in 1977 goes horribly wrong, unleashing evil into the nation's living rooms."
98. House Party,https://www.imdb.com/title/tt8005118/?ref_=sr_t_98,2023,1h 40m,R,4.4,4.6K,"From New Line Cinema comes your VIP ticket into the hottest event of the year:""House Party,"" the remix to the fan-favorite '90s classic."
99. Salaar,https://www.imdb.com/title/tt13927994/?ref_=sr_t_99,2023,2h 55m,Not Rated,6.6,74K,"The fate of a violently contested kingdom hangs on the fraught bond between two friends-turned-foes in this saga of power, bloodshed and betrayal."
100. Radical,https://www.imdb.com/title/tt14570440/?ref_=sr_t_100,2023,2h 5m,PG-13,7.8,6.4K,"A teacher in a Mexican border town full of neglect, corruption, and violence, tries a radical new method to unlock their students' curiosity, potential - and maybe even their genius."
