Title,Movie Link,Year,Duration,MPA,Rating,Votes,Description,budget,grossWorldWide,gross_US_Canada,opening_weekend_Gross,directors,writers,stars,genres,countries_origin,filming_locations,production_companies,Languages,wins,nominations,oscars,release_date
76. Pathaan,https://www.imdb.com/title/tt12844910/?ref_=sr_t_76,2023,2h 26m,Not Rated,5.8,160K,"An Indian agent races against a doomsday clock as a ruthless mercenary, with a bitter vendetta, mounts an apocalyptic attack against the country.",,112583450,17487476,6892182,['Siddharth Anand'],"['Shridhar Raghavan', 'Abbas Tyrewala', 'Siddharth Anand']","['Shah Rukh Khan', 'Deepika Padukone', 'John Abraham']","['Action Epic', 'Globetrotting Adventure', 'Spy', 'Action', 'Adventure', 'Thriller']",['India'],"['Dubai, United Arab Emirates']",['Yash Raj Films'],['Hindi'],11,52,0,2023
77. Renfield,https://www.imdb.com/title/tt11358390/?ref_=sr_t_77,2023,1h 33m,R,6.4,108K,"Renfield, Dracula's tortured henchman, is forced to capture prey for his master and do his every bidding. But now, after centuries of servitude, Renfield is ready to see if there is a life outside his boss's shadow.",65000000.0,26493921,17297895,8026475,['Chris McKay'],"['Ryan Ridley', 'Robert Kirkman', 'Ava Tramer']","['Nicholas Hoult', 'Nicolas Cage', 'Awkwafina']","['Dark Comedy', 'Splatter Horror', 'Vampire Horror', 'Action', 'Comedy', 'Fantasy', 'Horror']","['United States', 'United Kingdom', 'Canada']","['New Orleans, Louisiana, USA']","['Universal Pictures', 'Skybound Entertainment']","['English', 'French']",2,12,0,2023
78. The Blind,https://www.imdb.com/title/tt16374352/?ref_=sr_t_78,2023,1h 48m,PG-13,6.2,2.4K,"Long before Phil Robertson was a reality-TV star, he fell in love and started a family, but his demons threatened to tear their lives apart. This is the true story that started a dynasty.",,17265876,17265487,4341725,['Andrew Hyatt'],"['Zach Dasher', 'Stephanie Katz', 'Andrew Hyatt']","['Aron von Andrian', 'Matthew Erick White', 'Ronan Carroll']",['Drama'],['United States'],"['Shreveport, Louisiana, USA']","['GND Media Group', 'Stacey Films', 'Tread Lively']",['English'],0,2,0,2023
79. Guy Ritchie's the Covenant,https://www.imdb.com/title/tt4873118/?ref_=sr_t_79,2023,2h 3m,R,7.5,184K,"During the war in Afghanistan, a local interpreter risks his own life to carry an injured sergeant across miles of grueling terrain.",55000000.0,21948551,16938039,6380188,['Guy Ritchie'],"['Guy Ritchie', 'Ivan Atkinson', 'Marn Davies']","['Jake Gyllenhaal', 'Dar Salim', 'Sean Sagar']","['Action Epic', 'Action', 'Drama', 'Thriller', 'War']","['United Kingdom', 'Spain', 'United States']","['Alicante, Comunidad Valenciana, Spain']","['STX Films', 'Toff Guy Films']","['English', 'Dari']",0,3,0,2023
80. The Expendables 4,https://www.imdb.com/title/tt3291150/?ref_=sr_t_80,2023,1h 43m,R,4.8,48K,"Armed with every weapon they can get their hands on, the Expendables are the world's last line of defense and the team that gets called when all other options are off the table.",100000000.0,37917985,16710153,8039021,['Scott Waugh'],"['Kurt Wimmer', 'Tad Daggerhart', 'Max Adams']","['Jason Statham', '50 Cent', 'Megan Fox']","['Action Epic', 'Action', 'Adventure', 'Thriller', 'War']",['United States'],['Greece'],"['Campbell Grobman Films', 'Media Capital Technologies', 'Millennium Films']","['English', 'Arabic', 'Bulgarian', 'Vietnamese', 'Spanish', 'Thai']",2,7,0,2023
81. Champions,https://www.imdb.com/title/tt15339570/?ref_=sr_t_81,2023,2h 4m,PG-13,6.8,31K,"A former minor-league basketball coach is ordered by the court to manage a team of players with intellectual disabilities. He soon realizes that despite his doubts, together, this team can go further than they ever imagined.",,21873780,16397335,5148740,['Bobby Farrelly'],"['Mark Rizzo', 'Javier Fesser', 'David Marqués']","['Woody Harrelson', 'Kaitlin Olson', 'Matt Cook']","['Basketball', 'Comedy', 'Drama', 'Sport']",['United States'],"['Winnipeg, Manitoba, Canada']","['Gold Circle Films', 'Seven Deuce Entertainment']",['English'],2,3,0,2023
82. Ruby Gillman: Teenage Kraken,https://www.imdb.com/title/tt27155038/?ref_=sr_t_82,2023,1h 31m,PG,5.7,12K,"A shy 16-year-old girl learns that she comes from a fabled royal family of legendary sea krakens and that her destiny lies in the depths of the waters, which is bigger than she could have ever imagined.",70000000.0,45657745,15753600,5500990,"['Kirk DeMicco', 'Faryn Pearl']","['Pam Brady', 'Brian C. Brown', 'Elliott DiGuiseppi']","['Jane Fonda', 'Lana Condor', 'Toni Collette']","['Computer Animation', 'Teen Comedy', 'Teen Drama', 'Teen Romance', 'Animation', 'Comedy', 'Romance']",['United States'],"['Dreamworks SKG, 1000 Flower St, Glendale, California, USA']","['DreamWorks Animation', 'Mike Mitchell Productions', 'Universal Pictures']",['English'],0,3,0,2023
83. Jawan,https://www.imdb.com/title/tt15354916/?ref_=sr_t_83,2023,2h 49m,Not Rated,6.9,104K,A prison warden recruits inmates to commit outrageous crimes that shed light on corruption and injustice - and that lead him to an unexpected reunion.,3500000000.0,28499044,15198530,6124963,['Atlee'],"['Atlee', 'Ramanagirivasan', 'Sumit Arora']","['Shah Rukh Khan', 'Nayanthara', 'Vijay Sethupathi']","['Action Epic', 'One-Person Army Action', 'Action', 'Crime', 'Drama', 'Thriller']",['India'],"['Mumbai, Maharashtra, India']","['Red Chillies Entertainment', 'Red Chillies Entertainment']",['Hindi'],24,52,0,2023
84. Animal,https://www.imdb.com/title/tt13751694/?ref_=sr_t_84,2023,3h 24m,Not Rated,6.1,104K,The hardened son of a powerful industrialist returns home after years abroad and vows to take bloody revenge on those threatening his father's life.,,92870950,15004482,6524534,['Sandeep Reddy Vanga'],"['Suresh Bandaru', 'Saurabh Gupta', 'Pranay Reddy Vanga']","['Ranbir Kapoor', 'Anil Kapoor', 'Bobby Deol']","['One-Person Army Action', 'Action', 'Crime', 'Drama', 'Thriller']",['India'],"['Pataudi Palace, Gurugram, Haryana, India']","['Bhadrakali Pictures', 'Cars on Film', 'Cine1 Studios']",['Hindi'],34,54,0,2023
85. Dumb Money,https://www.imdb.com/title/tt13957560/?ref_=sr_t_85,2023,1h 45m,R,6.9,55K,"A regular guy sinks his life savings into the stock of videogame store GameStop and starts posting about it. When his social posts start blowing up and a stock tip becomes a movement, everyone gets rich, until the billionaires fight back.",30000000.0,20703794,13925356,220947,['Craig Gillespie'],"['Lauren Schuker Blum', 'Rebecca Angelo', 'Ben Mezrich']","['Paul Dano', 'Pete Davidson', ""Vincent D'Onofrio""]","['Docudrama', 'Biography', 'Comedy', 'Drama', 'Financial Drama']",['United States'],"['Jersey City, New Jersey, USA']","['Black Bear', 'Columbia Pictures', 'Ryder Picture Company']",['English'],0,2,0,2023
86. The Last Voyage of the Demeter,https://www.imdb.com/title/tt1001520/?ref_=sr_t_86,2023,1h 58m,R,6.1,61K,A crew sailing from Varna (Bulgaria) by the Black Sea to England find that they are carrying very dangerous cargo.,45000000.0,21786275,13637180,6504950,['André Øvredal'],"['Bram Stoker', 'Bragi F. Schut', 'Zak Olkewicz']","['Corey Hawkins', 'Aisling Franciosi', 'Liam Cunningham']","['Dark Fantasy', 'Supernatural Horror', 'Vampire Horror', 'Fantasy', 'Horror', 'Thriller']","['United States', 'United Kingdom', 'Canada', 'India', 'Germany']","['Berlin, Germany']","['Dreamworks Pictures', 'Reliance Entertainment', 'Storyworks Productions']",['English'],2,10,0,2023
87. Joy Ride,https://www.imdb.com/title/tt15268244/?ref_=sr_t_87,2023,1h 35m,R,6.4,26K,"Follows four Asian American friends as they bond and discover the truth of what it means to know and love who you are, while they travel through China in search of one of their birth mothers.",,15787674,12897789,5806277,['Adele Lim'],"['Cherry Chevapravatdumrong', 'Teresa Hsiao', 'Adele Lim']","['Ashley Park', 'Sherry Cola', 'Stephanie Hsu']","['Raunchy Comedy', 'Comedy']",['United States'],"['Dr. Sun Yat-Sen Classical Chinese Garden, 578 Carrall St, Vancouver, Canada']","['Lionsgate', 'Point Grey Pictures']",['English'],2,17,0,2023
88. His Only Son,https://www.imdb.com/title/tt8277246/?ref_=sr_t_88,2023,1h 46m,PG-13,5.9,2.7K,"After being called on by the Lord, Abraham's faith is tested on his three day journey to sacrifice his son.",250000.0,13817186,12392740,5501070,['David Helling'],['David Helling'],"['Daniel da Silva', 'Nicolas Mouawad', 'Sara Seyed']","['Drama', 'History']",['United States'],[],"['Commissioned Pictures', 'RockBridge Productions']",['English'],0,0,0,2023
89. The Shift,https://www.imdb.com/title/tt19406606/?ref_=sr_t_89,2023,1h 55m,PG-13,5.5,5.7K,"After meeting a mysterious stranger, a man must escape a dystopian world to return to his wife.",,12238643,12118219,4300165,['Brock Heasley'],['Brock Heasley'],"['Kristoffer Polaha', 'Neal McDonough', 'Elizabeth Tabish']","['Action', 'Romance', 'Sci-Fi', 'Thriller']",['United States'],"['Birmingham, Alabama, USA']","['Nook Lane Entertainment', 'Pinnacle Peak Pictures', 'Salt Shaker Media']",['English'],2,0,0,2023
90. About My Father,https://www.imdb.com/title/tt8373206/?ref_=sr_t_90,2023,1h 30m,PG-13,5.7,15K,"When Sebastian tells his old-school Italian immigrant father Salvo that he is going to propose to his all-American girlfriend, Salvo insists on crashing a weekend with her parents.",30000000.0,18167819,12089391,4321148,['Laura Terruso'],"['Austen Earl', 'Sebastian Maniscalco']","['Robert De Niro', 'Sebastian Maniscalco', 'Leslie Bibb']",['Comedy'],['United States'],"['Mobile, Alabama, USA']","['Lionsgate', 'Media Capital Technologies', 'Depth of Field']","['English', 'Italian']",0,0,0,2023
91. Bottoms,https://www.imdb.com/title/tt17527468/?ref_=sr_t_91,2023,1h 31m,R,6.7,51K,Two unpopular queer high-school students start a fight club to have sex before graduation.,,12976079,12036071,461052,['Emma Seligman'],"['Emma Seligman', 'Rachel Sennott']","['Rachel Sennott', 'Ayo Edebiri', 'Ruby Cruz']","['Dark Comedy', 'High-Concept Comedy', 'Raunchy Comedy', 'Satire', 'Teen Comedy', 'Comedy']",['United States'],"['New Orleans, Louisiana, USA']","['Orion Pictures', 'Brownstone Productions (II)']",['English'],5,24,0,2023
92. After Death,https://www.imdb.com/title/tt21191906/?ref_=sr_t_92,2023,1h 48m,PG-13,6.3,1.8K,"Based on real near-death experiences, After Death explores the afterlife with the guidance of New York Times bestselling authors, medical experts, scientists, and survivors that shed a light on what awaits us.",,11830860,11478326,5051950,"['Stephen Gray', 'Chris Radtke']",['Stephen Gray'],"['Dale Black', 'Dean Braxton', 'John Burke']",['Documentary'],['United States'],"['Los Angeles, California, USA']","['G8 Entertainment', 'Sypher Studios', 'Theora Films']",['English'],0,2,0,2023
93. Saltburn,https://www.imdb.com/title/tt17351924/?ref_=sr_t_93,2023,2h 11m,R,7.0,239K,"A student at Oxford University finds himself drawn into the world of a charming and aristocratic classmate, who invites him to his eccentric family's sprawling estate for a summer never to be forgotten.",,21026167,11425829,322651,['Emerald Fennell'],['Emerald Fennell'],"['Barry Keoghan', 'Jacob Elordi', 'Rosamund Pike']","['Dark Comedy', 'Psychological Drama', 'Psychological Thriller', 'Drama', 'Thriller']","['United Kingdom', 'United States']","['Drayton House, Lowick, Kettering, Northamptonshire, England, UK']","['Amazon MGM Studios', 'Lie Still', 'LuckyChap']",['English'],15,108,0,2023
94. Past Lives,https://www.imdb.com/title/tt13238346/?ref_=sr_t_94,2023,1h 45m,PG-13,7.8,145K,"Nora and Hae Sung, two deeply connected childhood friends, are wrested apart after Nora's family emigrates from South Korea. Twenty years later, they are reunited for one fateful week as they confront notions of love and destiny.",12000000.0,42530801,11185625,232266,['Celine Song'],['Celine Song'],"['Greta Lee', 'Teo Yoo', 'John Magaro']","['Korean Drama', 'Drama', 'Romance']","['United States', 'South Korea']","['Madison Square Park, Manhattan, New York City, New York, USA']","['A24', 'CJ ENM Co.', 'Killer Films']","['Korean', 'English', 'Mandarin', 'French']",82,239,2,2023
95. The Machine,https://www.imdb.com/title/tt11040844/?ref_=sr_t_95,2023,1h 52m,R,5.7,17K,Bert's drunken past catches up with him 20 years down the road when he and his father are kidnapped by those Bert wronged 20 years ago while drunk on a college semester abroad in Russia.,20000000.0,10664328,10458331,5000545,['Peter Atencio'],"['Bert Kreischer', 'Kevin Biegel', 'Scotty Landes']","['Bert Kreischer', 'Mark Hamill', 'Jimmy Tatro']","['Action', 'Comedy']","['United States', 'Serbia']","['Belgrade, Serbia']","['Screen Gems', 'Shaken Not Stirred', 'Balkanic Media']",['English'],0,0,0,2023
96. Demon Slayer: Kimetsu No Yaiba - To the Swordsmith Village,https://www.imdb.com/title/tt26537229/?ref_=sr_t_96,2023,1h 50m,R,7.6,14K,"Tanjiro needs to bring a definitive end to Upper Rank Six. After the dust settles, he goes with his sister Nezuko to the Swordsmith Village in search of a new sword.",,56319794,10117806,10117806,['Haruo Sotozaki'],['Koyoharu Gotouge'],"['Zach Aguilar', 'Laila Berzins', 'Kira Buckland']","['Anime', 'Action', 'Adventure', 'Animation', 'Fantasy', 'Thriller']",['Japan'],[],"['Shueisha', 'Aniplex', 'Ufotable']",['Japanese'],0,0,0,2023
97. Late Night with the Devil,https://www.imdb.com/title/tt14966898/?ref_=sr_t_97,2023,1h 33m,R,7.0,116K,"A live television broadcast in 1977 goes horribly wrong, unleashing evil into the nation's living rooms.",,15469415,10001000,2834867,"['Cameron Cairnes', 'Colin Cairnes']","['Colin Cairnes', 'Cameron Cairnes']","['David Dastmalchian', 'Laura Gordon', 'Ian Bliss']","['Found Footage Horror', 'Supernatural Horror', 'Horror']","['Australia', 'United Arab Emirates', 'United States']","['Docklands Studios, Melbourne, Victoria, Australia']","['Future Pictures', 'IFC Films', 'Shudder']",['English'],8,32,0,2023
98. House Party,https://www.imdb.com/title/tt8005118/?ref_=sr_t_98,2023,1h 40m,R,4.4,4.6K,"From New Line Cinema comes your VIP ticket into the hottest event of the year:""House Party,"" the remix to the fan-favorite '90s classic.",,9285747,9002247,3985882,['Calmatic'],"['Jamal Olori', 'Stephen Glover']","['Jacob Latimore', 'Tosin Cole', 'Karen Obilom']",['Comedy'],['United States'],"['Atlanta, Georgia, USA']","['New Line Cinema', 'SpringHill Entertainment', 'Warner Bros.']",['English'],0,0,0,2023
99. Salaar,https://www.imdb.com/title/tt13927994/?ref_=sr_t_99,2023,2h 55m,Not Rated,6.6,74K,"The fate of a violently contested kingdom hangs on the fraught bond between two friends-turned-foes in this saga of power, bloodshed and betrayal.",,11958548,8929282,5618511,['Prashanth Neel'],"['Sandeep Reddy Bandla', 'Manish Bhavan', 'Choudary Hanuman']","['Prabhas', 'Karthikeya Dev', 'Prithviraj Sukumaran']","['Action Epic', 'Epic', 'One-Person Army Action', 'Action', 'Crime', 'Drama', 'Thriller']",['India'],"['Hyderabad, Telangana, India']",['Hombale Films'],['Telugu'],2,10,0,2023
100. Radical,https://www.imdb.com/title/tt14570440/?ref_=sr_t_100,2023,2h 5m,PG-13,7.8,6.4K,"A teacher in a Mexican border town full of neglect, corruption, and violence, tries a radical new method to unlock their students' curiosity, potential - and maybe even their genius.",,21830921,8702731,2658047,['Christopher Zalla'],"['Christopher Zalla', 'Joshua Davis']","['Eugenio Derbez', 'Daniel Haddad', 'Jennifer Trejo']",['Drama'],"['United States', 'Mexico']",[],"['3Pas Studios', 'EPIC Magazine', 'Pantelion Films']",['Spanish'],18,23,0,2023
