Title,Movie Link,Year,Duration,MPA,Rating,Votes,Description,budget,grossWorldWide,gross_US_Canada,opening_weekend_Gross,directors,writers,stars,genres,countries_origin,filming_locations,production_companies,Languages,wins,nominations,oscars,release_date
1. Barbie,https://www.imdb.com/title/tt1517268/?ref_=sr_t_1,2023,1h 54m,PG-13,6.8,593K,"Barbie and Ken are having the time of their lives in the colorful and seemingly perfect world of Barbie Land. However, when they get a chance to go to the real world, they soon discover the joys and perils of living among humans.",100000000.0,1447038421,636238421,162022044,['Greta Gerwig'],"['Greta Gerwig', 'Noah Baumbach']","['Margot Robbie', 'Ryan Gosling', 'Issa Rae']","['High-Concept Comedy', 'Quirky Comedy', 'Satire', 'Adventure', 'Comedy', 'Fantasy']","['United States', 'United Kingdom']","['Venice Beach, Venice, Los Angeles, California, USA']","['Warner Bros.', 'Heyday Films', 'LuckyChap']","['English', 'Spanish']",208,437,1,2023
2. The Super Mario Bros. Movie,https://www.imdb.com/title/tt6718170/?ref_=sr_t_2,2023,1h 32m,PG,7.0,260K,"A plumber named Mario travels through an underground labyrinth with his brother Luigi, trying to save a captured princess.",100000000.0,1360847665,574934330,146361865,"['Aaron Horvath', 'Michael Jelenic', 'Pierre Leduc']",['Matthew Fogel'],"['Chris Pratt', 'Anya Taylor-Joy', 'Charlie Day']","['Adventure Epic', 'Computer Animation', 'Fantasy Epic', 'High-Concept Comedy', 'Quest', 'Slapstick', 'Adventure', 'Animation', 'Comedy', 'Family']","['United States', 'Japan', 'France']","['Paris, France']","['Universal Pictures', 'Nintendo', 'Illumination Entertainment']",['English'],2,48,0,2023
3. Spider-Man: Across the Spider-Verse,https://www.imdb.com/title/tt9362722/?ref_=sr_t_3,2023,2h 20m,PG,8.5,436K,"Traveling across the multiverse, Miles Morales meets a new team of Spider-People, made up of heroes from different dimensions. But when the heroes clash over how to deal with a new threat, Miles finds himself at a crossroads.",150000000.0,690824738,381593754,120663589,"['Joaquim Dos Santos', 'Kemp Powers', 'Justin K. Thompson']","['Phil Lord', 'Christopher Miller', 'Dave Callaham']","['Shameik Moore', 'Hailee Steinfeld', 'Brian Tyree Henry']","['Computer Animation', 'Superhero', 'Supernatural Fantasy', 'Teen Adventure', 'Urban Adventure', 'Action', 'Adventure', 'Animation', 'Family', 'Fantasy']",['United States'],[],"['Columbia Pictures', 'Marvel Entertainment', 'Avi Arad Productions']",['English'],106,165,1,2023
4. Guardians of the Galaxy Vol. 3,https://www.imdb.com/title/tt6791350/?ref_=sr_t_4,2023,2h 30m,PG-13,7.9,417K,"Still reeling from the loss of Gamora, Peter Quill rallies his team to defend the universe and one of their own - a mission that could mean the end of the Guardians if not successful.",250000000.0,845555777,358995815,118414021,['James Gunn'],"['James Gunn', 'Jim Starlin', 'Stan Lee']","['Chris Pratt', 'Chukwudi Iwuji', 'Bradley Cooper']","['Space Sci-Fi', 'Superhero', 'Action', 'Adventure', 'Comedy', 'Sci-Fi']","['United States', 'New Zealand', 'France', 'Canada']","['Atlanta, Georgia, USA']","['Marvel Studios', 'Film New Zealand', 'Marvel Entertainment']","['English', 'Russian']",11,88,1,2023
5. Oppenheimer,https://www.imdb.com/title/tt15398776/?ref_=sr_t_5,2023,3h,R,8.3,852K,"A dramatization of the life story of J. Robert Oppenheimer, the physicist who had a large hand in the development of the atomic bombs that brought an end to World War II.",100000000.0,975594978,329862540,82455420,['Christopher Nolan'],"['Christopher Nolan', 'Kai Bird', 'Martin Sherwin']","['Cillian Murphy', 'Emily Blunt', 'Matt Damon']","['Docudrama', 'Epic', 'Historical Epic', 'Period Drama', 'Psychological Drama', 'Biography', 'Drama', 'History']","['United States', 'United Kingdom']","['Los Alamos, New Mexico, USA']","['Universal Pictures', 'Atlas Entertainment', 'Gadget Films']","['English', 'German', 'Italian', 'Dutch']",361,371,7,2023
6. The Little Mermaid,https://www.imdb.com/title/tt5971474/?ref_=sr_t_6,2023,2h 15m,PG,7.2,164K,A young mermaid makes a deal with a sea witch to trade her beautiful voice for human legs so she can discover the world above water and impress a prince.,355100000.0,569626289,298172056,95578040,['Rob Marshall'],"['David Magee', 'Hans Christian Andersen', 'John Musker']","['Halle Bailey', 'Jonah Hauer-King', 'Melissa McCarthy']","['Fairy Tale', 'Feel-Good Romance', 'Sea Adventure', 'Teen Romance', 'Adventure', 'Family', 'Fantasy', 'Musical', 'Romance']",['United States'],"['Sardinia, Italy']","['Walt Disney Pictures', 'Lucamar Productions', 'Marc Platt Productions']",['English'],2,31,0,2023
7. Wonka,https://www.imdb.com/title/tt6166392/?ref_=sr_t_7,2023,1h 56m,PG,7.0,172K,"With dreams of opening a shop in a city renowned for its chocolate, a young and poor Willy Wonka discovers that the industry is run by a cartel of greedy chocolatiers.",125000000.0,634502312,218402312,39005800,['Paul King'],"['Roald Dahl', 'Paul King', 'Simon Farnaby']","['Timothée Chalamet', 'Gustave Die', 'Murray McArthur']","['Supernatural Fantasy', 'Adventure', 'Comedy', 'Family', 'Fantasy', 'Musical']","['United States', 'United Kingdom', 'Canada']","['Bath, Somerset, England, UK']","['Warner Bros.', 'Village Roadshow Pictures', 'The Roald Dahl Story Company']","['English', 'Latin', 'French']",3,42,0,2023
8. Ant-Man and the Wasp: Quantumania,https://www.imdb.com/title/tt10954600/?ref_=sr_t_8,2023,2h 4m,PG-13,6.0,246K,"Scott Lang and Hope Van Dyne are dragged into the Quantum Realm, along with Hope's parents and Scott's daughter Cassie. Together they must find a way to escape, but what secrets is Hope's mother hiding? And who is the mysterious Kang?",200000000.0,476071180,214504909,106109650,['Peyton Reed'],"['Jeff Loveness', 'Stan Lee', 'Larry Lieber']","['Paul Rudd', 'Evangeline Lilly', 'Michael Douglas']","['Superhero', 'Action', 'Adventure', 'Comedy', 'Sci-Fi']","['United States', 'Australia', 'Canada']","['Nevsehir, Turkey']","['Marvel Studios', ""Lightnin' Production Rentals"", 'Québec Production Services Tax Credit']",['English'],0,14,0,2023
9. John Wick: Chapter 4,https://www.imdb.com/title/tt10366206/?ref_=sr_t_9,2023,2h 49m,R,7.6,368K,"John Wick uncovers a path to defeating The High Table. But before he can earn his freedom, Wick must face off against a new enemy with powerful alliances across the globe and forces that turn old friends into foes.",100000000.0,440180275,187131806,73817950,['Chad Stahelski'],"['Shay Hatten', 'Michael Finch', 'Derek Kolstad']","['Keanu Reeves', 'Laurence Fishburne', 'George Georgiou']","['Action Epic', 'Gun Fu', 'One-Person Army Action', 'Action', 'Crime', 'Thriller']","['United States', 'Germany']","['Wadi Rum Desert, Jordan']","['Lionsgate', 'Thunder Road Pictures', '87Eleven Entertainment']","['English', 'Japanese', 'Russian', 'French', 'Spanish', 'German', 'Latin', 'Cantonese', 'Arabic']",37,47,0,2023
10. Sound of Freedom,https://www.imdb.com/title/tt7599146/?ref_=sr_t_10,2023,2h 11m,PG-13,7.6,128K,The incredible true story of a former government agent turned vigilante who embarks on a dangerous mission to rescue hundreds of children from traffickers.,14600000.0,250570396,184178046,19680879,['Alejandro Monteverde'],"['Rod Barr', 'Alejandro Monteverde']","['Jim Caviezel', 'Mira Sorvino', 'Bill Camp']","['Docudrama', 'True Crime', 'Biography', 'Crime', 'Drama', 'History', 'Thriller']","['Mexico', 'United States']","['Cartagena, Colombia']","['2521 Entertainment', 'Metanoia', 'Santa Fe Films']","['English', 'Spanish']",2,4,0,2023
11. Taylor Swift: The Eras Tour,https://www.imdb.com/title/tt28814949/?ref_=sr_t_11,2023,2h 49m,PG-13,8.0,24K,"Experience the Eras Tour concert, performed by the one and only Taylor Swift.",,261656269,180756269,93224755,['Sam Wrench'],[],"['Taylor Swift', 'Mike Meadows', 'Max Bernstein']","['Concert', 'Documentary', 'Music', 'Musical']",['United States'],"['SoFi Stadium - 1001 Stadium Drive, Inglewood, California, USA']","['Silent House', 'Taylor Swift Productions']",['English'],2,9,0,2023
12. Indiana Jones and the Dial of Destiny,https://www.imdb.com/title/tt1462764/?ref_=sr_t_12,2023,2h 34m,PG-13,6.5,216K,Archaeologist Indiana Jones races against time to retrieve a legendary artifact that can change the course of history.,387200000.0,383963057,174480468,60368101,['James Mangold'],"['Jez Butterworth', 'John-Henry Butterworth', 'David Koepp']","['Harrison Ford', 'Phoebe Waller-Bridge', 'Antonio Banderas']","['Adventure Epic', 'Globetrotting Adventure', 'Time Travel', 'Action', 'Adventure', 'Sci-Fi']",['United States'],"['North Yorkshire Moors Railway, 12 Park Street, Pickering, North Yorkshire, England, UK']","['Walt Disney Pictures', 'Lucasfilm', 'Paramount Pictures']","['English', 'German', 'Greek, Ancient (to 1453)', 'Spanish', 'Italian']",7,35,1,2023
13. Mission: Impossible - Dead Reckoning Part One,https://www.imdb.com/title/tt9603212/?ref_=sr_t_13,2023,2h 43m,PG-13,7.7,277K,Ethan Hunt and his IMF team must track down a dangerous weapon before it falls into the wrong hands.,291000000.0,571125435,172640980,54688347,['Christopher McQuarrie'],"['Bruce Geller', 'Christopher McQuarrie', 'Erik Jendresen']","['Tom Cruise', 'Hayley Atwell', 'Ving Rhames']","['Action Epic', 'Adventure Epic', 'Spy', 'Action', 'Adventure', 'Thriller']",['United States'],"['Helsetkopen, Møre og Romsdal, Norway']","['Paramount Pictures', 'Skydance Media', 'TC Productions']","['English', 'French', 'Italian', 'Russian']",18,67,2,2023
14. The Hunger Games: The Ballad of Songbirds & Snakes,https://www.imdb.com/title/tt10545296/?ref_=sr_t_14,2023,2h 37m,PG-13,6.7,152K,Coriolanus Snow mentors and develops feelings for the female District 12 tribute during the 10th Hunger Games.,100000000.0,348900019,166350594,44607143,['Francis Lawrence'],"['Michael Lesslie', 'Michael Arndt', 'Suzanne Collins']","['Rachel Zegler', 'Tom Blyth', 'Viola Davis']","['Dystopian Sci-Fi', 'Teen Adventure', 'Action', 'Adventure', 'Drama', 'Sci-Fi', 'Thriller', 'War']","['United States', 'Canada']","['Landschaftspark, Duisburg, North Rhine-Westphalia, Germany']","['Lionsgate', 'Color Force', 'About Blank']",['English'],7,27,0,2023
15. Transformers: Rise of the Beasts,https://www.imdb.com/title/tt5090568/?ref_=sr_t_15,2023,2h 7m,PG-13,6.0,119K,"During the '90s, a new faction of Transformers - the Maximals - join the Autobots as allies in the battle for Earth.",200000000.0,441656550,157341749,61045464,['Steven Caple Jr.'],"['Joby Harold', 'Darnell Metayer', 'Josh Peters']","['Anthony Ramos', 'Dominique Fishback', 'Luna Lauren Velez']","['Alien Invasion', 'Car Action', 'Action', 'Adventure', 'Sci-Fi']","['United States', 'Canada', 'United Kingdom', 'New Zealand', 'Hungary', 'Peru', 'China']","['Cuzco, Peru']","['Paramount Pictures', 'Skydance Media', 'New Republic Pictures']","['English', 'Spanish']",0,11,0,2023
16. Creed III,https://www.imdb.com/title/tt11145118/?ref_=sr_t_16,2023,1h 56m,PG-13,6.7,99K,"Adonis has been thriving in both his career and family life, but when a childhood friend and former boxing prodigy resurfaces, the face-off is more than just a fight.",75000000.0,276148615,156248615,58370007,['Michael B. Jordan'],"['Keenan Coogler', 'Zach Baylin', 'Ryan Coogler']","['Michael B. Jordan', 'Tessa Thompson', 'Jonathan Majors']","['Boxing', 'Action', 'Drama', 'Sport']",['United States'],"['Atlanta, Georgia, USA']","['Metro-Goldwyn-Mayer (MGM)', 'Chartoff-Winkler Productions', 'Glickmania']","['English', 'American Sign Language', 'Spanish', 'Hawaiian']",0,28,0,2023
17. Elemental,https://www.imdb.com/title/tt15789038/?ref_=sr_t_17,2023,1h 41m,PG,7.0,146K,"Follows Ember and Wade, in a city where fire-, water-, earth- and air-residents live together.",200000000.0,496444308,154426697,29602429,['Peter Sohn'],"['John Hoberg', 'Kat Likkel', 'Brenda Hsueh']","['Leah Lewis', 'Mamoudou Athie', 'Ronnie Del Carmen']","['Computer Animation', 'Urban Adventure', 'Adventure', 'Animation', 'Comedy', 'Family', 'Fantasy', 'Romance']",['United States'],"['Walt Disney Feature Animation - 500 S. Buena Vista Street, Burbank, California, USA']","['Walt Disney Pictures', 'Pixar Animation Studios', 'Hurwitz Creative']",['English'],2,68,1,2023
18. Fast X,https://www.imdb.com/title/tt5433140/?ref_=sr_t_18,2023,2h 21m,PG-13,5.7,131K,Dom Toretto and his family are targeted by the vengeful son of drug kingpin Hernan Reyes.,340000000.0,704875015,146126015,67017410,['Louis Leterrier'],"['Dan Mazeau', 'Justin Lin', 'Zach Dean']","['Vin Diesel', 'Michelle Rodriguez', 'Jason Statham']","['Action Epic', 'Car Action', 'Urban Adventure', 'Action', 'Adventure', 'Crime', 'Mystery', 'Thriller']","['United States', 'China', 'Japan']","['A24 Highway AKA Autoestrada do Interior Norte, Portugal']","['Universal Pictures', 'China Film Co., Ltd.', 'Dentsu']",['English'],2,15,0,2023
19. Five Nights at Freddy's,https://www.imdb.com/title/tt4589218/?ref_=sr_t_19,2023,1h 49m,PG-13,5.4,109K,"A troubled security guard begins working at Freddy Fazbear's Pizza. During his five nights on the job, he realizes that something is wrong with the pizzeria and pretty soon finds the truth about its animatronics.",20000000.0,291493620,137275620,80001720,['Emma Tammi'],"['Scott Cawthon', 'Seth Cuddeback', 'Emma Tammi']","['Josh Hutcherson', 'Piper Rubio', 'Elizabeth Lail']","['Supernatural Horror', 'Suspense Mystery', 'Horror', 'Mystery', 'Thriller']",['United States'],"['Oakwood Center, Terrytown, Louisiana, USA']","['Universal Pictures', 'Blumhouse Productions', 'Scott Cawthon Productions']",['English'],0,22,0,2023
20. Migration,https://www.imdb.com/title/tt6495056/?ref_=sr_t_20,2023,1h 23m,PG,6.6,39K,A family of ducks try to convince their overprotective father to go on the vacation of a lifetime.,70000000.0,300187799,127630880,12453275,"['Benjamin Renner', 'Guylo Homsy']","['Mike White', 'Benjamin Renner', 'Ken Daurio']","['Kumail Nanjiani', 'Tresi Gazal', 'Elizabeth Banks']","['Animal Adventure', 'Computer Animation', 'Adventure', 'Animation', 'Comedy', 'Family']",['United States'],[],"['Universal Pictures', 'Illumination Entertainment', 'Dentsu']",['English'],0,7,0,2023
21. Aquaman and the Lost Kingdom,https://www.imdb.com/title/tt9663764/?ref_=sr_t_21,2023,2h 4m,PG-13,5.6,103K,"Black Manta seeks revenge on Aquaman for his father's death. Wielding the Black Trident's power, he becomes a formidable foe. To defend Atlantis, Aquaman forges an alliance with his imprisoned brother. They must protect the kingdom.",205000000.0,439381226,124481226,27686211,['James Wan'],"['David Leslie Johnson-McGoldrick', 'James Wan', 'Jason Momoa']","['Jason Momoa', 'Patrick Wilson', 'Yahya Abdul-Mateen II']","['Action Epic', 'Superhero', 'Action', 'Adventure', 'Fantasy', 'Sci-Fi']","['United States', 'United Kingdom', 'Canada', 'Australia', 'Iceland']","['Saunton Sands, Devon, England, UK']","['Warner Bros.', 'DC Entertainment', 'Domain Entertainment (II)']",['English'],0,6,0,2023
22. Teenage Mutant Ninja Turtles: Mutant Mayhem,https://www.imdb.com/title/tt8589698/?ref_=sr_t_22,2023,1h 39m,PG,7.2,72K,The Turtle brothers work to earn the love of New York City while facing down an army of mutants.,70000000.0,181935518,118700272,28007544,"['Jeff Rowe', 'Kyler Spears']","['Seth Rogen', 'Evan Goldberg', 'Jeff Rowe']","['Micah Abbey', 'Shamon Brown Jr.', 'Nicolas Cantu']","['Computer Animation', 'Hand-Drawn Animation', 'Superhero', 'Teen Adventure', 'Teen Comedy', 'Urban Adventure', 'Action', 'Adventure', 'Animation', 'Comedy']","['United States', 'Japan', 'Canada']","['New York City, New York, USA']","['Image Comics', 'Mikros Animation', 'Nickelodeon Animation Studios']",['English'],0,73,0,2023
23. Scream VI,https://www.imdb.com/title/tt17663992/?ref_=sr_t_23,2023,2h 2m,R,6.4,134K,The survivors of the Ghostface killings leave Woodsboro behind and start a fresh chapter in New York City.,35000000.0,166577232,108391107,44447270,"['Matt Bettinelli-Olpin', 'Tyler Gillett']","['James Vanderbilt', 'Guy Busick', 'Kevin Williamson']","['Courteney Cox', 'Melissa Barrera', 'Jenna Ortega']","['Slasher Horror', 'Suspense Mystery', 'Teen Horror', 'Whodunnit', 'Horror', 'Mystery', 'Thriller']","['United States', 'Canada', 'United Kingdom']","['Montreal, Canada']","['Paramount Pictures', 'Spyglass Media Group', 'Project X Entertainment']",['English'],4,27,0,2023
24. The Flash,https://www.imdb.com/title/tt0439572/?ref_=sr_t_24,2023,2h 24m,PG-13,6.6,229K,"Barry Allen uses his super speed to change the past, but his attempt to save his family creates a world without super heroes, forcing him to race for his life in order to save the future.",200000000.0,271433313,108133313,55043679,['Andy Muschietti'],"['Christina Hodson', 'John Francis Daley', 'Jonathan Goldstein']","['Ezra Miller', 'Michael Keaton', 'Sasha Calle']","['Superhero', 'Supernatural Fantasy', 'Time Travel', 'Action', 'Adventure', 'Fantasy', 'Sci-Fi']","['United States', 'Canada', 'Australia', 'New Zealand']","['130 St Vincent Street, Glasgow, Scotland, UK']","['DC Comics', 'DC Entertainment', 'New Zealand Film Commission']",['English'],5,7,0,2023
25. Trolls Band Together,https://www.imdb.com/title/tt14362112/?ref_=sr_t_25,2023,1h 31m,PG,6.0,18K,"Poppy discovers that Branch was once part of the boy band 'BroZone' with his brothers, Floyd, John Dory, Spruce and Clay. When Floyd is kidnapped, Branch and Poppy embark on a journey to reunite his two other brothers and rescue Floyd.",95000000.0,209646030,103270155,30002525,"['Walt Dohrn', 'Tim Heitz']","['Elizabeth Tippet', 'Thomas Dam']","['Anna Kendrick', 'Justin Timberlake', 'Kenan Thompson']","['Computer Animation', 'Adventure', 'Animation', 'Comedy', 'Family', 'Fantasy', 'Musical']","['United States', 'United Kingdom']",[],"['DreamWorks Animation', 'Universal Pictures']","['English', 'Spanish']",5,6,0,2023
26. Dungeons & Dragons: Honor Among Thieves,https://www.imdb.com/title/tt2906216/?ref_=sr_t_26,2023,2h 14m,PG-13,7.2,253K,"A charming thief and a band of unlikely adventurers embark on an epic quest to retrieve a lost relic, but things go dangerously awry when they run afoul of the wrong people.",150000000.0,205460387,93549650,37205784,"['John Francis Daley', 'Jonathan Goldstein']","['Jonathan Goldstein', 'John Francis Daley', 'Michael Gilio']","['Chris Pine', 'Michelle Rodriguez', 'Regé-Jean Page']","['Quest', 'Sword & Sorcery', 'Action', 'Adventure', 'Comedy', 'Fantasy']","['United States', 'Canada', 'United Kingdom', 'Iceland', 'Ireland', 'Australia']","['Fagradalsfjall, Iceland']","['Paramount Pictures', 'Entertainment One', 'Allspark Pictures']",['English'],4,19,0,2023
27. The Equalizer 3,https://www.imdb.com/title/tt17024450/?ref_=sr_t_27,2023,1h 49m,R,6.8,141K,"Robert McCall finds himself at home in Southern Italy but he discovers his friends are under the control of local crime bosses. As events turn deadly, McCall knows what he has to do: become his friends' protector by taking on the mafia.",70000000.0,191067560,92373751,34604229,['Antoine Fuqua'],"['Richard Wenk', 'Michael Sloan', 'Richard Lindheim']","['Denzel Washington', 'Dakota Fanning', 'Eugenio Mastrandrea']","['One-Person Army Action', 'Action', 'Crime', 'Thriller']","['United States', 'Italy', 'Australia']","['Minori, Campania, Italy']","['Columbia Pictures', 'Eagle Pictures', 'Escape Artists']","['English', 'Italian']",0,6,0,2023
28. Anyone But You,https://www.imdb.com/title/tt26047818/?ref_=sr_t_28,2023,1h 43m,R,6.1,137K,"After an amazing first date, Bea and Ben's fiery attraction turns ice-cold--until they find themselves unexpectedly reunited at a wedding in Australia. So they do what any two mature adults would do: pretend to be a couple.",25000000.0,220323355,88319668,6000344,['Will Gluck'],"['Ilana Wolpert', 'Will Gluck']","['Sydney Sweeney', 'Glen Powell', 'Alexandra Shipp']","['Romantic Comedy', 'Comedy', 'Romance']","['Australia', 'United States']","['Jones Bay Wharf, Pyrmont, Sydney, New South Wales, Australia']","['Columbia Pictures', 'Roth/Kirschenbaum Films', 'SK Global']",['English'],0,4,0,2023
29. The Nun II,https://www.imdb.com/title/tt10160976/?ref_=sr_t_29,2023,1h 50m,R,5.6,68K,"1956 in France, a priest is horribly murdered. An evil is spreading. Once again, Sister Irene comes face-to-face with Valak, the demon nun.",38000000.0,269667073,86267073,32603336,['Michael Chaves'],"['Ian Goldberg', 'Richard Naing', 'Akela Cooper']","['Taissa Farmiga', 'Jonas Bloquet', 'Storm Reid']","['Supernatural Horror', 'Horror', 'Mystery', 'Thriller']",['United States'],"['Couvent des Prêcheurs, Aix-en-Provence, Bouches-du-Rhône, France']","['New Line Cinema', 'Atomic Monster', 'The Safran Company']","['English', 'French', 'Italian', 'Romanian']",0,12,0,2023
30. The Marvels,https://www.imdb.com/title/tt10676048/?ref_=sr_t_30,2023,1h 45m,PG-13,5.5,144K,"Carol Danvers gets her powers entangled with those of Kamala Khan and Monica Rambeau, forcing them to work together to save the universe.",220000000.0,206136825,84500223,46110859,['Nia DaCosta'],"['Nia DaCosta', 'Megan McDonnell', 'Elissa Karasik']","['Brie Larson', 'Teyonah Parris', 'Iman Vellani']","['Superhero', 'Action', 'Adventure', 'Fantasy']",['United States'],"['Calabria, Italy']",['Marvel Studios'],"['English', 'Urdu']",4,11,0,2023
31. Meg 2: The Trench,https://www.imdb.com/title/tt9224104/?ref_=sr_t_31,2023,1h 56m,PG-13,5.0,90K,"A research team's journey into the depths of the ocean turns into chaos when a mining operation forces them into a battle for survival, facing off against Megalodons and relentless environmental marauders.",129000000.0,397800317,82600317,30002735,['Ben Wheatley'],"['Jon Hoeber', 'Erich Hoeber', 'Dean Georgaris']","['Jason Statham', 'Jing Wu', 'Shuya Sophia Cai']","['Kaiju', 'Action', 'Adventure', 'Horror', 'Sci-Fi', 'Thriller']","['United States', 'China', 'Thailand', 'Germany', 'Canada', 'United Kingdom']","['Phuket, Thailand']","['Alibaba Pictures Group', 'Apelles Entertainment', 'China Media Capital']","['English', 'Mandarin', 'Spanish']",3,4,0,2023
32. Insidious: The Red Door,https://www.imdb.com/title/tt13405778/?ref_=sr_t_32,2023,1h 47m,PG-13,5.5,57K,The Lamberts must go deeper into The Further than ever before to put their demons to rest once and for all.,16000000.0,189086877,82156962,33013036,['Patrick Wilson'],"['Leigh Whannell', 'Scott Teems']","['Ty Simpkins', 'Patrick Wilson', 'Rose Byrne']","['Supernatural Horror', 'Suspense Mystery', 'Horror', 'Mystery', 'Thriller']","['United States', 'Canada']","['Morristown, New Jersey, USA']","['Screen Gems', 'Stage 6 Films', 'Blumhouse Productions']",['English'],0,2,0,2023
33. Blue Beetle,https://www.imdb.com/title/tt9362930/?ref_=sr_t_33,2023,2h 7m,PG-13,5.9,106K,"An alien scarab chooses Jaime Reyes to be its symbiotic host, bestowing the recent college graduate with a suit of armor that's capable of extraordinary powers, forever changing his destiny as he becomes the superhero known as Blue Beetle.",104000000.0,130788072,72488072,25030225,['Angel Manuel Soto'],['Gareth Dunnet-Alcocer'],"['Xolo Maridueña', 'Bruna Marquezine', 'Becky G']","['Superhero', 'Action', 'Adventure', 'Sci-Fi', 'Thriller']","['United States', 'Mexico', 'Canada', 'Germany']",['Puerto Rico'],"['Warner Bros.', 'Warner Bros. Pictures Mexico', 'DC Entertainment']","['English', 'Spanish', 'Portuguese']",3,12,0,2023
34. Killers of the Flower Moon,https://www.imdb.com/title/tt5537002/?ref_=sr_t_34,2023,3h 26m,R,7.6,275K,"When oil is discovered in 1920s Oklahoma under Osage Nation land, the Osage people are murdered one by one - until the FBI steps in to unravel the mystery.",200000000.0,158772599,68035488,23253655,['Martin Scorsese'],"['Eric Roth', 'Martin Scorsese', 'David Grann']","['Leonardo DiCaprio', 'Robert De Niro', 'Lily Gladstone']","['Epic', 'Period Drama', 'Tragedy', 'True Crime', 'Western Epic', 'Crime', 'Drama', 'History', 'Mystery', 'Romance']",['United States'],"['Bartlesville, Oklahoma, USA']","['Apple Studios', 'Imperative Entertainment', 'Sikelia Productions']","['English', 'Osage', 'Latin', 'French']",135,427,10,2023
35. Haunted Mansion,https://www.imdb.com/title/tt1695843/?ref_=sr_t_35,2023,2h 3m,PG-13,6.0,47K,"A single mom named Gabbie hires a tour guide, a psychic, a priest and a historian to help exorcise her newly bought mansion after discovering it is inhabited by ghosts.",150000000.0,117449790,67653287,24082475,['Justin Simien'],['Katie Dippold'],"['LaKeith Stanfield', 'Rosario Dawson', 'Owen Wilson']","['Supernatural Fantasy', 'Supernatural Horror', 'Comedy', 'Drama', 'Family', 'Fantasy', 'Horror', 'Mystery']","['United States', 'Canada']","['New Orleans, Louisiana, USA']","['Walt Disney Pictures', 'Canadian Film or Video Production Services Tax Credit (PSTC)', 'Canadian Film or Video Production Tax Credit (CPTC)']","['English', 'French', 'Spanish']",0,8,0,2023
36. Evil Dead Rise,https://www.imdb.com/title/tt13345606/?ref_=sr_t_36,2023,1h 36m,R,6.5,153K,"A twisted tale of two estranged sisters whose reunion is cut short by the rise of flesh-possessing demons, thrusting them into a primal battle for survival as they face the most nightmarish version of family imaginable.",12000000.0,147033054,67233054,24504315,['Lee Cronin'],['Lee Cronin'],"['Mirabai Pease', 'Richard Crouchley', 'Anna-Maree Thomas']","['Body Horror', 'Dark Comedy', 'Supernatural Horror', 'Zombie Horror', 'Horror']","['Ireland', 'New Zealand', 'United States']","['Auckland, New Zealand']","['Department of Post', 'Ghost House Pictures', 'New Line Cinema']",['English'],4,32,0,2023
