Title,Movie Link,Year,Duration,MPA,Rating,Votes,Description,budget,grossWorldWide,gross_US_Canada,opening_weekend_Gross,directors,writers,stars,genres,countries_origin,filming_locations,production_companies,Languages,wins,nominations,oscars,release_date
37. The Exorcist: Believer,https://www.imdb.com/title/tt12921446/?ref_=sr_t_37,2023,1h 51m,R,4.8,46K,"When two girls disappear into the woods and return three days later with no memory of what happened to them, the father of one girl seeks out Chris MacNeil, who's been forever altered by what happened to her daughter fifty years ago.",30000000.0,136294607,65537395,26497600,['David Gordon Green'],"['Peter Sattler', 'David Gordon Green', 'Scott Teems']","['Lafortune Joseph', 'Leslie Odom Jr.', 'Gastner Legerme']",['Horror'],['United States'],"['Santo Domingo, Dominican Republic']","['Universal Pictures', 'Blumhouse Productions', 'Morgan Creek Entertainment']","['English', 'Latin', 'Haitian', 'French']",0,22,0,2023
38. PAW Patrol: The Mighty Movie,https://www.imdb.com/title/tt15837338/?ref_=sr_t_38,2023,1h 28m,PG,5.9,5.7K,"A magical meteor falls in Adventure City and gives the PAW Patrol superpowers, transforming them into the Mighty Pups. But they face their most powerful challenge when Humdinger teams up with a mad scientist to steal their powers.",40387500.0,205098869,65343309,22764354,['Cal Brunker'],"['Cal Brunker', 'Bob Barlen', 'Shane Morris']","['Dan Duran', 'Kristen Bell', 'James Marsden']","['Computer Animation', 'Superhero', 'Urban Adventure', 'Action', 'Adventure', 'Animation', 'Comedy', 'Crime', 'Family', 'Fantasy']","['Canada', 'United States']","['Toronto, Ontario, Canada']","['Spin Master Entertainment', 'Nickelodeon Animation Studios', 'Nickelodeon Movies']",['English'],0,8,0,2023
39. Cocaine Bear,https://www.imdb.com/title/tt14209916/?ref_=sr_t_39,2023,1h 35m,R,5.9,118K,"An oddball group of cops, criminals, tourists and teens converge on a Georgia forest where a huge black bear goes on a murderous rampage after unintentionally ingesting cocaine.",35000000.0,88314672,64670240,23260790,['Elizabeth Banks'],['Jimmy Warden'],"['Keri Russell', 'Alden Ehrenreich', ""O'Shea Jackson Jr.""]","['Dark Comedy', 'True Crime', 'Comedy', 'Crime', 'Thriller']","['United States', 'Ireland', 'New Zealand', 'Netherlands', 'United Kingdom']","['Avoca, County Wicklow, Ireland']","['Universal Pictures', 'Brownstone Productions (II)', 'Jurassic Party Productions']",['English'],0,10,0,2023
40. Wish,https://www.imdb.com/title/tt11304740/?ref_=sr_t_40,2023,1h 35m,PG,5.6,45K,A young girl wishes on a star and gets a more direct answer than she bargained for when a trouble-making star comes down from the sky to join her.,200000000.0,254997360,63973821,19698228,"['Chris Buck', 'Fawn Veerasunthorn']","['Jennifer Lee', 'Allison Moore', 'Chris Buck']","['Ariana DeBose', 'Chris Pine', 'Alan Tudyk']","['Computer Animation', 'Fairy Tale', 'Adventure', 'Animation', 'Comedy', 'Family', 'Fantasy', 'Musical']",['United States'],"['Walt Disney Animation Studios - 2100 Riverside Drive, Burbank, California, USA']","['Walt Disney Pictures', 'Walt Disney Animation Studios', 'Hurwitz Creative']",['English'],0,22,0,2023
41. Napoleon,https://www.imdb.com/title/tt13287846/?ref_=sr_t_41,2023,2h 38m,R,6.3,169K,"An epic that details the chequered rise and fall of French Emperor Napoleon Bonaparte and his relentless journey to power through the prism of his addictive, volatile relationship with his wife, Josephine.",200000000.0,221394838,61524375,20638887,['Ridley Scott'],['David Scarpa'],"['Joaquin Phoenix', 'Vanessa Kirby', 'Tahar Rahim']","['Action Epic', 'Costume Drama', 'Docudrama', 'Epic', 'Historical Epic', 'Period Drama', 'War Epic', 'Action', 'Adventure', 'Biography']","['United States', 'United Kingdom']","['Kalkara, Malta']","['Apple Studios', 'Moving Picture Company (MPC)', 'Scott Free Productions']","['English', 'French', 'Russian', 'German', 'Italian']",5,46,3,2023
42. The Color Purple,https://www.imdb.com/title/tt1200263/?ref_=sr_t_42,2023,2h 21m,PG-13,6.8,19K,"A woman faces many hardships in her life, but ultimately finds extraordinary strength and hope in the unbreakable bonds of sisterhood.",100000000.0,68919191,60619191,11737072,['Blitz Bazawule'],"['Marcus Gardley', 'Alice Walker', 'Marsha Norman']","['Fantasia Barrino', 'Taraji P. Henson', 'Danielle Brooks']","['Drama', 'Musical']",['United States'],"['Jekyll Island, Georgia, USA']","['Amblin Entertainment', 'Canadian Film or Video Production Services Tax Credit (PSTC)', 'Domain Entertainment (II)']",['English'],28,109,1,2023
43. Shazam! Fury of the Gods,https://www.imdb.com/title/tt10151854/?ref_=sr_t_43,2023,2h 10m,PG-13,5.9,134K,"The film continues the story of teenage Billy Batson who, upon reciting the magic word ""SHAZAM!"", is transformed into his adult superhero alter ego, Shazam.",125000000.0,134138006,57638006,30111158,['David F. Sandberg'],"['Henry Gayden', 'Chris Morgan', 'Bill Parker']","['Zachary Levi', 'Asher Angel', 'Jack Dylan Grazer']","['Superhero', 'Action', 'Adventure', 'Comedy', 'Fantasy', 'Sci-Fi']","['United States', 'Germany', 'New Zealand', 'United Kingdom', 'India', 'South Korea', 'Canada']","['Athens, Greece']","['New Line Cinema', 'DC Entertainment', 'Warner Bros.']","['English', 'Greek', 'French', 'Spanish']",0,8,0,2023
44. Godzilla Minus One,https://www.imdb.com/title/tt23289160/?ref_=sr_t_44,2023,2h 4m,PG-13,7.7,165K,"Post-war Japan is at its lowest point when a new crisis emerges in the form of a giant monster, baptized in the horrific power of the atomic bomb.",15000000.0,113676322,57144669,11419975,['Takashi Yamazaki'],"['Takashi Yamazaki', 'Ishirô Honda', 'Takeo Murata']","['Minami Hamabe', 'Ryunosuke Kamiki', 'Sakura Andô']","['Action Epic', 'Adventure Epic', 'Dinosaur Adventure', 'Epic', 'Kaiju', 'Monster Horror', 'Period Drama', 'Sci-Fi Epic', 'Supernatural Horror', 'Tragedy']",['Japan'],['Japan'],"['Robot Communications', 'Toho Studios', 'Toho']",['Japanese'],44,62,1,2023
45. Saw X,https://www.imdb.com/title/tt21807222/?ref_=sr_t_45,2023,1h 58m,R,6.6,88K,A sick and desperate John travels to Mexico for a risky and experimental medical procedure in hopes of a miracle cure for his cancer only to discover the entire operation is a scam to defraud the most vulnerable.,13000000.0,112202480,53607898,18309301,['Kevin Greutert'],"['Pete Goldfinger', 'Josh Stolberg']","['Tobin Bell', 'Shawnee Smith', 'Synnøve Macody Lund']","['Body Horror', 'Splatter Horror', 'Horror', 'Mystery', 'Thriller']","['United States', 'Mexico', 'Canada']","['Mexico City, Mexico']","['Twisted Pictures', 'Galaxy 8 Entertainment', 'Serendipity Productions']","['English', 'Spanish']",0,15,0,2023
46. The Boys in the Boat,https://www.imdb.com/title/tt1856080/?ref_=sr_t_46,2023,2h 3m,PG-13,7.0,27K,"A 1930s-set story centered on the University of Washington's rowing team, from their Depression-era beginnings.",40000000.0,55501365,52641306,8400548,['George Clooney'],"['Daniel James Brown', 'Mark L. Smith']","['Joel Edgerton', 'Callum Turner', 'Peter Guinness']","['Coming-of-Age', 'Docudrama', 'Water Sport', 'Biography', 'Drama', 'Sport']",['United States'],"['Cleveland Lakes Nature Reserve, Ashton Keynes, Swindon, Wiltshire, England, UK']","['Tempesta Films', 'Lantern Entertainment', 'Metro-Goldwyn-Mayer (MGM)']","['English', 'German', 'French', 'Italian', 'Hungarian']",2,6,0,2023
47. Air,https://www.imdb.com/title/tt16419074/?ref_=sr_t_47,2023,1h 51m,R,7.4,181K,The history of the game-changing partnership between a then undiscovered Michael Jordan and Nike's fledgling basketball division which revolutionized the world of sports and culture with the Air Jordan brand.,90000000.0,90060106,52460106,14456279,['Ben Affleck'],['Alex Convery'],"['Matt Damon', 'Jason Bateman', 'Ben Affleck']","['Basketball', 'Docudrama', 'Period Drama', 'Drama', 'Sport']",['United States'],"['Los Angeles, California, USA']","['Amazon Studios', 'Artists Equity', 'Mandalay Pictures']",['English'],5,48,0,2023
48. Jesus Revolution,https://www.imdb.com/title/tt10098448/?ref_=sr_t_48,2023,2h,PG-13,7.1,15K,The true story of a national spiritual awakening in the early 1970s and its origins within a community of teenage hippies in Southern California.,,54293684,52102987,15882067,"['Jon Erwin', 'Brent Mccorkle']","['Ellen Vaughn', 'Greg Laurie', 'Jon Gunn']","['Joel Courtney', 'Jonathan Roumie', 'Kimberly Williams-Paisley']","['Docudrama', 'Biography', 'Drama', 'History']",['United States'],"['Fairhope, Alabama, USA']","['Kingdom Story Company', 'Lionsgate']",['English'],0,2,0,2023
49. No Hard Feelings,https://www.imdb.com/title/tt15671028/?ref_=sr_t_49,2023,1h 43m,R,6.3,188K,"On the brink of losing her home, Maddie finds an intriguing job listing: helicopter parents looking for someone to bring their introverted 19-year-old son out of his shell before college. She has one summer to make him a man or die trying.",45000000.0,87256407,50452282,15002770,['Gene Stupnitsky'],"['Gene Stupnitsky', 'John Phillips']","['Jennifer Lawrence', 'Andrew Barth Feldman', 'Laura Benanti']","['Raunchy Comedy', 'Romantic Comedy', 'Teen Comedy', 'Teen Romance', 'Comedy', 'Romance']",['United States'],"['Point Lookout, New York, USA']","['Excellent Cadaver', 'Odenkirk Provissiero Entertainment', 'Sony Pictures Releasing']",['English'],0,10,0,2023
50. The Boy and the Heron,https://www.imdb.com/title/tt6587046/?ref_=sr_t_50,2023,2h 4m,PG-13,7.4,89K,"In the wake of his mother's death and his father's remarriage, a headstrong boy named Mahito ventures into a dreamlike world shared by both the living and the dead.",,281951288,46832867,13011722,['Hayao Miyazaki'],['Hayao Miyazaki'],"['Soma Santoki', 'Masaki Suda', 'Kô Shibasaki']","['Anime', 'Fantasy Epic', 'Hand-Drawn Animation', 'Isekai', 'Adventure', 'Animation', 'Drama', 'Fantasy']",['Japan'],[],"['Studio Ghibli', 'Toho']",['Japanese'],35,91,1,2023
51. Gran Turismo,https://www.imdb.com/title/tt4495098/?ref_=sr_t_51,2023,2h 14m,PG-13,7.1,117K,"Based on the unbelievable, inspiring true story of a team of underdogs - a struggling, working-class gamer, a failed former race car driver, and an idealistic motorsport exec - who risk it all to take on the most elite sport in the world.",60000000.0,122076738,44428554,17410552,['Neill Blomkamp'],"['Jason Hall', 'Zach Baylin', 'Alex Tse']","['David Harbour', 'Orlando Bloom', 'Archie Madekwe']","['Car Action', 'Motorsport', 'Action', 'Adventure', 'Drama', 'Sport']","['Japan', 'United States']","['Dubai, United Arab Emirates']","['Columbia Pictures', 'PlayStation Productions', '2.0 Entertainment']",['English'],0,3,0,2023
52. The Boogeyman,https://www.imdb.com/title/tt3427252/?ref_=sr_t_52,2023,1h 38m,PG-13,5.9,49K,"Two sisters grieving the recent death of their mother without receiving much support from their father, a therapist who is dealing with his own grief, must face a supernatural entity that feeds on the suffering of its victims.",35000000.0,67307243,43244282,12356486,['Rob Savage'],"['Scott Beck', 'Bryan Woods', 'Mark Heyman']","['Sophie Thatcher', 'Chris Messina', 'Vivien Lyra Blair']","['Supernatural Horror', 'Horror', 'Mystery', 'Thriller']","['United States', 'Canada']","['New Orleans, Louisiana, USA']","['20th Century Studios', '21 Laps Entertainment']",['English'],0,3,0,2023
53. A Haunting in Venice,https://www.imdb.com/title/tt22687790/?ref_=sr_t_53,2023,1h 43m,PG-13,6.5,128K,"In post-World War II Venice, Poirot, now retired and living in his own exile, reluctantly attends a seance. But when one of the guests is murdered, it is up to the former detective to once again uncover the killer.",60000000.0,122290456,42471412,14279529,['Kenneth Branagh'],"['Michael Green', 'Agatha Christie']","['Kenneth Branagh', 'Michelle Yeoh', 'Jamie Dornan']","['Psychological Horror', 'Psychological Thriller', 'Whodunnit', 'Crime', 'Drama', 'Horror', 'Mystery', 'Thriller']",['United States'],"['Campiello dei Miracoli, Campo Santa Maria Nova, Venezia, Italy']","['20th Century Studios', 'Kinberg Genre', 'Scott Free Productions']","['English', 'Italian', 'French', 'Latin']",6,4,0,2023
54. The Creator,https://www.imdb.com/title/tt11858890/?ref_=sr_t_54,2023,2h 13m,PG-13,6.7,182K,"Against the backdrop of a war between humans and robots with artificial intelligence, a former soldier finds the robots' secret weapon to end the conflict, an AI in the form of a child.",80000000.0,104272136,40774679,14079512,['Gareth Edwards'],"['Gareth Edwards', 'Chris Weitz']","['John David Washington', 'Madeleine Yuna Voyles', 'Gemma Chan']","['Action Epic', 'Adventure Epic', 'Artificial Intelligence', 'Cyberpunk', 'Dystopian Sci-Fi', 'Sci-Fi Epic', 'Action', 'Adventure', 'Drama', 'Sci-Fi']",['United States'],"['Bangkok, Thailand']","['20th Century Studios', 'New Regency Productions', 'Entertainment One']","['English', 'Thai']",13,47,2,2023
55. 80 for Brady,https://www.imdb.com/title/tt18079362/?ref_=sr_t_55,2023,1h 38m,PG-13,5.9,13K,A group of friends made it their life-long mission to go to the Super Bowl and meet NFL superstar Tom Brady.,28000000.0,40480875,39448525,12701640,['Kyle Marvin'],"['Sarah Haskins', 'Emily Halpern']","['Lily Tomlin', 'Jane Fonda', 'Rita Moreno']","['Football', 'Comedy', 'Drama', 'Sport']",['United States'],"['Santa Clarita, California, USA']","['199 Productions', 'Fifth Season', 'Paramount Pictures']",['English'],4,2,0,2023
56. Knock at the Cabin,https://www.imdb.com/title/tt15679400/?ref_=sr_t_56,2023,1h 40m,R,6.1,132K,"While vacationing, a girl and her parents are taken hostage by armed strangers who demand that the family make a choice to avert the apocalypse.",20000000.0,54760947,35397980,14127170,['M. Night Shyamalan'],"['Paul Tremblay', 'M. Night Shyamalan', 'Steve Desmond']","['Dave Bautista', 'Jonathan Groff', 'Ben Aldridge']","['Psychological Thriller', 'Horror', 'Mystery', 'Thriller']","['United States', 'Japan', 'China']","['Tabernacle, New Jersey, USA']","['Universal Pictures', 'Blinding Edge Pictures', 'Dentsu']",['English'],0,12,0,2023
57. The Iron Claw,https://www.imdb.com/title/tt21064584/?ref_=sr_t_57,2023,2h 12m,R,7.6,101K,"The true story of the inseparable Von Erich brothers, who made history in the intensely competitive world of professional wrestling in the early 1980s.",15000000.0,45204449,35070296,4868370,['Sean Durkin'],['Sean Durkin'],"['Zac Efron', 'Jeremy Allen White', 'Harris Dickinson']","['Docudrama', 'Tragedy', 'Biography', 'Drama', 'Sport']","['United Kingdom', 'United States']","['Baton Rouge, Louisiana, USA']","['A24', 'Access Entertainment', 'BBC Film']",['English'],3,39,0,2023
58. Poor Things,https://www.imdb.com/title/tt14230458/?ref_=sr_t_58,2023,2h 21m,R,7.8,328K,"An account of the fantastical evolution of Bella Baxter, a young woman brought back to life by the brilliant and unorthodox scientist Dr. Godwin Baxter.",35000000.0,117625455,34553225,661230,['Yorgos Lanthimos'],"['Tony McNamara', 'Alasdair Gray']","['Emma Stone', 'Mark Ruffalo', 'Willem Dafoe']","['Dark Comedy', 'Steampunk', 'Comedy', 'Drama', 'Romance', 'Sci-Fi']","['Ireland', 'United Kingdom', 'United States', 'Hungary']","['Origo Film Studio, Budapest, Hungary']","['Element Pictures', 'Film4', 'Fruit Tree']","['English', 'French', 'Portuguese']",120,424,4,2023
59. Renaissance: A Film by Beyoncé,https://www.imdb.com/title/tt29354040/?ref_=sr_t_59,2023,2h 49m,Not Rated,8.6,3.6K,"Beyoncé in performance at her record-breaking RENAISSANCE World Tour, and the creative mastermind behind it.",,43989684,33889684,21801216,"['Beyoncé', 'Mark Ritchie', 'Ed Burke']",['Beyoncé'],"['Beyoncé', 'Blue Ivy Carter', 'Diana Ross']","['Concert', 'Music Documentary', 'Documentary', 'Music']",['United States'],[],"['Parkwood Entertainment', 'Southpaw Productions']",['English'],0,6,0,2023
60. Missing,https://www.imdb.com/title/tt10855768/?ref_=sr_t_60,2023,1h 51m,PG-13,7.1,66K,"When her mother disappears while on vacation in Colombia with her new boyfriend, June's search for answers is hindered by international red tape. However, as she digs deeper, her digital sleuthing soon raises more questions than answers.",7000000.0,48767848,32502025,9154695,"['Nicholas D. Johnson', 'Will Merrick']","['Will Merrick', 'Nicholas D. Johnson', 'Sev Ohanian']","['Tim Griffin', 'Ava Zaria Lee', 'Nia Long']","['Psychological Thriller', 'Drama', 'Mystery', 'Thriller']","['United States', 'Russia']","['Cartagena, Colombia']","['Stage 6 Films', 'Screen Gems', 'Bazelevs Production']","['English', 'Spanish']",3,0,0,2023
61. Plane,https://www.imdb.com/title/tt5884796/?ref_=sr_t_61,2023,1h 47m,R,6.5,89K,A pilot finds himself caught in a war zone after he's forced to land his commercial aircraft during a terrible storm.,25000000.0,74515586,32111181,10265326,['Jean-François Richet'],"['Charles Cumming', 'J.P. Davis']","['Gerard Butler', 'Mike Colter', 'Tony Goldwyn']","['One-Person Army Action', 'Quest', 'Survival', 'Action', 'Adventure', 'Thriller']","['United Kingdom', 'United States', 'Puerto Rico']","['San Juan, Puerto Rico, USA']","['Di Bonaventura Pictures', 'G-BASE', 'Lionsgate']","['English', 'Tagalog']",0,0,0,2023
62. 65,https://www.imdb.com/title/tt12261776/?ref_=sr_t_62,2023,1h 33m,PG-13,5.4,98K,An astronaut crash lands on a mysterious planet only to discover he's not alone.,45000000.0,60730568,32062904,12328361,"['Scott Beck', 'Bryan Woods']","['Scott Beck', 'Bryan Woods']","['Adam Driver', 'Ariana Greenblatt', 'Chloe Coleman']","['Dinosaur Adventure', 'Survival', 'Action', 'Adventure', 'Sci-Fi', 'Thriller']","['United States', 'Ireland', 'Australia', 'Canada']","['Bray, Ireland']","['Beck Woods', 'Bron Creative', 'Columbia Pictures']",['English'],0,0,0,2023
63. Thanksgiving,https://www.imdb.com/title/tt1448754/?ref_=sr_t_63,2023,1h 46m,R,6.2,69K,"After a Black Friday riot ends in tragedy, a mysterious Thanksgiving-inspired killer terrorizes Plymouth, Massachusetts, the birthplace of the infamous holiday.",15000000.0,46553280,31908884,10306272,['Eli Roth'],"['Jeff Rendell', 'Eli Roth']","['Patrick Dempsey', 'Ty Olsson', 'Gina Gershon']","['Slasher Horror', 'Teen Horror', 'Whodunnit', 'Comedy', 'Horror', 'Mystery', 'Thriller']","['United States', 'Canada', 'Australia']","['Port Perry, Ontario, Canada']","['TriStar Pictures', 'Spyglass Media Group', 'Ethereal Visage Productions']",['English'],0,12,0,2023
64. My Big Fat Greek Wedding 3,https://www.imdb.com/title/tt21103300/?ref_=sr_t_64,2023,1h 32m,PG-13,5.2,11K,"After the death of the family's patriarch, Toula attempts to locate her father's childhood friends in Greece for a family reunion.",,38831076,28496030,10028675,['Nia Vardalos'],['Nia Vardalos'],"['Nia Vardalos', 'John Corbett', 'Louis Mandylor']","['Romantic Comedy', 'Comedy', 'Drama', 'Romance']",['United States'],"['Corfu, Greece']","['Artistic Films', 'Focus Features', 'Gold Circle Films']","['English', 'Greek']",0,2,0,2023
65. Asteroid City,https://www.imdb.com/title/tt14230388/?ref_=sr_t_65,2023,1h 45m,PG-13,6.5,128K,World-changing events spectacularly disrupt the annual Asteroid Day celebration in an American desert town.,25000000.0,53857743,28153025,853382,['Wes Anderson'],"['Wes Anderson', 'Roman Coppola']","['Jason Schwartzman', 'Scarlett Johansson', 'Tom Hanks']","['Quirky Comedy', 'Showbiz Drama', 'Comedy', 'Drama', 'Romance', 'Sci-Fi']",['United States'],"['Chinchón, Madrid, Spain']","['Focus Features', 'Indian Paintbrush', 'American Empirical Pictures']",['English'],4,85,0,2023
66. Magic Mike's Last Dance,https://www.imdb.com/title/tt16280138/?ref_=sr_t_66,2023,1h 52m,R,5.2,19K,"Mike takes to the stage again, following a business deal that went bust, leaving him broke and taking bartender gigs in Florida. Mike heads to London with a wealthy socialite who lures him with an offer he can't refuse.",40000000.0,57105156,26005156,8305317,['Steven Soderbergh'],['Reid Carolin'],"['Channing Tatum', 'Salma Hayek', 'Ayub Khan-Din']","['Showbiz Drama', 'Comedy', 'Drama']",['United States'],[],['Warner Bros.'],['English'],0,4,0,2023
67. Strays,https://www.imdb.com/title/tt15153532/?ref_=sr_t_67,2023,1h 33m,R,6.3,34K,An abandoned dog teams up with other strays to get revenge on his former owner.,,36071267,23988885,8247810,['Josh Greenbaum'],['Dan Perrault'],"['Will Ferrell', 'Jamie Foxx', 'Isla Fisher']","['Buddy Comedy', 'Adventure', 'Comedy']","['United States', 'United Kingdom']","['Atlanta, Georgia, USA']","['Universal Pictures', 'Lord Miller', 'Picturestart']",['English'],0,0,0,2023
68. The Bikeriders,https://www.imdb.com/title/tt21454134/?ref_=sr_t_68,2023,1h 56m,R,6.7,62K,"After a chance encounter, headstrong Kathy is drawn to Benny, member of Midwestern motorcycle club the Vandals. As the club transforms into a dangerous underworld of violence, Benny must choose between Kathy and his loyalty to the club.",40000000.0,36159144,21746895,9698275,['Jeff Nichols'],"['Jeff Nichols', 'Danny Lyon']","['Austin Butler', 'Jodie Comer', 'Tom Hardy']","['Gangster', 'Period Drama', 'Crime', 'Drama']",['United States'],"['Middletown, Ohio, USA']","['Focus Features', 'Regency Enterprises', 'New Regency Productions']",['English'],0,9,0,2023
69. American Fiction,https://www.imdb.com/title/tt23561236/?ref_=sr_t_69,2023,1h 57m,R,7.5,107K,A novelist who's fed up with the establishment profiting from Black entertainment uses a pen name to write a book that propels him into the heart of the hypocrisy and madness he claims to disdain.,,22483370,21098470,224469,['Cord Jefferson'],"['Cord Jefferson', 'Percival Everett']","['Jeffrey Wright', 'Tracee Ellis Ross', 'John Ortiz']","['Dark Comedy', 'High-Concept Comedy', 'Satire', 'Comedy', 'Drama']",['United States'],"['Scituate, Massachusetts, USA']","['3 Arts Entertainment', 'MRC Film', 'Media Rights Capital (MRC)']",['English'],63,174,1,2023
70. Priscilla,https://www.imdb.com/title/tt22041854/?ref_=sr_t_70,2023,1h 53m,R,6.5,45K,"When teenage Priscilla Beaulieu meets Elvis Presley, the man who is already a meteoric rock-and-roll superstar becomes someone entirely unexpected in private moments: a thrilling crush, an ally in loneliness, a vulnerable best friend.",20000000.0,33111706,20960939,132139,['Sofia Coppola'],"['Priscilla Presley', 'Sandra Harmon', 'Sofia Coppola']","['Cailee Spaeny', 'Jacob Elordi', 'Ari Cohen']","['Coming-of-Age', 'Dark Romance', 'Docudrama', 'Period Drama', 'Showbiz Drama', 'Teen Romance', 'Biography', 'Drama', 'Music', 'Romance']","['Italy', 'United States', 'United Kingdom']","['Toronto, Ontario, Canada']","['American Zoetrope', 'The Apartment', 'Fremantle']",['English'],6,35,0,2023
"71. Are You There God? It's Me, Margaret.",https://www.imdb.com/title/tt9185206/?ref_=sr_t_71,2023,1h 46m,PG-13,7.3,33K,"Eleven-year-old Margaret moves from the city to the suburbs and starts to contemplate everything about life, friendship and adolescence. She relies on her mother, Barbara, who offers loving support, and her grandmother, Sylvia.",30000000.0,21464043,20372406,6739037,['Kelly Fremon Craig'],"['Kelly Fremon Craig', 'Judy Blume']","['Abby Ryder Fortson', 'Rachel McAdams', 'Kathy Bates']","['Coming-of-Age', 'Comedy', 'Drama', 'Family']",['United States'],"['Charlotte, North Carolina, USA']","['Gracie Films', 'Lionsgate']","['English', 'Hebrew']",26,82,0,2023
72. The Holdovers,https://www.imdb.com/title/tt14849194/?ref_=sr_t_72,2023,2h 13m,R,7.9,193K,"A curmudgeonly instructor at a New England school remains on campus during Christmas break. He soon forms an unlikely bond with a brainy but damaged troublemaker, and with the school's cook, a woman who just lost a son in the Vietnam War.",,45729236,20355375,211093,['Alexander Payne'],['David Hemingson'],"['Paul Giamatti', ""Da'Vine Joy Randolph"", 'Dominic Sessa']","['Holiday Comedy', 'Comedy', 'Drama', 'Holiday']",['United States'],"['Groton School, 282 Farmers Row, Groton, Massachusetts, USA']","['Miramax', 'CAA Media Finance', 'Gran Via Productions']",['English'],137,212,1,2023
73. The Pope's Exorcist,https://www.imdb.com/title/tt13375076/?ref_=sr_t_73,2023,1h 43m,R,6.1,94K,"In 1987, Gabriel Amorth, the Vatican's leading exorcist, investigates the demonic possession of an American boy in Spain, and discovers a secret the Vatican has tried to keep buried for centuries.",18000000.0,76987621,20009380,9006368,['Julius Avery'],"['Michael Petroni', 'Evan Spiliotopoulos', 'R. Dean McCreary']","['Russell Crowe', 'Daniel Zovatto', 'Alexandra Essoe']","['Supernatural Horror', 'Horror', 'Thriller']","['United States', 'Spain', 'United Kingdom']","['Trinity College, College Green, Dublin 2, Ireland']","['Screen Gems', '2.0 Entertainment', 'Loyola Productions']","['English', 'Italian', 'Spanish', 'Latin', 'German']",0,3,0,2023
74. Ferrari,https://www.imdb.com/title/tt3758542/?ref_=sr_t_74,2023,2h 10m,R,6.4,61K,"Set in the summer of 1957, with Enzo Ferrari's auto empire in crisis, the ex-racer turned entrepreneur pushes himself and his drivers to the edge as they launch into the Mille Miglia, a treacherous 1,000-mile race across Italy.",110000000.0,43601123,18550028,3921773,['Michael Mann'],"['Troy Kennedy Martin', 'Brock Yates']","['Adam Driver', 'Shailene Woodley', 'Giuseppe Festinese']","['Docudrama', 'Motorsport', 'Biography', 'Drama', 'History', 'Sport']","['United States', 'United Kingdom', 'Italy', 'Saudi Arabia']","['Modena, Emilia-Romagna, Italy']","['Forward Pass', 'Storyteller Productions', 'Lady Bacardi Media']",['English'],6,41,0,2023
75. Book Club: The Next Chapter,https://www.imdb.com/title/tt20768712/?ref_=sr_t_75,2023,1h 47m,PG-13,5.6,8.3K,Follows the new journey of four best friends as they take their book club to Italy for the fun girls trip they never had.,20000000.0,29014500,17581565,6677580,['Bill Holderman'],"['Bill Holderman', 'Erin Simms']","['Diane Keaton', 'Jane Fonda', 'Candice Bergen']","['Romantic Comedy', 'Comedy', 'Romance']",['United States'],[],"['Focus Features', 'Apartment Story', 'Fifth Season']","['English', 'Italian']",2,0,0,2023
