Title,Movie Link,Year,Duration,MPA,Rating,Votes,Description,budget,grossWorldWide,gross_US_Canada,opening_weekend_Gross,directors,writers,stars,genres,countries_origin,filming_locations,production_companies,Languages,wins,nominations,oscars,release_date
89. X: The Man with the X-Ray Eyes,https://www.imdb.com/title/tt0057693/?ref_=sr_t_89,1963,1h 19m,Approved,6.6,8.6K,"An ambitious scientist invents an eye drop formula that grants him X-ray vision, but his new powers have disastrous consequences.",250000.0,,,,['Roger Corman'],"['Robert Dillon', 'Ray Russell']","['Ray Milland', 'Diana Van der Vlis', 'Harold J. Stone']","['Horror', 'Sci-Fi', 'Thriller']",['United States'],"['Queen of Angels Hospital - 2301 Bellevue Avenue, Los Angeles, California, USA']",['Alta Vista Productions'],['English'],0,2,0,1963
90. Judex,https://www.imdb.com/title/tt0057207/?ref_=sr_t_90,1963,1h 38m,Not Rated,7.0,3K,"After abducting a corrupt banker to make him pay back the people he swindled, a conjuring vigilante must rescue the man's daughter when she is kidnapped by the scheming family governess.",,,,,['Georges Franju'],"['Arthur Bernède', 'Louis Feuillade', 'Jacques Champreux']","['Channing Pollock', 'Francine Bergé', 'Edith Scob']","['Caper', 'Costume Drama', 'Gangster', 'Period Drama', 'Crime', 'Drama', 'Thriller']","['France', 'Italy']","['Château-Gaillard, Les Andelys, France']","['Comptoir Français du Film Production (CFFP)', 'Filmes Cinematografica', 'C.F.P.C.']",['French'],0,0,0,1963
91. Sunday in New York,https://www.imdb.com/title/tt0057543/?ref_=sr_t_91,1963,1h 45m,Approved,6.7,3.5K,"On a Sunday, Eileen Tyler, still a virgin, leaves Albany to visit her airline pilot brother in New York but a chance encounter with a man on a city bus threatens to derail her upcoming marriage to boyfriend Russ.",2000000.0,,,,['Peter Tewksbury'],['Norman Krasna'],"['Rod Taylor', 'Jane Fonda', 'Cliff Robertson']","['Comedy', 'Romance']",['United States'],"['Pennsylvania Station, Manhattan, New York City, New York, USA']","['Seven Arts Productions', 'Metro-Goldwyn-Mayer (MGM)']",['English'],0,0,0,1963
92. The Organizer,https://www.imdb.com/title/tt0056945/?ref_=sr_t_92,1963,2h 6m,Not Rated,8.0,3.5K,A former high school teacher turned unionist tries to organize workers laboring with inhuman conditions at a late 19th Century textile factory.,,,,,['Mario Monicelli'],"['Agenore Incrocci', 'Furio Scarpelli', 'Mario Monicelli']","['Marcello Mastroianni', 'Renato Salvatori', 'Gabriella Giorgelli']","['Workplace Drama', 'Drama', 'History']","['Italy', 'France', 'Yugoslavia']","['Turin, Piedmont, Italy']","['Lux Film', 'Vides Cinematografica', 'Méditerrannée Cinéma Production']",['Italian'],6,9,1,1963
93. Sparrows Can't Sing,https://www.imdb.com/title/tt0057521/?ref_=sr_t_93,1963,1h 34m,,6.2,565,"After 2 years at sea, Charlie comes home to find his house demolished, wife Maggie gone, living with married Bert and their toddler. Charlie leaves a trail of mayhem as he tries to sort things out.",,,,,['Joan Littlewood'],"['Stephen Lewis', 'Joan Littlewood']","['James Booth', 'Barbara Windsor', 'Roy Kinnear']","['Comedy', 'Drama']",['United Kingdom'],"['Cowley Gardens - now Oyster Row, Shadwell, London, England, UK']",['Carthage Films'],['English'],0,0,0,1963
94. The Rescue Squad,https://www.imdb.com/title/tt0170506/?ref_=sr_t_94,1963,54m,,7.1,9,Six children lose a toy plane in a high ruined tower.,,,,,['Colin Bell'],"['Mary Cathcart Borer', 'Malcolm Stewart', 'Frank Wells']","['Christopher Brett', 'Shirley Joy', 'Malcolm Knight']",['Family'],['United Kingdom'],[],['World Wide'],['English'],0,0,0,1963
95. The Stripper,https://www.imdb.com/title/tt0057537/?ref_=sr_t_95,1963,1h 35m,Approved,6.6,465,"Lila Green is an insecure and aging showgirl for Madame Olga's stage shows. When her boyfriend, Rick, runs off with the show's money, Madame Olga and Ronny let Lila go. Lila goes to stay with her old neighbors, Helen Bard and her teenage son, Kenny. Lila decides to go out and get a regular job and try and live a normal life. All seems well, until Lila and Kenny stop fighting their attraction for one another.",,,,,['Franklin J. Schaffner'],"['William Inge', 'Meade Roberts']","['Joanne Woodward', 'Richard Beymer', 'Claire Trevor']","['Drama', 'Romance']",['United States'],"['20th Century Fox Studios - 10201 Pico Blvd., Century City, Los Angeles, California, USA']","['Jerry Wald Productions', 'Twentieth Century Fox']",['English'],0,2,1,1963
96. A Child Is Waiting,https://www.imdb.com/title/tt0056930/?ref_=sr_t_96,1963,1h 42m,Approved,7.2,3.6K,A teacher and a psychologist work with children at an institute for the mentally-imparied.,2000000.0,1675.0,,,['John Cassavetes'],['Abby Mann'],"['Burt Lancaster', 'Judy Garland', 'Gena Rowlands']",['Drama'],['United States'],"['Lanterman Development Center - 3530 W Pomona Blvd, Pomona, California, USA']",['Stanley Kramer Productions'],['English'],0,0,0,1963
97. Heavens Above!,https://www.imdb.com/title/tt0057134/?ref_=sr_t_97,1963,1h 45m,Not Rated,6.7,1.7K,A minister is accidentally appointed to a snobbish parish.,,,,,"['John Boulting', 'Roy Boulting']","['Frank Harvey', 'John Boulting', 'Malcolm Muggeridge']","['Peter Sellers', 'Cecil Parker', 'Isabel Jeans']","['Satire', 'Comedy']",['United Kingdom'],"['Claremont House, Esher, Surrey, England, UK']",['Charter Film Productions'],"['English', 'Hindi', 'French', 'Italian']",0,0,0,1963
98. Summer Holiday,https://www.imdb.com/title/tt0057541/?ref_=sr_t_98,1963,1h 47m,Approved,6.1,1.9K,"Four bus mechanics and a stowaway travel Europe as a hotel, picking up singers. In Athens, the stowaway's mother has them arrested for kidnapping but then accepts her daughter's love for a mechanic and they vacation in Greece.",,1315.0,,,['Peter Yates'],"['Peter Myers', 'Ronald Cass']","['Cliff Richard', 'Lauri Peters', 'Melvyn Hayes']","['Comedy', 'Musical', 'Romance']",['United Kingdom'],"['Elstree Studios, Borehamwood, Hertfordshire, England, UK']",['Ivy Films'],"['English', 'French']",0,0,0,1963
99. Carry on Cabby,https://www.imdb.com/title/tt0056912/?ref_=sr_t_99,1963,1h 31m,,6.4,3.2K,A taxi company is threatened when an all-female firm sets itself up in business and starts to steal their customers.,,,,,['Gerald Thomas'],"['Talbot Rothwell', 'Sidney Green', 'Richard Hills']","['Sidney James', 'Hattie Jacques', 'Kenneth Connor']","['Parody', 'Adventure', 'Comedy', 'Romance']",['United Kingdom'],"['Farm Yard, Datchet Road, Windsor, Berkshire, England, UK']",['Peter Rogers Productions'],['English'],0,0,0,1963
100. Who's Minding the Store?,https://www.imdb.com/title/tt0057683/?ref_=sr_t_100,1963,1h 30m,Approved,6.7,2.9K,"Norman Phiffier works as a store clerk in a large department store. Clumsy and inept, he can't do anything right. Boy are they in trouble!",,,,,['Frank Tashlin'],"['Frank Tashlin', 'Harry Tugend']","['Jerry Lewis', 'Jill St. John', 'Ray Walston']","['Slapstick', 'Comedy']",['United States'],"['Paramount Studios - 5555 Melrose Avenue, Hollywood, Los Angeles, California, USA']","['Jerry Lewis Pictures', 'York Pictures Corporation']",['English'],0,0,0,1963
