Title,Movie Link,Year,Duration,MPA,Rating,Votes,Description,budget,grossWorldWide,gross_US_Canada,opening_weekend_Gross,directors,writers,stars,genres,countries_origin,filming_locations,production_companies,Languages,wins,nominations,oscars,release_date
89. The French Sex Murders,https://www.imdb.com/title/tt0069850/?ref_=sr_t_89,1972,1h 28m,Not Rated,5.2,1.2K,"A man is accused of killing his favorite prostitute in a French brothel. He's tried and sentenced to death. He tries to escape but dies during pursuit. Soon, people connected to the case are killed one by one.",,,,,['Ferdinando Merighi'],"['Paolo Daniele', 'Marius Mattei', 'Ferdinando Merighi']","['Anita Ekberg', 'Rosalba Neri', 'Evelyne Kraft']","['Giallo', 'Whodunnit', 'Drama', 'Horror', 'Mystery', 'Thriller']","['Italy', 'West Germany', 'France']","['Eiffel Tower, Paris, Ile de France, France']","['Costantino International Films', 'Eurociné', 'Gopa-Film']","['French', 'German', 'English', 'Italian']",0,0,0,1972
90. Season of the Witch,https://www.imdb.com/title/tt0069239/?ref_=sr_t_90,1972,2h 10m,R,5.6,4.1K,"A neglected, unhappy suburban housewife gets mixed up in witchcraft with unexpected consequences.",90000.0,,,,['George A. Romero'],['George A. Romero'],"['Jan White', 'Raymond Laine', 'Ann Muffly']","['Witch Horror', 'Drama', 'Horror']",['United States'],"['North Hills, Pittsburgh, Pennsylvania, USA']",['The Latent Image'],['English'],0,0,0,1972
"91. X, Y & Zee",https://www.imdb.com/title/tt0069516/?ref_=sr_t_91,1972,1h 50m,PG,5.8,1.5K,"The venomous and amoral wife of a wealthy architect tries, any way she can, to break up the blossoming romance between her husband and his new mistress; a good-natured young widow who holds a dark past.",,,1356807.0,,['Brian G. Hutton'],"[""Edna O'Brien""]","['Elizabeth Taylor', 'Michael Caine', 'Susannah York']",['Drama'],['United Kingdom'],"['Alembic House - 93 Albert Embankment, Vauxhall, London, England, UK']","['Columbia Pictures', 'Zee Company']","['English', 'Italian']",0,0,0,1972
"92. A Reason to Live, a Reason to Die",https://www.imdb.com/title/tt0069159/?ref_=sr_t_92,1972,1h 32m,PG,6.1,2.4K,"Branded a coward for surrendering his New Mexico fort to the Confederates without firing a shot, a Union colonel leads a band of condemned prisoners on a suicide mission to recapture it.",,,,,['Tonino Valerii'],"['Ernesto Gastaldi', 'Tonino Valerii', 'Rafael Azcona']","['James Coburn', 'Bud Spencer', 'Telly Savalas']","['Spaghetti Western', 'Drama', 'Western']","['Italy', 'France', 'West Germany', 'Spain']","['Almería, Andalucía, Spain']","['Atlántida Films', 'Europrodis', 'Heritage Entertainment Inc.']",['English'],0,0,0,1972
93. Ben,https://www.imdb.com/title/tt0068264/?ref_=sr_t_93,1972,1h 34m,PG,5.3,3.7K,"A lonely boy befriends Ben, the leader of a violent swarm of killer rats.",,,769986.0,,['Phil Karlson'],"['Stephen Gilbert', 'Gilbert Ralston']","['Lee Montgomery', 'Joseph Campanella', ""Arthur O'Connell""]","['B-Horror', 'Drama', 'Horror', 'Thriller']",['United States'],"['Higgins-Verbeck-Hirsch Mansion - 637 South Lucerne Boulevard, Windsor Square, Los Angeles, California, USA']",['Bing Crosby Productions'],['English'],0,0,1,1972
94. Female Prisoner #701: Scorpion,https://www.imdb.com/title/tt0226872/?ref_=sr_t_94,1972,1h 27m,Not Rated,7.2,5.1K,"After being used and betrayed by the detective she had fallen in love with, young Matsu is sent to a female prison full of sadistic guards and disobedient prisoners.",,,,,"[""Shun'ya Itô""]","['Fumio Kônami', 'Hirô Matsuda', 'Tooru Shinohara']","['Meiko Kaji', 'Rie Yokoyama', 'Yayoi Watanabe']","['Prison Drama', 'Crime', 'Drama', 'Thriller']",['Japan'],['Japan'],['Toei Company'],['Japanese'],0,0,0,1972
95. Roma,https://www.imdb.com/title/tt0069191/?ref_=sr_t_95,1972,2h,R,7.3,14K,"A fluid, unconnected and sometimes chaotic procession of scenes detailing the various people and events of life in Italy's capital, most of it based on director Federico Fellini's life.",,807.0,,,['Federico Fellini'],"['Federico Fellini', 'Bernardino Zapponi']","['Britta Barnes', 'Peter Gonzales Falcon', 'Fiona Florence']","['Satire', 'Comedy', 'Drama']","['Italy', 'France']","['Rome, Lazio, Italy']","['Ultra Film', 'Les Productions Artistes Associés']","['Italian', 'German', 'English', 'French', 'Latin', 'Spanish']",3,3,0,1972
"96. Brother Sun, Sister Moon",https://www.imdb.com/title/tt0069824/?ref_=sr_t_96,1972,2h 1m,PG,7.2,5.1K,"Dramatization of events in the life of St. Francis of Assisi from before his conversion experience through his audience with the pope, including his friendship with St. Clare.",3000000.0,,,,['Franco Zeffirelli'],"[""Suso Cecchi D'Amico"", 'Charles Dyer', 'Kenneth Ross']","['Graham Faulkner', 'Judi Bowker', 'Leigh Lawson']","['Period Drama', 'Biography', 'Drama', 'History', 'War']","['United Kingdom', 'Italy']","['Monreale, Palermo, Sicily, Italy']","['Euro International Films', 'Vic Films Productions']","['Italian', 'English']",3,2,1,1972
97. Across 110th Street,https://www.imdb.com/title/tt0068168/?ref_=sr_t_97,1972,1h 42m,R,7.0,7.4K,Two New York City cops go after amateur crooks who are trying to rip off the Mafia and start a gang war.,,10000000.0,3601306.0,,['Barry Shear'],"['Luther Davis', 'Wally Ferris']","['Anthony Quinn', 'Yaphet Kotto', 'Anthony Franciosa']","['Tragedy', 'Action', 'Crime', 'Drama', 'Thriller']",['United States'],"['Apollo Theatre - 253 W. 125th Street, Harlem, Manhattan, New York City, New York, USA']",['Film Guarantors'],"['English', 'Italian']",0,0,0,1972
98. The Ruling Class,https://www.imdb.com/title/tt0069198/?ref_=sr_t_98,1972,2h 34m,PG,7.2,7K,"A member of the House of Lords dies, leaving his estate to his son. Unfortunately, his son thinks he is Jesus Christ. Their other, somewhat more respectable family members plot to steal the estate from him; murder and mayhem ensue.",,,,,['Peter Medak'],['Peter Barnes'],"[""Peter O'Toole"", 'Alastair Sim', 'Arthur Lowe']","['Dark Comedy', 'Parody', 'Satire', 'Comedy', 'Drama', 'Musical']",['United Kingdom'],"['Harlaxton Manor, Harlaxton, Lincolnshire, England, UK']",['Keep Films'],"['English', 'French', 'Italian', 'German', 'Latin']",2,4,1,1972
99. State of Siege,https://www.imdb.com/title/tt0070959/?ref_=sr_t_99,1972,2h,Not Rated,7.7,6.3K,"Using the interrogation of a US counterinsurgency agent as a backdrop, the film explores the consequences of the struggle between Uruguay's government and the leftist Tupamaro guerrillas.",,,1127482.0,,['Costa-Gavras'],"['Franco Solinas', 'Costa-Gavras']","['Yves Montand', 'Renato Salvatori', 'O.E. Hasse']","['Crime', 'Drama', 'Mystery', 'Thriller']","['France', 'Italy', 'West Germany', 'Chile']","['Cerro Playa Ancha, Valparaíso, Región de Valparaíso, Chile']","['Reggane Films', 'Euro International Films', 'Unidis']","['French', 'English']",2,5,0,1972
100. Fat City,https://www.imdb.com/title/tt0068575/?ref_=sr_t_100,1972,1h 36m,PG,7.2,11K,"Two men, working as professional boxers, come to blows when their careers each begin to take different directions.",,,,,['John Huston'],['Leonard Gardner'],"['Stacy Keach', 'Jeff Bridges', 'Susan Tyrrell']","['Drama', 'Sport']",['United States'],"['Stockton Memorial Civic Auditorium, Stockton, California, USA']","['Columbia Pictures', 'Rastar Pictures']","['English', 'Spanish']",4,4,1,1972
