Title,Movie Link,Year,Duration,MPA,Rating,Votes,Description,budget,grossWorldWide,gross_US_Canada,opening_weekend_Gross,directors,writers,stars,genres,countries_origin,filming_locations,production_companies,Languages,wins,nominations,oscars,release_date
82. Don't Be a Menace to South Central While Drinking Your Juice in the Hood,https://www.imdb.com/title/tt0116126/?ref_=sr_t_82,1996,1h 29m,R,6.5,64K,"A parody of several U.S. films about being in the 'Hood', for instance Boyz n the Hood (1991), South Central (1992), Menace II Society (1993), Higher Learning (1995) and Juice (1992).",3800000.0,20949601,20109115,8112884,['Paris Barclay'],"['Shawn Wayans', 'Marlon Wayans', 'Phil Beauman']","['Shawn Wayans', 'Marlon Wayans', 'Keenen Ivory Wayans']","['Buddy Comedy', 'Dark Comedy', 'Parody', 'Slapstick', 'Comedy', 'Crime']",['United States'],"['S 7th Ave & Montclair St, Los Angeles, California, USA']","['Island Pictures', 'Ivory Way Productions']","['English', 'Spanish']",0,0,0,1996
83. Flipper,https://www.imdb.com/title/tt0116322/?ref_=sr_t_83,1996,1h 35m,PG,5.3,12K,A teenage boy sent to spend the summer with his eccentric uncle on the Florida coast befriends a remarkable dolphin and takes on local bad guys who are polluting the water.,25530000.0,20080020,20080020,4209525,['Alan Shapiro'],"['Ricou Browning', 'Jack Cowden', 'Arthur Weiss']","['Paul Hogan', 'Elijah Wood', 'Jonathan Banks']","['Adventure', 'Crime', 'Drama', 'Family']",['United States'],"[""Stuart Cove's, New Providence Island, Bahamas""]","['Universal Pictures', 'American Films', 'The Bubble Factory']",['English'],0,5,0,1996
84. Mother,https://www.imdb.com/title/tt0117091/?ref_=sr_t_84,1996,1h 44m,PG-13,6.9,7.1K,"A neurotic, twice-divorced sci-fi writer moves back in with his mother to solve his personal problems.",,19145198,19145198,137701,['Albert Brooks'],"['Albert Brooks', 'Monica Mcgowan Johnson']","['Albert Brooks', 'Debbie Reynolds', 'Paul Collins']","['Buddy Comedy', 'Satire', 'Comedy', 'Drama']",['United States'],"['Sausalito, California, USA']","['Paramount Pictures', 'Scott Rudin Productions']",['English'],3,5,0,1996
85. Bed of Roses,https://www.imdb.com/title/tt0115644/?ref_=sr_t_85,1996,1h 27m,PG,6.1,9K,Follows a young career girl who is swept off her feet by a shy florist who fell in love with her after one glimpse through a shadowy window.,,27315527,19030691,6117558,['Michael Goldenberg'],['Michael Goldenberg'],"['Christian Slater', 'Mary Stuart Masterson', 'Pamela Adlon']","['Drama', 'Romance']",['United States'],"['New York City, New York, USA']","['Juno Pix', 'New Line Cinema']",['English'],0,0,0,1996
86. Kazaam,https://www.imdb.com/title/tt0116756/?ref_=sr_t_86,1996,1h 33m,PG,3.1,26K,"A troubled kid inadvertently releases a genie, who must grant him any three wishes he requests.",20000000.0,18937262,18937262,5001588,['Paul Michael Glaser'],"['Paul Michael Glaser', 'Christian Ford', 'Roger Soffer']","[""Shaquille O'Neal"", 'Francis Capra', 'Ally Walker']","['Comedy', 'Family', 'Fantasy', 'Musical']",['United States'],"['Brooklyn, New York City, New York, USA']","['Touchstone Pictures', 'Interscope Communications', 'Polygram Filmed Entertainment']",['English'],0,2,0,1996
87. The Fan,https://www.imdb.com/title/tt0116277/?ref_=sr_t_87,1996,1h 56m,R,5.9,52K,An all-star baseball player becomes the unhealthy focus of an obsessive salesman.,55000000.0,18626419,18626419,6271406,['Tony Scott'],"['Peter Abrahams', 'Phoef Sutton']","['Robert De Niro', 'Wesley Snipes', 'Ellen Barkin']","['Action', 'Drama', 'Sport', 'Thriller']",['United States'],"['Angel Stadium of Anaheim - 2000 Gene Autry Way, Anaheim, California, USA']","['TriStar Pictures', 'Mandalay Entertainment', 'Scott Free Productions']","['English', 'Spanish']",0,3,0,1996
88. Last Man Standing,https://www.imdb.com/title/tt0116830/?ref_=sr_t_88,1996,1h 41m,R,6.4,62K,A drifting gunslinger-for-hire finds himself in the middle of an ongoing war between the Irish and Italian mafia in a Prohibition era ghost town.,67000000.0,47267001,18115927,7010333,['Walter Hill'],"['Ryûzô Kikushima', 'Akira Kurosawa', 'Walter Hill']","['Bruce Willis', 'Bruce Dern', 'William Sanderson']","['Action', 'Crime', 'Drama', 'Thriller']",['United States'],"['Cerro Pelon Movie Ranch - 5547 Highway 41, Galisteo, New Mexico, USA']","['New Line Cinema', 'Lone Wolf']","['English', 'Spanish']",0,0,0,1996
89. The Crow: City of Angels,https://www.imdb.com/title/tt0115986/?ref_=sr_t_89,1996,1h 24m,R,4.6,23K,The spirit of the Crow resurrects a car mechanic seeking revenge for the murder of his son.,13000000.0,17917287,17917287,9785111,['Tim Pope'],"[""James O'Barr"", 'David S. Goyer']","['Vincent Perez', 'Mia Kirshner', 'Richard Brooks']","['Dark Comedy', 'Superhero', 'Action', 'Crime', 'Fantasy', 'Horror', 'Thriller']",['United States'],"['Front Street Studios, Los Angeles, California, USA']","['Bad Bird Productions', 'Dimension Films', 'Image Comics']",['English'],2,3,0,1996
90. Extreme Measures,https://www.imdb.com/title/tt0116259/?ref_=sr_t_90,1996,1h 58m,R,6.2,21K,A young doctor confronts a famous colleague when he learns about the true methods of his work.,38000000.0,17380126,17380126,6906546,['Michael Apted'],"['Michael Palmer', 'Tony Gilroy']","['Hugh Grant', 'Gene Hackman', 'Sarah Jessica Parker']","['Medical Drama', 'Crime', 'Drama', 'Mystery', 'Thriller']","['United Kingdom', 'United States', 'Canada']","['Lower Bay Station, Toronto, Ontario, Canada']","['Castle Rock Entertainment', 'Simian Films', 'Starcraft Services']",['English'],0,0,0,1996
91. The Phantom,https://www.imdb.com/title/tt0117331/?ref_=sr_t_91,1996,1h 40m,PG,5.1,37K,"The Phantom, descendent of a line of African superheroes, travels to New York City to thwart a wealthy criminal genius from obtaining three magic skulls which would give him the secret to ultimate power.",45000000.0,17323326,17323326,5072346,['Simon Wincer'],"['Lee Falk', 'Jeffrey Boam']","['Billy Zane', 'Kristy Swanson', 'Treat Williams']","['Superhero', 'Action', 'Adventure', 'Comedy', 'Fantasy']","['Australia', 'United States']","['Krabi, Thailand']","['Paramount Pictures', 'The Ladd Company', 'Boam Productions']",['English'],3,0,0,1996
92. Fled,https://www.imdb.com/title/tt0116320/?ref_=sr_t_92,1996,1h 38m,R,5.4,10K,Two prisoners chained together flee during an escape attempt gone bad.,25000000.0,17193231,17193231,5405855,['Kevin Hooks'],['Preston A. Whitmore II'],"['Laurence Fishburne', 'Stephen Baldwin', 'Will Patton']","['Dark Comedy', 'Action', 'Adventure', 'Comedy', 'Crime', 'Drama', 'Romance']",['United States'],"['Georgia Dome - One Georgia Dome Drive, Atlanta, Georgia, USA']","['Frank Mancuso Jr. Productions', 'Metro-Goldwyn-Mayer (MGM)']","['English', 'Spanish']",0,0,0,1996
93. Diabolique,https://www.imdb.com/title/tt0116095/?ref_=sr_t_93,1996,1h 47m,R,5.5,16K,The wife and mistress of the sadistic dean of an exclusive prep school conspire to murder him.,,17100266,17100266,5524055,['Jeremiah S. Chechik'],"['Pierre Boileau', 'Thomas Narcejac', 'Henri-Georges Clouzot']","['Sharon Stone', 'Isabelle Adjani', 'Chazz Palminteri']","['Erotic Thriller', 'Drama', 'Horror', 'Mystery', 'Thriller']",['United States'],"['Uniontown, Pennsylvania, USA']","['ABC Productions', 'Marvin Worth Productions', 'Morgan Creek Entertainment']","['English', 'Spanish']",2,0,0,1996
94. The Frighteners,https://www.imdb.com/title/tt0116365/?ref_=sr_t_94,1996,1h 50m,R,7.1,98K,"After a tragic car accident that kills his wife, a man discovers he can communicate with the dead, and he uses that gift to con people. However, when a demonic spirit appears, he may be the only one who can stop it from killing the living and the dead.",30000000.0,29359216,16759216,5565495,['Peter Jackson'],"['Fran Walsh', 'Peter Jackson']","['Michael J. Fox', 'Trini Alvarado', 'Peter Dobson']","['Dark Comedy', 'Dark Fantasy', 'High-Concept Comedy', 'Quirky Comedy', 'Supernatural Fantasy', 'Supernatural Horror', 'Comedy', 'Fantasy', 'Horror']","['New Zealand', 'United States']","['Wellington, New Zealand']","['Universal Pictures', 'WingNut Films']",['English'],3,17,0,1996
95. Trainspotting,https://www.imdb.com/title/tt0117951/?ref_=sr_t_95,1996,1h 33m,R,8.1,744K,"Renton, deeply immersed in the Edinburgh drug scene, tries to clean up and get out despite the allure of drugs and the influence of friends.",1500000.0,16981823,16491080,262673,['Danny Boyle'],"['Irvine Welsh', 'John Hodge']","['Ewan McGregor', 'Ewen Bremner', 'Jonny Lee Miller']","['Dark Comedy', 'Psychological Drama', 'Drama']","['United Kingdom', 'United States']","['Corrour Railway Station, Highland, Scotland, UK']","['Miramax', 'Channel Four Films', 'Figment Films']",['English'],23,35,1,1996
96. First Strike,https://www.imdb.com/title/tt0116704/?ref_=sr_t_96,1996,1h 47m,PG-13,6.6,23K,This fourth installment of Chan's Police Story film franchise has our hero trying to locate a missing nuclear warhead.,,21890845,15318863,5778933,['Stanley Tong'],"['Greg Mellott', 'Elliot Tong', 'Stanley Tong']","['Jackie Chan', 'Jackson Lou', 'Annie Wu']","['Action', 'Adventure', 'Comedy', 'Crime', 'Drama', 'Thriller']",['Hong Kong'],"['Falls Creek, Victoria, Australia']","['Golden Harvest Company', 'Paragon Films Ltd.', 'Raymond Chow']","['Cantonese', 'Mandarin', 'Russian', 'Ukrainian']",2,9,0,1996
97. Thinner,https://www.imdb.com/title/tt0117894/?ref_=sr_t_97,1996,1h 33m,R,5.8,35K,An obese attorney is cursed by a gypsy to rapidly and uncontrollably lose weight.,8000000.0,15315484,15315484,5679046,['Tom Holland'],"['Stephen King', 'Michael McDowell', 'Tom Holland']","['Robert John Burke', 'Joe Mantegna', 'Lucinda Jenney']","['Body Horror', 'Fantasy', 'Horror']",['United States'],"['Belfast, Maine, USA']",['Spelling Films'],['English'],0,2,0,1996
98. The Adventures of Pinocchio,https://www.imdb.com/title/tt0115472/?ref_=sr_t_98,1996,1h 36m,G,5.2,6.4K,"One of puppet-maker Geppetto's creations comes magically to life. This puppet named Pinocchio has one major desire, to become a real boy someday, but he has to learn to act responsibly.",25000000.0,15094530,15094530,3832551,['Steve Barron'],"['Sherry Mills', 'Steve Barron', 'Tom Benedek']","['Martin Landau', 'Jonathan Taylor Thomas', 'Geneviève Bujold']","['Adventure', 'Drama', 'Family', 'Fantasy', 'Musical']","['United States', 'Germany', 'United Kingdom', 'Czech Republic', 'France']",['Croatia'],"['New Line Cinema', 'Savoy Pictures', 'Twin Continental Films']",['English'],0,2,0,1996
99. The Substitute,https://www.imdb.com/title/tt0117774/?ref_=sr_t_99,1996,1h 54m,R,6.0,17K,Shale's Mercenary team is retired after a (not so) covert mission in Cuba. He becomes a substitute teacher at his teacher fiancee's Miami high school to get those behind kneecapping her. His team helps him.,,14818176,14818176,6096833,['Robert Mandel'],"['Roy Frumkes', 'Rocco Simonelli', 'Alan Ormsby']","['Tom Berenger', 'Raymond Cruz', 'William Forsythe']","['Action', 'Crime', 'Drama', 'Thriller']",['United States'],"['Miami Senior High School, Miami, Florida, USA']","['Dinamo Entertainment', 'H2 Productions', 'Live Entertainment']","['English', 'Spanish']",0,0,0,1996
100. Flirting with Disaster,https://www.imdb.com/title/tt0116324/?ref_=sr_t_100,1996,1h 32m,R,6.7,20K,"A young man, his wife, and his incompetent case worker travel across country to find his birth parents.",7000000.0,14702438,14702438,164458,['David O. Russell'],['David O. Russell'],"['Ben Stiller', 'Patricia Arquette', 'Téa Leoni']","['Dark Comedy', 'Road Trip', 'Comedy']",['United States'],"['Battle Creek, Michigan, USA']",['Miramax'],['English'],0,10,0,1996
