Title,Movie Link,Year,Duration,MPA,Rating,Votes,Description,budget,grossWorldWide,gross_US_Canada,opening_weekend_Gross,directors,writers,stars,genres,countries_origin,filming_locations,production_companies,Languages,wins,nominations,oscars,release_date
1. Independence Day,https://www.imdb.com/title/tt0116629/?ref_=sr_t_1,1996,2h 25m,PG-13,7.0,623K,"The aliens are coming and their goal is to invade and destroy Earth. Fighting superior technology, mankind's best weapon is the will to survive.",75000000.0,817400891,306169268,50228264,['Roland Emmerich'],"['Dean Devlin', 'Roland Emmerich']","['Will Smith', 'Bill Pullman', 'Jeff Goldblum']","['Action Epic', 'Alien Invasion', 'Sci-Fi Epic', 'Space Sci-Fi', 'Action', 'Adventure', 'Sci-Fi']",['United States'],"['Bonneville Salt Flats, Utah, USA']","['Twentieth Century Fox', 'Centropolis Entertainment']",['English'],35,35,1,1996
2. Twister,https://www.imdb.com/title/tt0117998/?ref_=sr_t_2,1996,1h 53m,PG-13,6.5,242K,Two storm chasers on the brink of divorce must work together to create an advanced weather alert system by putting themselves in the cross-hairs of extremely violent tornadoes.,92000000.0,494580615,241830615,41059405,['Jan de Bont'],"['Michael Crichton', 'Anne-Marie Martin']","['Helen Hunt', 'Bill Paxton', 'Jami Gertz']","['Disaster', 'Survival', 'Action', 'Adventure', 'Thriller']",['United States'],"['Ames, Iowa, USA']","['Warner Bros.', 'Universal Pictures', 'Amblin Entertainment']",['English'],11,17,2,1996
3. Mission: Impossible,https://www.imdb.com/title/tt0117060/?ref_=sr_t_3,1996,1h 50m,PG-13,7.2,484K,"An American agent, under false suspicion of disloyalty, must discover and expose the real spy without the help of his organization.",80000000.0,457696391,180981856,45436830,['Brian De Palma'],"['Bruce Geller', 'David Koepp', 'Steven Zaillian']","['Tom Cruise', 'Jon Voight', 'Emmanuelle Béart']","['Spy', 'Urban Adventure', 'Action', 'Adventure', 'Thriller']",['United States'],"['Charles Bridge, Old Town, Prague, Czech Republic']","['Paramount Pictures', 'Cruise/Wagner Productions']","['English', 'French', 'Czech']",3,17,0,1996
4. Jerry Maguire,https://www.imdb.com/title/tt0116695/?ref_=sr_t_4,1996,2h 19m,R,7.3,296K,"When a sports agent has a moral epiphany and is fired for expressing it, he decides to put his new philosophy to the test as an independent agent with the only athlete who stays with him and his former colleague.",50000000.0,273552592,153952592,17084296,['Cameron Crowe'],['Cameron Crowe'],"['Tom Cruise', 'Cuba Gooding Jr.', 'Renée Zellweger']","['Feel-Good Romance', 'Football', 'Romantic Comedy', 'Workplace Drama', 'Comedy', 'Drama', 'Romance', 'Sport']",['United States'],"[""Paco's Tacos - 4141 S. Centinela Avenue, Culver City, California, USA""]","['TriStar Pictures', 'Gracie Films']","['English', 'American Sign Language']",26,41,1,1996
5. Ransom,https://www.imdb.com/title/tt0117438/?ref_=sr_t_5,1996,2h 1m,R,6.7,139K,"Multi-millionaire Tom Mullen's son is kidnapped, but after initially agreeing to pay the ransom Mullen then decides to use the ransom money as a bounty.",80000000.0,309492681,136492681,34216088,['Ron Howard'],"['Cyril Hume', 'Richard Maibaum', 'Richard Price']","['Mel Gibson', 'Gary Sinise', 'Rene Russo']","['Action', 'Crime', 'Drama', 'Thriller']",['United States'],"['Fair Lawn, New Jersey, USA']","['Touchstone Pictures', 'Imagine Entertainment', 'Ransom Productions']",['English'],3,5,0,1996
6. 101 Dalmatians,https://www.imdb.com/title/tt0115433/?ref_=sr_t_6,1996,1h 43m,G,5.8,120K,An evil high-fashion designer plots to steal dalmatian puppies in order to make an extravagant fur coat but creates an extravagant mess instead.,75000000.0,320689294,136189294,33504025,['Stephen Herek'],"['Dodie Smith', 'John Hughes']","['Glenn Close', 'Jeff Daniels', 'Joely Richardson']","['Animal Adventure', 'Urban Adventure', 'Adventure', 'Comedy', 'Crime', 'Family']","['United States', 'United Kingdom']","['Minster Court, Mincing Lane, City of London, England, UK']","['Walt Disney Pictures', 'Great Oaks Entertainment', 'Wizzer Productions']","['English', 'Spanish']",3,10,0,1996
7. The Rock,https://www.imdb.com/title/tt0117500/?ref_=sr_t_7,1996,2h 16m,R,7.4,367K,"A mild-mannered chemist and an ex-con must lead the counterstrike when a rogue group of military men, led by a renegade general, threaten a nerve gas attack from Alcatraz against San Francisco.",75000000.0,335062621,134069511,25069525,['Michael Bay'],"['David Weisberg', 'Douglas Cook', 'Mark Rosner']","['Sean Connery', 'Nicolas Cage', 'Ed Harris']","['Action', 'Adventure', 'Thriller']",['United States'],"['Alcatraz Island, San Francisco Bay, California, USA']","['Hollywood Pictures', 'Don Simpson/Jerry Bruckheimer Films']",['English'],9,10,1,1996
8. The Nutty Professor,https://www.imdb.com/title/tt0117218/?ref_=sr_t_8,1996,1h 35m,PG-13,5.7,127K,Grossly overweight yet good-hearted professor Sherman Klump takes a special chemical that turns him into the slim but obnoxious Buddy Love.,54000000.0,273961019,128814019,25411725,['Tom Shadyac'],"['Jerry Lewis', 'Bill Richmond', 'David Sheffield']","['Eddie Murphy', 'Jada Pinkett Smith', 'James Coburn']","['Slapstick', 'Comedy', 'Romance', 'Sci-Fi']",['United States'],"['Biltmore Hotel - 506 S. Grand Avenue, Downtown, Los Angeles, California, USA']",['Imagine Entertainment'],['English'],10,12,1,1996
9. The Birdcage,https://www.imdb.com/title/tt0115685/?ref_=sr_t_9,1996,1h 57m,R,7.2,105K,"A gay cabaret owner and his drag queen companion agree to put up a false straight front so that their son can introduce them to his fiancée's right-wing, conservative parents.",31000000.0,185260553,124060553,18275828,['Mike Nichols'],"['Jean Poiret', 'Francis Veber', 'Édouard Molinaro']","['Robin Williams', 'Nathan Lane', 'Gene Hackman']","['Farce', 'Comedy']",['United States'],"['Carlyle Hotel - 1250 Ocean Drive, Miami Beach, Florida, USA']",['United Artists'],['English'],7,25,1,1996
10. A Time to Kill,https://www.imdb.com/title/tt0117913/?ref_=sr_t_10,1996,2h 29m,R,7.5,188K,A young Mississippi lawyer defends a black man who killed the two white men that raped his preteen daughter.,40000000.0,152266007,108766007,14823159,['Joel Schumacher'],"['John Grisham', 'Akiva Goldsman']","['Matthew McConaughey', 'Sandra Bullock', 'Samuel L. Jackson']","['Legal Thriller', 'Crime', 'Drama', 'Thriller']",['United States'],"['London, Ontario, Canada']","['New Regency Productions', 'Warner Bros.']",['English'],7,12,0,1996
11. The First Wives Club,https://www.imdb.com/title/tt0116313/?ref_=sr_t_11,1996,1h 43m,PG,6.5,56K,"Reunited by the death of a college friend, three divorced women seek revenge on the husbands who left them for younger women.",26000000.0,181489203,105489203,18913411,['Hugh Wilson'],"['Olivia Goldsmith', 'Robert Harling']","['Goldie Hawn', 'Bette Midler', 'Diane Keaton']","['Farce', 'Comedy']",['United States'],"['Robbins & Appleton Building, 1 Bond Street, New York City, New York, USA']","['Paramount Pictures', 'Scott Rudin Productions']","['English', 'Italian', 'French']",3,8,1,1996
12. Phenomenon,https://www.imdb.com/title/tt0117333/?ref_=sr_t_12,1996,2h 3m,PG,6.4,86K,"An ordinary man sees a bright light descend from the sky, and discovers he now has super-intelligence and telekinesis.",32000000.0,152036382,104636382,16158901,['Jon Turteltaub'],['Gerald Di Pego'],"['John Travolta', 'Kyra Sedgwick', 'Forest Whitaker']","['Drama', 'Fantasy', 'Romance', 'Sci-Fi']",['United States'],"['Auburn, California, USA']",['Touchstone Pictures'],"['English', 'Spanish', 'Portuguese']",7,8,0,1996
13. Scream,https://www.imdb.com/title/tt0117571/?ref_=sr_t_13,1996,1h 51m,R,7.4,412K,"A year after the murder of her mother, a teenage girl is terrorized by a masked killer who targets her and her friends by using scary movies as part of a deadly game.",14000000.0,173046663,103046663,6354586,['Wes Craven'],['Kevin Williamson'],"['Neve Campbell', 'Courteney Cox', 'David Arquette']","['Dark Comedy', 'Slasher Horror', 'Suspense Mystery', 'Teen Horror', 'Whodunnit', 'Horror', 'Mystery']",['United States'],"['1820 Calistoga Road, Santa Rosa, California, USA']","['Dimension Films', 'Woods Entertainment']",['English'],12,11,0,1996
14. Eraser,https://www.imdb.com/title/tt0116213/?ref_=sr_t_14,1996,1h 55m,R,6.2,121K,A Witness Protection specialist becomes suspicious of his co-workers when dealing with a case involving high-tech weapons.,100000000.0,242295562,101295562,24566446,['Chuck Russell'],"['Tony Puryear', 'Walon Green', 'Michael S. Chernuchin']","['Arnold Schwarzenegger', 'Vanessa Williams', 'James Caan']","['Conspiracy Thriller', 'Spy', 'Action', 'Crime', 'Thriller']",['United States'],"['Santa Clarita, California, USA']","['Kopelson Entertainment', 'Sprockets Music', 'Warner Bros.']","['English', 'Russian']",3,2,1,1996
15. The Hunchback of Notre Dame,https://www.imdb.com/title/tt0116583/?ref_=sr_t_15,1996,1h 31m,G,7.0,177K,"A deformed bell-ringer must assert his independence from a vicious government minister in order to help his friend, a gypsy dancer.",100000000.0,325338851,100138851,21037414,"['Gary Trousdale', 'Kirk Wise']","['Tab Murphy', 'Victor Hugo', 'Irene Mecchi']","['Demi Moore', 'Jason Alexander', 'Mary Kay Bergman']","['Hand-Drawn Animation', 'Animation', 'Drama', 'Family', 'Musical', 'Romance']",['United States'],"['Walt Disney Feature Animation - 500 S. Buena Vista Street, Burbank, California, USA']","['Walt Disney Pictures', 'Walt Disney Animation Studios', 'Walt Disney Feature Animation']","['English', 'Latin']",8,26,1,1996
16. Michael,https://www.imdb.com/title/tt0117038/?ref_=sr_t_16,1996,1h 45m,PG,5.7,46K,Two tabloid reporters checking out a report of the Archangel Michael living with an old woman find that it's true. But that's not the only surprise.,,119718203,95318203,17435711,['Nora Ephron'],"['Peter Dexter', 'Jim Quinlan', 'Nora Ephron']","['John Travolta', 'Andie MacDowell', 'William Hurt']","['Comedy', 'Drama', 'Fantasy']",['United States'],"['Gruene Hall - 1281 Gruene Road, New Braunfels, Texas, USA']","['Turner Pictures (I)', 'Alphaville Films']","['English', 'Portuguese']",0,0,0,1996
17. Star Trek: First Contact,https://www.imdb.com/title/tt0117731/?ref_=sr_t_17,1996,1h 51m,PG-13,7.6,134K,The Borg travel back in time intent on preventing Earth's first contact with an alien species. Captain Picard and his crew pursue them to ensure that Zefram Cochrane makes his maiden flight reaching warp speed.,45000000.0,146027888,92027888,30716131,['Jonathan Frakes'],"['Gene Roddenberry', 'Rick Berman', 'Brannon Braga']","['Patrick Stewart', 'Jonathan Frakes', 'Brent Spiner']","['Time Travel', 'Action', 'Adventure', 'Drama', 'Sci-Fi', 'Thriller']",['United States'],"['Titan Missile Museum - 1580 W. Duval Mine Road, Green Valley, Arizona, USA']",['Paramount Pictures'],['English'],8,21,1,1996
18. Space Jam,https://www.imdb.com/title/tt0117705/?ref_=sr_t_18,1996,1h 28m,PG,6.5,220K,"In a desperate attempt to win a basketball match and earn their freedom, the Looney Tunes seek the aid of retired basketball champion, Michael Jordan.",80000000.0,230594962,90594962,27528529,['Joe Pytka'],"['Leo Benvenuti', 'Steve Rudnick', 'Timothy Harris']","['Michael Jordan', 'Wayne Knight', 'Theresa Randle']","['Animal Adventure', 'Basketball', 'Hand-Drawn Animation', 'High-Concept Comedy', 'Satire', 'Slapstick', 'Space Sci-Fi', 'Adventure', 'Animation', 'Comedy']",['United States'],"['Hoover Metropolitan Stadium, Hoover, Alabama, USA']","['Warner Bros.', 'Northern Lights Entertainment', 'Courtside Seats Productions']",['English'],5,8,0,1996
19. The English Patient,https://www.imdb.com/title/tt0116209/?ref_=sr_t_19,1996,2h 42m,R,7.4,208K,"At the close of World War II, a young nurse tends to a badly burned plane crash victim. His past is shown in flashbacks, revealing an involvement in a fateful love affair.",27000000.0,231976425,78676425,278439,['Anthony Minghella'],"['Michael Ondaatje', 'Anthony Minghella']","['Ralph Fiennes', 'Juliette Binoche', 'Willem Dafoe']","['Desert Adventure', 'Period Drama', 'Romantic Epic', 'Steamy Romance', 'Tragedy', 'Tragic Romance', 'Drama', 'Romance', 'War']","['United States', 'United Kingdom']","['Mahdia, Tunisia']","['Miramax', 'Tiger Moth Productions']","['English', 'German', 'Italian', 'Arabic']",62,78,9,1996
20. Broken Arrow,https://www.imdb.com/title/tt0115759/?ref_=sr_t_20,1996,1h 48m,R,6.1,107K,Terrorists steal nuclear warheads from the U.S. military but don't count on a pilot and park ranger spoiling their plans.,50000000.0,150270147,70770147,15583510,['John Woo'],['Graham Yost'],"['John Travolta', 'Christian Slater', 'Samantha Mathis']","['Dark Comedy', 'Action', 'Adventure', 'Thriller']",['United States'],"['Marble Canyon, Arizona, USA']","['Twentieth Century Fox', 'Mark Gordon Productions', 'WCG Entertainment Productions']",['English'],0,3,0,1996
21. Beavis and Butt-Head Do America,https://www.imdb.com/title/tt0115641/?ref_=sr_t_21,1996,1h 21m,PG-13,6.8,61K,"Our intrepid adolescent heroes wake up to find their beloved television stolen, and embark on an epic journey across America to recover it, and, who knows, maybe even score.",12000000.0,63118386,63118386,20114233,"['Geoffrey Johnson', 'Mike Judge', 'Mike de Seve']","['Mike Judge', 'Joe Stillman', 'Brian Mulroney']","['Mike Judge', 'Bruce Willis', 'Demi Moore']","['Adult Animation', 'Buddy Comedy', 'Dark Comedy', 'Parody', 'Road Trip', 'Adventure', 'Animation', 'Comedy', 'Crime', 'Music']",['United States'],[],"['Paramount Pictures', 'MTV Films', 'MTV Productions']",['English'],0,4,0,1996
22. Jingle All the Way,https://www.imdb.com/title/tt0116705/?ref_=sr_t_22,1996,1h 29m,PG,5.8,123K,"A father vows to get his son a Turbo Man action figure for Christmas. However, every store is sold out, and he must travel all over town and compete with everybody else in order to find one.",60000000.0,129832389,60592389,12112267,['Brian Levant'],['Randy Kornfield'],"['Arnold Schwarzenegger', 'Sinbad', 'Phil Hartman']","['High-Concept Comedy', 'Holiday Comedy', 'Holiday Family', 'Quest', 'Slapstick', 'Urban Adventure', 'Adventure', 'Comedy', 'Family', 'Holiday']",['United States'],"['7th Place Mall - St. Peter & Wabasha Streets, St. Paul, Minnesota, USA']","['Twentieth Century Fox', '1492 Pictures']",['English'],2,4,0,1996
23. The Cable Guy,https://www.imdb.com/title/tt0115798/?ref_=sr_t_23,1996,1h 36m,PG-13,6.1,183K,A designer makes a grievious mistake when he rejects the friendship of a borderline cable guy.,47000000.0,102825796,60240295,19806226,['Ben Stiller'],['Lou Holtz Jr.'],"['Jim Carrey', 'Matthew Broderick', 'Leslie Mann']","['Dark Comedy', 'Psychological Drama', 'Psychological Thriller', 'Satire', 'Tragedy', 'Comedy', 'Drama', 'Thriller']",['United States'],"['Medieval Times - 7662 Beach Blvd., Buena Park, California, USA']","['Columbia Pictures', 'Brillstein-Grey Entertainment', 'Licht/Mueller Film Corporation']","['English', 'French']",3,2,0,1996
24. Courage Under Fire,https://www.imdb.com/title/tt0115956/?ref_=sr_t_24,1996,1h 56m,R,6.6,61K,"A U.S. Army officer, despondent about a deadly mistake he made, investigates a female chopper commander's worthiness for the Medal of Honor.",46000000.0,100860818,59031057,12501586,['Edward Zwick'],['Patrick Sheane Duncan'],"['Denzel Washington', 'Meg Ryan', 'Lou Diamond Phillips']","['Action', 'Drama', 'Mystery', 'Thriller', 'War']",['United States'],"['National Training Center, Fort Irwin, California, USA']","['Fox 2000 Pictures', 'Davis Entertainment', 'Joseph M. Singer Entertainment']","['English', 'Arabic']",9,7,0,1996
25. Jack,https://www.imdb.com/title/tt0116669/?ref_=sr_t_25,1996,1h 53m,PG-13,5.8,65K,"Because of an unusual disorder that has aged him four times faster than a typical human being, a boy looks like a 40-year-old man as he starts fifth grade at public school after being homeschooled.",45000000.0,58620973,58620973,11191496,['Francis Ford Coppola'],"['James DeMonaco', 'Gary Nadeau']","['Robin Williams', 'Diane Lane', 'Brian Kerwin']","['Comedy', 'Drama', 'Fantasy']",['United States'],"['Mare Island, Vallejo, California, USA']","['Hollywood Pictures', 'American Zoetrope', 'Great Oaks Entertainment']","['English', 'Spanish']",0,6,0,1996
26. Executive Decision,https://www.imdb.com/title/tt0116253/?ref_=sr_t_26,1996,2h 13m,R,6.5,63K,"When terrorists seize control of an airliner, an intelligence analyst accompanies a commando unit for a midair boarding operation.",55000000.0,121969216,56569216,12069780,['Stuart Baird'],"['Jim Thomas', 'John Thomas']","['Kurt Russell', 'Halle Berry', 'Steven Seagal']","['Action', 'Adventure', 'Thriller']",['United States'],"['Alverno High School - 200 North Michillinda Avenue, Sierra Madre, California, USA']","['Warner Bros.', 'Silver Pictures']","['English', 'Arabic']",2,2,0,1996
27. Primal Fear,https://www.imdb.com/title/tt0117381/?ref_=sr_t_27,1996,2h 9m,R,7.7,256K,"The murder of a high and mighty archbishop leads to the involvement of Martin Vail, Chicago's best attorney. As he studies the suspects, he becomes convinced of certain aspects, but there's more to the story than meets the eye.",30000000.0,102616183,56116183,9871222,['Gregory Hoblit'],"['William Diehl', 'Steve Shagan', 'Ann Biderman']","['Richard Gere', 'Laura Linney', 'Edward Norton']","['Legal Thriller', 'Psychological Thriller', 'Crime', 'Drama', 'Mystery', 'Thriller']",['United States'],"['Chicago, Illinois, USA']","['Paramount Pictures', 'Rysher Entertainment']","['English', 'Spanish']",10,12,1,1996
28. Tin Cup,https://www.imdb.com/title/tt0117918/?ref_=sr_t_28,1996,2h 15m,R,6.4,54K,A washed-up golf pro working at a driving range tries to qualify for the U.S. Open in order to win the heart of his successful rival's girlfriend.,45000000.0,53854588,53854588,10128834,['Ron Shelton'],"['John Norville', 'Ron Shelton']","['Kevin Costner', 'Rene Russo', 'Don Johnson']","['Romantic Comedy', 'Comedy', 'Drama', 'Romance', 'Sport']",['United States'],"['Tubac, Arizona, USA']","['New Regency Productions', 'Warner Bros.']",['English'],0,4,0,1996
29. Sleepers,https://www.imdb.com/title/tt0117665/?ref_=sr_t_29,1996,2h 27m,R,7.5,244K,"After a prank goes disastrously wrong, a group of boys are sent to a detention center where they are brutalized. Thirteen years later, an unexpected random encounter with a former guard gives them a chance for revenge.",44000000.0,165615285,53315285,12305745,['Barry Levinson'],"['Lorenzo Carcaterra', 'Barry Levinson']","['Robert De Niro', 'Kevin Bacon', 'Brad Pitt']","['Prison Drama', 'Teen Drama', 'Crime', 'Drama', 'Thriller']",['United States'],"['Fairfield Hills Hospital - Mile Hill Rd., Newtown, Connecticut, USA']","['Astoria Films', 'Baltimore Pictures', 'Polygram Filmed Entertainment']",['English'],0,5,1,1996
30. DragonHeart,https://www.imdb.com/title/tt0116136/?ref_=sr_t_30,1996,1h 43m,PG-13,6.4,103K,"The last dragon and a disillusioned dragon-slaying knight must unite to stop an evil king, who was granted partial immortality.",57000000.0,115267375,51367375,15027150,['Rob Cohen'],"['Patrick Read Johnson', 'Charles Edward Pogue']","['Dennis Quaid', 'Sean Connery', 'Dina Meyer']","['Sword & Sandal', 'Action', 'Adventure', 'Fantasy']",['United States'],"['Bratislava, Slovakia']",['Universal Pictures'],['English'],3,10,1,1996
31. Up Close & Personal,https://www.imdb.com/title/tt0118055/?ref_=sr_t_31,1996,2h 4m,PG-13,6.1,16K,"An ambitious young woman, determined to build a career in television journalism, gets good advice from her first boss, and they fall in love.",60000000.0,100688705,51088705,11101955,['Jon Avnet'],"['Joan Didion', 'John Gregory Dunne', 'Alanna Nash']","['Robert Redford', 'Michelle Pfeiffer', 'Stockard Channing']","['Drama', 'Romance']",['United States'],"['Holmesburg Prison - 8215 Torresdale Avenue, Philadelphia, Pennsylvania, USA']","['Touchstone Pictures', 'Cinergi Pictures Entertainment', 'Avnet/Kerner Productions']","['English', 'Spanish']",3,3,1,1996
32. Evita,https://www.imdb.com/title/tt0116250/?ref_=sr_t_32,1996,2h 15m,PG,6.3,38K,"The hit musical based on the life of Eva Perón (Evita Duarte), a B-picture Argentinian actress who eventually became the wife of Argentinian president Juan Domingo Perón, and the most beloved and hated woman in Argentina.",55000000.0,141047179,50047179,195085,['Alan Parker'],"['Tim Rice', 'Alan Parker', 'Oliver Stone']","['Madonna', 'Jonathan Pryce', 'Antonio Banderas']","['Rock Musical', 'Biography', 'Drama', 'History', 'Musical']",['United States'],"['Budapest, Hungary']","['Hollywood Pictures', 'Cinergi Pictures Entertainment', 'Dirty Hands Productions']",['English'],19,44,1,1996
33. The Preacher's Wife,https://www.imdb.com/title/tt0117372/?ref_=sr_t_33,1996,2h 3m,PG,5.7,14K,An angel comes to Earth to help a preacher save his church and his family.,40000000.0,48102795,48102795,7649752,['Penny Marshall'],"['Robert Nathan', 'Robert E. Sherwood', 'Leonardo Bercovici']","['Denzel Washington', 'Whitney Houston', 'Courtney B. Vance']","['Holiday Romance', 'Supernatural Fantasy', 'Comedy', 'Drama', 'Fantasy', 'Holiday', 'Romance']",['United States'],"['Portland, Maine, USA']","['Touchstone Pictures', 'The Samuel Goldwyn Company', 'Parkway Productions']",['English'],4,7,1,1996
34. Romeo + Juliet,https://www.imdb.com/title/tt0117509/?ref_=sr_t_34,1996,2h,PG-13,6.7,250K,Shakespeare's famous play is updated to the hip modern suburb of Verona still retaining its original dialogue.,14500000.0,147554998,46351345,11133231,['Baz Luhrmann'],"['William Shakespeare', 'Craig Pearce', 'Baz Luhrmann']","['Leonardo DiCaprio', 'Claire Danes', 'John Leguizamo']","['Romantic Epic', 'Teen Romance', 'Tragedy', 'Tragic Romance', 'Drama', 'Romance']","['United States', 'Mexico', 'Australia', 'Canada']","['Chapultepec Castle, Chapultepec Park, Mexico City, Distrito Federal, Mexico']","['Bazmark Films', 'Estudios Churubusco Azteca S.A.', 'Twentieth Century Fox']",['English'],15,30,1,1996
35. One Fine Day,https://www.imdb.com/title/tt0117247/?ref_=sr_t_35,1996,1h 48m,PG,6.5,49K,"The lives of two strangers and their young children unexpectedly intersect on one hectic, stressful day in New York City.",,97529550,46151454,6226430,['Michael Hoffman'],"['Terrel Seltzer', 'Ellen Simon']","['Michelle Pfeiffer', 'George Clooney', 'Mae Whitman']","['Feel-Good Romance', 'Romantic Comedy', 'Comedy', 'Drama', 'Romance']",['United States'],"['Serendipity 3 Restaurant, Manhattan, New York City, New York, USA']","['Fox 2000 Pictures', 'Rosa Productions', 'Sprockets Music']","['English', 'Spanish']",4,6,1,1996
36. The Mirror Has Two Faces,https://www.imdb.com/title/tt0117057/?ref_=sr_t_36,1996,2h 6m,PG-13,6.6,24K,"A shy, middle-aged professor enters into a romantic but non-physical relationship with an unlucky-in-love colleague.",42000000.0,41083864,41083864,12210868,['Barbra Streisand'],"['André Cayatte', 'Gérard Oury', 'Richard LaGravenese']","['Barbra Streisand', 'Jeff Bridges', 'Lauren Bacall']","['Comedy', 'Drama', 'Romance']",['United States'],"['505 West End Avenue, Manhattan, New York City, New York, USA']","['TriStar Pictures', 'Phoenix Pictures', 'Barwood Films']",['English'],4,11,2,1996
37. Happy Gilmore,https://www.imdb.com/title/tt0116483/?ref_=sr_t_37,1996,1h 32m,PG-13,7.0,260K,"After his grandmother's house is repossessed by the IRS, a bad tempered hockey player takes his talents to golf to earn the big bucks and get his grandmothers house back.",12000000.0,41205099,38824099,8514125,['Dennis Dugan'],"['Tim Herlihy', 'Adam Sandler']","['Adam Sandler', 'Christopher McDonald', 'Julie Bowen']","['High-Concept Comedy', 'Slapstick', 'Comedy', 'Sport']",['United States'],"['Furry Creek, British Columbia, Canada']","['Universal Pictures', 'Brillstein-Grey Entertainment', 'Robert Simonds Productions']",['English'],0,4,0,1996
38. The Ghost and the Darkness,https://www.imdb.com/title/tt0116409/?ref_=sr_t_38,1996,1h 50m,R,6.8,67K,A bridge engineer and an experienced old hunter begin a hunt for two lions after they start attacking local construction workers.,55000000.0,38619405,38619405,9215063,['Stephen Hopkins'],['William Goldman'],"['Michael Douglas', 'Val Kilmer', 'Tom Wilkinson']","['Adventure', 'Drama', 'Thriller']","['United States', 'Germany']","['Tsavo National Park, Kenya']","['Constellation Entertainment', 'Douglas/Reuther Productions', 'Bernina Film']","['English', 'Hindi']",0,5,1,1996
39. Mars Attacks!,https://www.imdb.com/title/tt0116996/?ref_=sr_t_39,1996,1h 46m,PG-13,6.4,250K,Earth is invaded by Martians with unbeatable weapons and a cruel sense of humor.,70000000.0,101381197,37781197,9384272,['Tim Burton'],"['Len Brown', 'Woody Gelman', 'Wally Wood']","['Jack Nicholson', 'Pierce Brosnan', 'Sarah Jessica Parker']","['Alien Invasion', 'Dark Comedy', 'Parody', 'Satire', 'Space Sci-Fi', 'Comedy', 'Sci-Fi']","['United States', 'Japan', 'United Kingdom']","['Red Lake, Arizona, USA']","['Warner Bros.', 'Tim Burton Productions']","['English', 'French']",3,19,0,1996
40. Set It Off,https://www.imdb.com/title/tt0117603/?ref_=sr_t_40,1996,2h 3m,R,6.9,19K,"Desperation drives four inner-city women to bank robbery in Los Angeles, then they start mistrusting each other.",9000000.0,41590886,36461139,8812105,['F. Gary Gray'],"['Takashi Bufford', 'Kate Lanier']","['Jada Pinkett Smith', 'Queen Latifah', 'Vivica A. Fox']","['Dark Comedy', 'Heist', 'Action', 'Crime', 'Drama', 'Romance', 'Thriller']",['United States'],"['Biltmore Hotel - 506 S. Grand Avenue, Downtown, Los Angeles, California, USA']","['New Line Cinema', 'Peak Films']",['English'],5,6,0,1996
