Title,Movie Link,Year,Duration,MPA,Rating,Votes,Description,budget,grossWorldWide,gross_US_Canada,opening_weekend_Gross,directors,writers,stars,genres,countries_origin,filming_locations,production_companies,Languages,wins,nominations,oscars,release_date
93. The Accountant 2,https://www.imdb.com/title/tt7068946/?ref_=sr_t_93,2025,2h 4m,R,,,Christian Wolff applies his brilliant mind and illegal methods to reconstruct the unsolved puzzle of a Treasury chief's murder.,,,,,"[""Gavin O'Connor""]",['Bill Dubuque'],"['Ben Affleck', 'Jon Bernthal', 'J.K. Simmons']","['Action', 'Crime', 'Drama', 'Mystery', 'Thriller']",['United States'],"['Los Angeles, California, USA']","['51 Entertainment', 'Artists Equity', 'Warner Bros.']",['English'],0,2,0,2025
94. Return to Silent Hill,https://www.imdb.com/title/tt22868010/?ref_=sr_t_94,2025,,,,,"When a mysterious letter calls him back to Silent Hill in search of his lost love, James finds a once-recognizable town and encounters terrifying figures both familiar and new, and begins to question his own sanity.",40000000.0,,,,['Christophe Gans'],"['Christophe Gans', 'William Josef Schneider', 'Keiichiro Toyama']","['Jeremy Irvine', 'Hannah Emily Anderson', 'Robert Strange']","['Supernatural Horror', 'Horror']","['United Kingdom', 'France', 'Germany', 'Serbia', 'United States']","['Munich, Bavaria, Germany']","['Ashland Hill Media Finance', 'Davis Films', 'Maze Pictures']",[],0,0,0,2025
95. The Bayou,https://www.imdb.com/title/tt29343289/?ref_=sr_t_95,2025,1h 27m,,4.9,72,"Vacation turns disaster when Houston grad, Kyle and her friends escape a plane crash in the desolate Louisiana everglades, only to discover there's something way more dangerous lurking in the shallows.",,62907.0,,,"['Taneli Mustonen', 'Brad Watson']","['Ashley Holberry', 'Gavin Cosmo Mehrtens']","['Elisha Applebaum', 'Madalena Aragão', 'Isabelle Bonfrer']","['Action', 'Horror', 'Thriller']",['United Kingdom'],"['London, England, UK']","['Big Safari', 'Cowboy Cosmonaut Films', 'Creativity Capital']",['English'],0,0,0,2025
96. Predator: Badlands,https://www.imdb.com/title/tt31227572/?ref_=sr_t_96,2025,,,,,Plot is under wraps.,,,,,['Dan Trachtenberg'],"['Patrick Aison', 'Jim Thomas', 'John Thomas']",['Elle Fanning'],"['Alien Invasion', 'Monster Horror', 'Horror', 'Sci-Fi']",[],[],['20th Century Studios'],[],0,0,0,2025
97. La Dolce Villa,https://www.imdb.com/title/tt31519456/?ref_=sr_t_97,2025,1h 39m,,,,"A successful businessman travels to Italy to stop his daughter from spending all her money to restore an old villa, but Italy has other romantic plans.",,,,,['Mark Waters'],"['Elizabeth Hackett', 'Hilary Galanoy']","['Scott Foley', 'Violante Placido', 'Maia Reficco']","['Comedy', 'Romance']",['United States'],"['Tuscany, Italy']","['DAE Light Media', 'Front Row Films']",['English'],0,0,0,2025
98. Opus,https://www.imdb.com/title/tt29929565/?ref_=sr_t_98,2025,1h 43m,R,4.2,218,An iconic pop star returns after decades missing.,,,,,['Mark Anthony Green'],['Mark Anthony Green'],"['Ayo Edebiri', 'John Malkovich', 'Juliette Lewis']",['Drama'],['United States'],[],"['A24', 'MACRO', 'Makeready']",['English'],0,0,0,2025
99. Kiss of the Spider Woman,https://www.imdb.com/title/tt30400277/?ref_=sr_t_99,2025,2h 8m,,6.2,184,"Valentín, a political prisoner, shares a cell with Molina, convicted for public indecency. An unlikely bond forms as Molina recounts a Hollywood musical plot starring Ingrid Luna.",,,,,['Bill Condon'],"['Bill Condon', 'Terrence McNally', 'Manuel Puig']","['Diego Luna', 'Tonatiuh', 'Jennifer Lopez']","['Political Drama', 'Prison Drama', 'Drama', 'Musical']","['United States', 'Mexico']","['Kearny, New Jersey, USA']","['1000 Eyes', 'Artists Equity', 'Josephson Entertainment']","['English', 'Spanish']",0,0,0,2025
100. Detective Chinatown 1900,https://www.imdb.com/title/tt34463310/?ref_=sr_t_100,2025,2h 18m,,6.0,493,"In 1900, a white woman was murdered in Chinatown in San Francisco, and the suspect was a Chinese man. The murder caused social shock, and people demanded the closure of Chinatown.",,977709.0,,,"['Sicheng Chen', 'Mo Dai']",['Sicheng Chen'],"['Baoqiang Wang', 'Haoran Liu', 'Chow Yun-Fat']","['Comedy', 'Drama', 'Mystery', 'Western']",['China'],[],"['As One Productions', 'Beijing Happy Film Industry', 'Beijing Yitong Chuanqi Film Culture']","['Mandarin', 'English', 'Navajo']",0,0,0,2025
