Title,Movie Link,Year,Duration,MPA,Rating,Votes,Description,budget,grossWorldWide,gross_US_Canada,opening_weekend_Gross,directors,writers,stars,genres,countries_origin,filming_locations,production_companies,Languages,wins,nominations,oscars,release_date
85. Class Act,https://www.imdb.com/title/tt0103978/?ref_=sr_t_85,1992,1h 38m,PG-13,6.1,8.3K,A valedictorian and a juvenile delinquent have their school records switched and begin to be treated like the other.,7500000.0,13272113,13272113,3421827,['Randall Miller'],"['Michael Swerdlick', 'Wayne Allan Rice', 'Richard Brenne']","['Christopher Reid', 'Christopher Martin', 'Andre Rosey Brown']","['Buddy Comedy', 'Slapstick', 'Comedy']",['United States'],"['Van Nuys High School - 6535 Cedros Avenue, Van Nuys, Los Angeles, California, USA']",['Warner Bros.'],['English'],0,0,0,1992
86. Trespass,https://www.imdb.com/title/tt0105636/?ref_=sr_t_86,1992,1h 41m,R,6.3,14K,"Two firemen in a burning building get a treasure map - stolen gold church items are hidden in a closed down factory in St. Louis. Once there, they're trapped in by a black gang considering it their territory.",14000000.0,13249535,13249535,5012910,['Walter Hill'],"['Bob Gale', 'Robert Zemeckis']","['Bill Paxton', 'Ice-T', 'William Sadler']","['Action', 'Thriller']",['United States'],"['Fulton Bag and Cotton Mill, Cabbagetown, Atlanta, Georgia, USA']",['Universal Pictures'],['English'],0,0,0,1992
87. American Me,https://www.imdb.com/title/tt0103671/?ref_=sr_t_87,1992,2h 5m,R,7.1,11K,"A Mexican-American Mafia kingpin is released from prison, falls in love for the first time, and grows introspective about his gangster lifestyle.",16000000.0,13086430,13086430,3378100,['Edward James Olmos'],"['Floyd Mutrux', 'Desmond Nakano']","['Edward James Olmos', 'William Forsythe', 'Sal Lopez']","['Period Drama', 'Prison Drama', 'Tragedy', 'Biography', 'Crime', 'Drama', 'Romance']",['United States'],"['California Institution for Men - 14901 Central Avenue, Chino, California, USA']","['Hivemind', 'Olmos Productions', 'Universal Pictures']","['English', 'Spanish']",3,2,0,1992
88. Hellraiser III: Hell on Earth,https://www.imdb.com/title/tt0104409/?ref_=sr_t_88,1992,1h 37m,R,5.5,36K,An investigative reporter must send the newly unbound Pinhead and his legions back to Hell.,5000000.0,12534961,12534961,3208009,['Anthony Hickox'],"['Peter Atkins', 'Tony Randel', 'Clive Barker']","['Terry Farrell', 'Doug Bradley', 'Kevin Bernhardt']",['Horror'],"['United Kingdom', 'United States']","['Wake Forest University - 1834 Wake Forest Road, Winston-Salem, North Carolina, USA']","['Fifth Avenue Entertainment', 'Trans Atlantic Entertainment']",['English'],0,10,0,1992
89. A Stranger Among Us,https://www.imdb.com/title/tt0105483/?ref_=sr_t_89,1992,1h 50m,PG-13,5.6,4.4K,"Emily, a tough NYPD cop, is sent to an orthodox Jewish community to investigate a missing person plus $720,000 in missing diamonds. To solve what becomes a murder case, she has to join the community.",18000000.0,12282994,12282994,2886082,['Sidney Lumet'],['Robert J. Avrech'],"['Melanie Griffith', 'Eric Thal', 'John Pankow']","['Crime', 'Drama', 'Mystery', 'Romance']",['United States'],"['Forest Avenue, Ridgewood, Queens, New York City, New York, USA']","['Hollywood Pictures', 'ISIS', 'Mansfield Pictures']","['English', 'Yiddish', 'Hebrew']",0,3,0,1992
90. Strictly Ballroom,https://www.imdb.com/title/tt0105488/?ref_=sr_t_90,1992,1h 34m,PG,7.2,30K,A maverick dancer risks his career by performing an unusual routine and sets out to succeed with a new partner.,3000000.0,11759033,11738022,145977,['Baz Luhrmann'],"['Baz Luhrmann', 'Andrew Bovell', 'Craig Pearce']","['Paul Mercurio', 'Tara Morice', 'Bill Hunter']","['Parody', 'Comedy', 'Drama', 'Music', 'Romance']","['Australia', 'United Kingdom']","[""St George's Theatre, Yarraville, Victoria, Australia""]","['Beyond Films', 'M & A', 'New South Wales Film & Television Office']","['English', 'Spanish']",19,20,0,1992
91. Army of Darkness,https://www.imdb.com/title/tt0106308/?ref_=sr_t_91,1992,1h 21m,R,7.4,201K,"When Ash Williams is accidentally transported to 1300 A.D., he must retrieve the Necronomicon and battle an army of the dead in order to return home.",11000000.0,11514639,11502976,4424535,['Sam Raimi'],"['Sam Raimi', 'Ivan Raimi']","['Bruce Campbell', 'Embeth Davidtz', 'Marcus Gilbert']","['Dark Comedy', 'Farce', 'Quest', 'Slapstick', 'Supernatural Horror', 'Zombie Horror', 'Comedy', 'Horror']",['United States'],"['Bronson Caves, Bronson Canyon, Griffith Park - 4730 Crystal Springs Drive, Los Angeles, California, USA']","['Dino De Laurentiis Company', 'Renaissance Pictures', 'Introvision International']",['English'],12,6,0,1992
92. Jennifer 8,https://www.imdb.com/title/tt0104549/?ref_=sr_t_92,1992,2h 4m,R,6.3,19K,"John Berlin, a former Los Angeles homicide detective, investigates a multiple murder case in San Diego. The only witness is a blind girl to whom he is immediately attracted.",20000000.0,11390479,11390479,3619666,['Bruce Robinson'],['Bruce Robinson'],"['Andy Garcia', 'Uma Thurman', 'Lance Henriksen']","['Cop Drama', 'Police Procedural', 'Serial Killer', 'Crime', 'Drama', 'Mystery', 'Thriller']","['Canada', 'United States', 'United Kingdom']","['Eureka, California, USA']",['Paramount Pictures'],['English'],5,0,0,1992
93. Whispers in the Dark,https://www.imdb.com/title/tt0105811/?ref_=sr_t_93,1992,1h 43m,R,5.6,2.5K,"Eve tells her shrink, Ann, about kinky sex with a man. Ann learns that it's the same man, she's been seeing lately. Eve finds out and explodes. A murder follows.",18000000.0,11124511,11124511,3177158,['Christopher Crowe'],['Christopher Crowe'],"['Annabella Sciorra', 'Jamey Sheridan', 'Alan Alda']","['Erotic Thriller', 'Drama', 'Mystery', 'Thriller']",['United States'],"['500 5th Avenue, Manhattan, New York City, New York, USA']","['Intrada', 'Martin Bregman Productions', 'Paramount Pictures']",['English'],0,0,0,1992
94. Stay Tuned,https://www.imdb.com/title/tt0105466/?ref_=sr_t_94,1992,1h 28m,PG,6.3,15K,A husband and wife are sucked into a hellish television set and must survive the gauntlet of twisted versions of shows in which they find themselves.,25000000.0,10736401,10736401,3532540,['Peter Hyams'],"['Tom S. Parker', 'Jim Jennewein', 'Richard Siegel']","['John Ritter', 'Pam Dawber', 'Jeffrey Jones']","['Dark Comedy', 'High-Concept Comedy', 'Satire', 'Adventure', 'Comedy', 'Fantasy']",['United States'],"['Old Tucson - 201 S. Kinney Road, Tucson, Arizona, USA']",['Morgan Creek Entertainment'],['English'],0,2,0,1992
95. Glengarry Glen Ross,https://www.imdb.com/title/tt0104348/?ref_=sr_t_95,1992,1h 40m,R,7.7,121K,An examination of the machinations behind the scenes at a real estate office.,12500000.0,10726612,10725228,2104402,['James Foley'],['David Mamet'],"['Al Pacino', 'Jack Lemmon', 'Alec Baldwin']","['Workplace Drama', 'Crime', 'Drama', 'Mystery', 'Financial Drama']",['United States'],"['Office, 1515 Sheepshead Bay Road, Brooklyn, New York, USA']","['New Line Cinema', 'Zupnik Cinema Group II', 'GGR']",['English'],8,14,1,1992
96. Husbands and Wives,https://www.imdb.com/title/tt0104466/?ref_=sr_t_96,1992,1h 48m,R,7.5,32K,"When their best friends announce that they're separating, a professor and his wife discover the faults in their own marriage.",20000000.0,10555619,10555619,3520550,['Woody Allen'],['Woody Allen'],"['Woody Allen', 'Mia Farrow', 'Sydney Pollack']","['Satire', 'Comedy', 'Drama', 'Romance']",['United States'],"['Barnard College, Columbia University - 3009 Broadway, Manhattan, New York City, New York, USA']","['TriStar Pictures', 'Jack Rollins & Charles H. Joffe Productions']",['English'],13,17,2,1992
97. Chaplin,https://www.imdb.com/title/tt0103939/?ref_=sr_t_97,1992,2h 23m,PG-13,7.5,64K,"An elderly Charlie Chaplin discusses his autobiography with his editor, recounting his amazing journey from his poverty-stricken childhood to world-wide success after the ingenious invention of the Little Tramp.",31000000.0,9493259,9493259,84669,['Richard Attenborough'],"['David Robinson', 'Charles Chaplin', 'Diana Hawkins']","['Robert Downey Jr.', 'Geraldine Chaplin', 'Paul Rhys']","['Docudrama', 'Period Drama', 'Showbiz Drama', 'Biography', 'Comedy', 'Drama']","['United Kingdom', 'France', 'Italy', 'Japan', 'United States']","['Chaplin Studios - 1416 N. La Brea Avenue, Hollywood, Los Angeles, California, USA']","['Carolco Pictures', 'Japan Satellite Broadcasting (JBS)', 'Canal+']","['English', 'Italian', 'German']",3,20,3,1992
98. Gladiator,https://www.imdb.com/title/tt0104346/?ref_=sr_t_98,1992,1h 41m,R,6.5,11K,"Tommy Riley has moved with his dad to Chicago from a 'nice place'. He keeps to himself, goes to school. However, after a street fight he is noticed and quickly falls into the world of illegal underground boxing - where punches can kill.",20000000.0,9223441,9223441,3305189,['Rowdy Herrington'],"['Djordje Milicevic', 'Robert Mark Kamen', 'Lyle Kessler']","['James Marshall', 'Cuba Gooding Jr.', 'Brian Dennehy']","['Action', 'Drama', 'Sport']",['United States'],"['Chicago, Illinois, USA']","['Columbia Pictures', 'Price Entertainment']",['English'],0,0,0,1992
99. White Sands,https://www.imdb.com/title/tt0105813/?ref_=sr_t_99,1992,1h 41m,R,6.0,9.2K,A small southwestern town Sheriff finds a body in the desert with a suitcase and five hundred thousand dollars. He impersonates the man and stumbles into an F.B.I. investigation.,22000000.0,9011574,9011574,3151629,['Roger Donaldson'],['Daniel Pyne'],"['Willem Dafoe', 'Mary Elizabeth Mastrantonio', 'Mickey Rourke']","['Dark Comedy', 'Action', 'Crime', 'Drama', 'Thriller']",['United States'],"['White Sands National Monument, New Mexico, USA']",['Morgan Creek Entertainment'],['English'],0,0,0,1992
100. Once Upon a Crime...,https://www.imdb.com/title/tt0101625/?ref_=sr_t_100,1992,1h 34m,PG,5.8,5.7K,Phoebe and a fellow American in Rome find a dog with a $5000 reward. They take a train to the owner in Monte Carlo. She turns up murdered. They run and become suspects just as 3 other Americans on the train.,18000000.0,8669847,8669847,3249740,['Eugene Levy'],"['Rodolfo Sonego', 'Giorgio Arlorio', 'Stefano Strucchi']","['John Candy', 'Jim Belushi', 'Cybill Shepherd']","['Bumbling Detective', 'Whodunnit', 'Comedy', 'Crime', 'Mystery']","['Germany', 'United States']","['Casino de Monte Carlo, Monte Carlo, Monaco']","['Ascot Film', 'Dino De Laurentiis Company']",['English'],0,0,0,1992
