Title,Movie Link,Year,Duration,MPA,Rating,Votes,Description
1. Star Wars: Episode VII - The Force Awakens,https://www.imdb.com/title/tt2488496/?ref_=sr_t_1,2015,2h 18m,PG-13,7.8,993K,"As a new threat to the galaxy rises, Rey, a desert scavenger, and Finn, an ex-stormtrooper, must join Han Solo and Chewbacca to search for the one hope of restoring peace."
2. Jurassic World,https://www.imdb.com/title/tt0369610/?ref_=sr_t_2,2015,2h 4m,PG-13,6.9,696K,"A new theme park, built on the original site of Jurassic Park, creates a genetically modified hybrid dinosaur, the Indominus Rex, which escapes containment and goes on a killing spree."
3. Avengers: Age of Ultron,https://www.imdb.com/title/tt2395427/?ref_=sr_t_3,2015,2h 21m,PG-13,7.3,950K,"When Tony Stark and Bruce Banner try to jump-start a dormant peacekeeping program called Ultron, things go horribly wrong and it's up to Earth's mightiest heroes to stop the villainous Ultron from enacting his terrible plan."
4. Inside Out,https://www.imdb.com/title/tt2096673/?ref_=sr_t_4,2015,1h 35m,PG,8.1,855K,"After young Riley is uprooted from her Midwest life and moved to San Francisco, her emotions - Joy, Fear, Anger, Disgust and Sadness - conflict on how best to navigate a new city, house, and school."
5. Furious 7,https://www.imdb.com/title/tt2820852/?ref_=sr_t_5,2015,2h 17m,PG-13,7.1,424K,Deckard Shaw seeks revenge against Dominic Toretto and his family for his comatose brother.
6. Minions,https://www.imdb.com/title/tt2293640/?ref_=sr_t_6,2015,1h 31m,PG,6.4,270K,"Minions Stuart, Kevin, and Bob are recruited by Scarlet Overkill, a supervillain who, alongside her inventor husband Herb, hatches a plot to take over the world."
7. The Hunger Games: Mockingjay - Part 2,https://www.imdb.com/title/tt1951266/?ref_=sr_t_7,2015,2h 17m,PG-13,6.6,389K,Katniss and a team of rebels from District 13 prepare for the final battle that will decide the fate of Panem.
8. The Martian,https://www.imdb.com/title/tt3659388/?ref_=sr_t_8,2015,2h 24m,PG-13,8.0,958K,"An astronaut becomes stranded on Mars after his team assume him dead, and must rely on his ingenuity to find a way to signal to Earth that he is alive and can survive until a potential rescue."
9. Cinderella,https://www.imdb.com/title/tt1661199/?ref_=sr_t_9,2015,1h 45m,PG,6.9,196K,"When her father unexpectedly dies, young Ella finds herself at the mercy of her cruel stepmother and her scheming stepsisters. Never one to give up hope, Ella's fortunes begin to change after meeting a dashing stranger."
10. Spectre,https://www.imdb.com/title/tt2379713/?ref_=sr_t_10,2015,2h 28m,PG-13,6.8,478K,"A cryptic message from James Bond's past sends him on a trail to uncover the existence of a sinister organisation named SPECTRE. With a new threat dawning, Bond learns the terrible truth about the author of all his pain in his most recent missions."
11. Mission: Impossible - Rogue Nation,https://www.imdb.com/title/tt2381249/?ref_=sr_t_11,2015,2h 11m,PG-13,7.4,422K,Ethan and his team take on their most impossible mission yet when they have to eradicate an international rogue organization as highly skilled as they are and committed to destroying the IMF.
12. Pitch Perfect 2,https://www.imdb.com/title/tt2848292/?ref_=sr_t_12,2015,1h 55m,PG-13,6.4,174K,"After a humiliating command performance at The Kennedy Center, the Barden Bellas enter an international competition that no American group has ever won in order to regain their status and right to perform."
13. The Revenant,https://www.imdb.com/title/tt1663202/?ref_=sr_t_13,2015,2h 36m,R,8.0,903K,A frontiersman on a fur trading expedition in the 1820s fights for survival after being mauled by a bear and left for dead by members of his own hunting team.
14. Ant-Man,https://www.imdb.com/title/tt0478970/?ref_=sr_t_14,2015,1h 57m,PG-13,7.2,744K,"Armed with a super-suit with the astonishing ability to shrink in scale but increase in strength, cat burglar Scott Lang must embrace his inner hero and help his mentor, Dr. Hank Pym, pull off a plan that will save the world."
15. Home,https://www.imdb.com/title/tt2224026/?ref_=sr_t_15,2015,1h 34m,PG,6.5,115K,"Oh, a lovable misfit alien, runs away from his planet and takes shelter on Earth, where he befriends Tip, an adventurous young girl who is on a quest to find her displaced mother Lucy."
16. Hotel Transylvania 2,https://www.imdb.com/title/tt2510894/?ref_=sr_t_16,2015,1h 29m,PG,6.6,151K,"Dracula and his friends try to bring out the monster in his half human, half vampire grandson in order to keep Mavis from leaving the hotel."
17. Fifty Shades of Grey,https://www.imdb.com/title/tt2322441/?ref_=sr_t_17,2015,2h 5m,R,4.2,344K,"Literature student Anastasia Steele's life changes forever when she meets handsome, yet tormented, billionaire Christian Grey."
18. The SpongeBob Movie: Sponge Out of Water,https://www.imdb.com/title/tt2279373/?ref_=sr_t_18,2015,1h 32m,PG,6.0,64K,"When a diabolical pirate above the sea steals the secret Krabby Patty formula, SpongeBob and his friends team up in order to get it back."
19. Straight Outta Compton,https://www.imdb.com/title/tt1398426/?ref_=sr_t_19,2015,2h 27m,R,7.8,226K,The rap group NWA emerges from the mean streets of Compton in the mid-1980s and revolutionizes hip-hop culture with their music and tales about life in the hood.
20. San Andreas,https://www.imdb.com/title/tt2126355/?ref_=sr_t_20,2015,1h 54m,PG-13,6.1,265K,"In the aftermath of a massive earthquake in California, a rescue-chopper pilot makes a dangerous journey with his ex-wife across the state in order to rescue his daughter."
21. Mad Max: Fury Road,https://www.imdb.com/title/tt1392190/?ref_=sr_t_21,2015,2h,R,8.1,1.2M,"In a post-apocalyptic wasteland, a woman rebels against a tyrannical ruler in search for her homeland with the aid of a group of female prisoners, a psychotic worshipper and a drifter named Max."
22. Daddy's Home,https://www.imdb.com/title/tt1528854/?ref_=sr_t_22,2015,1h 36m,PG-13,6.2,134K,"Brad Whitaker is a radio host trying to get his stepchildren to love him and call him Dad. But his plans turn upside down when their biological father, Dusty Mayron, returns."
23. The Divergent Series: Insurgent,https://www.imdb.com/title/tt2908446/?ref_=sr_t_23,2015,1h 59m,PG-13,6.2,262K,"Tris Prior must confront her inner demons, and with help from those closest to her, continue the fight against a powerful alliance that threatens to tear her society apart."
24. The Peanuts Movie,https://www.imdb.com/title/tt2452042/?ref_=sr_t_24,2015,1h 28m,G,7.0,51K,"Snoopy embarks upon his greatest mission as he and his team take to the skies to pursue their archnemesis, while his best pal Charlie Brown begins his own epic quest back home to win the love of his life."
25. The Good Dinosaur,https://www.imdb.com/title/tt1979388/?ref_=sr_t_25,2015,1h 33m,PG,6.7,132K,"In a world where dinosaurs and humans live side-by-side, an Apatosaurus named Arlo makes an unlikely human friend."
26. Spy,https://www.imdb.com/title/tt3079380/?ref_=sr_t_26,2015,2h,R,7.0,266K,A desk-bound CIA analyst volunteers to go undercover to infiltrate the world of a deadly arms dealer and prevent diabolical global disaster.
27. Trainwreck,https://www.imdb.com/title/tt3152624/?ref_=sr_t_27,2015,2h 5m,R,6.2,145K,"Having thought that monogamy was never possible, a commitment-phobic career woman may have to face her fears when she meets a good guy."
28. Creed,https://www.imdb.com/title/tt3076658/?ref_=sr_t_28,2015,2h 13m,PG-13,7.6,319K,"The former World Heavyweight Champion Rocky Balboa serves as a trainer and mentor to Adonis Johnson, the son of his late friend and former rival Apollo Creed."
29. Tomorrowland,https://www.imdb.com/title/tt1964418/?ref_=sr_t_29,2015,2h 10m,PG,6.4,195K,"Bound by a shared destiny, a teen bursting with scientific curiosity and a former boy-genius inventor embark on a mission to unearth the secrets of a place somewhere in time and space that exists in their collective memory."
30. Get Hard,https://www.imdb.com/title/tt2561572/?ref_=sr_t_30,2015,1h 40m,R,6.0,150K,"When millionaire James King is jailed for fraud and bound for San Quentin, he turns to Darnell Lewis to prep him to go behind bars."
31. Terminator Genisys,https://www.imdb.com/title/tt1340138/?ref_=sr_t_31,2015,2h 6m,PG-13,6.3,299K,"When John Connor, leader of the human resistance, sends Sgt. Kyle Reese back to 1984 to protect Sarah Connor and safeguard the future, an unexpected turn of events creates a fractured timeline."
32. Sisters,https://www.imdb.com/title/tt1850457/?ref_=sr_t_32,2015,1h 58m,R,6.0,71K,Two sisters decide to throw one last house party before their parents sell their family home.
33. Alvin and the Chipmunks: The Road Chip,https://www.imdb.com/title/tt2974918/?ref_=sr_t_33,2015,1h 32m,PG,4.9,24K,The Chipmunks believe that Dave plans to propose to his new girlfriend in Miami.--and dump them. They have three days to get to him and save themselves not only from losing Dave but also from gaining a terrible stepbrother.
34. Maze Runner: The Scorch Trials,https://www.imdb.com/title/tt4046784/?ref_=sr_t_34,2015,2h 11m,PG-13,6.3,289K,"After having escaped the Maze, the Gladers now face a new set of challenges on the open roads of a desolate landscape filled with unimaginable obstacles."
35. Ted 2,https://www.imdb.com/title/tt2637276/?ref_=sr_t_35,2015,1h 55m,R,6.3,244K,"Newlywed couple Ted and Tami-Lynn want to have a baby, but in order to qualify to be a parent, Ted will have to prove he's a person in a court of law."
36. Goosebumps,https://www.imdb.com/title/tt1051904/?ref_=sr_t_36,2015,1h 43m,PG,6.3,98K,"A teenager teams up with the daughter of young-adult horror author R.L. Stine after the writer's imaginary demons are set free on the town of Madison, Delaware."
37. Pixels,https://www.imdb.com/title/tt2120120/?ref_=sr_t_37,2015,1h 45m,PG-13,5.6,167K,"When aliens misinterpret video feeds of classic arcade games as a declaration of war, they attack the Earth in the form of the video games."
38. The Intern,https://www.imdb.com/title/tt2361509/?ref_=sr_t_38,2015,2h 1m,PG-13,7.1,289K,"Seventy-year-old widower Ben Whittaker has discovered that retirement isn't all it's cracked up to be. Seizing an opportunity to get back in the game, he becomes a senior intern at an online fashion site, founded and run by Jules Ostin."
39. Bridge of Spies,https://www.imdb.com/title/tt3682448/?ref_=sr_t_39,2015,2h 22m,PG-13,7.6,334K,"During the Cold War, an American lawyer is recruited to defend an arrested Soviet spy in court, and then help the CIA facilitate an exchange of the spy for the Soviet captured American U2 spy plane pilot, Francis Gary Powers."
40. Paul Blart: Mall Cop 2,https://www.imdb.com/title/tt3450650/?ref_=sr_t_40,2015,1h 34m,PG,4.4,42K,"After six years of keeping our malls safe, Paul Blart has earned a well-deserved vacation. He heads to Las Vegas with his teenage daughter before she heads off to college. But safety never takes a holiday and when duty calls, Blart answers."
41. The Big Short,https://www.imdb.com/title/tt1596363/?ref_=sr_t_41,2015,2h 10m,R,7.8,504K,"In 2006-2007 a group of investors bet against the United States mortgage market. In their research, they discover how flawed and corrupt the market is."
42. War Room,https://www.imdb.com/title/tt3832914/?ref_=sr_t_42,2015,2h,PG,6.5,17K,"A seemingly perfect family looks to fix their problems with the help of Miss Clara, an older, wiser woman."
43. Magic Mike XXL,https://www.imdb.com/title/tt2268016/?ref_=sr_t_43,2015,1h 55m,R,5.6,62K,"Three years after Mike bowed out of the stripper life at the top of his game, he and the remaining Kings of Tampa hit the road to Myrtle Beach to put on one last blow-out performance."
44. The Visit,https://www.imdb.com/title/tt3567288/?ref_=sr_t_44,2015,1h 34m,PG-13,6.3,162K,Two siblings become increasingly frightened by their grandparents' disturbing behavior while visiting them on vacation.
45. The Wedding Ringer,https://www.imdb.com/title/tt0884732/?ref_=sr_t_45,2015,1h 41m,R,6.6,82K,"Two weeks shy of his wedding, a socially awkward guy enters into a charade by hiring the owner of a company that provides best men for grooms in need."
46. Black Mass,https://www.imdb.com/title/tt1355683/?ref_=sr_t_46,2015,2h 3m,R,6.8,197K,"The true story of Whitey Bulger, the brother of a state senator and the most infamous violent criminal in the history of South Boston, who became an FBI informant to take down a Mafia family invading his turf."
47. Vacation,https://www.imdb.com/title/tt1524930/?ref_=sr_t_47,2015,1h 39m,R,6.2,126K,"Rusty Griswold takes his own family on a road trip to ""Walley World"" in order to spice things up with his wife and reconnect with his sons."
48. The Perfect Guy,https://www.imdb.com/title/tt3862750/?ref_=sr_t_48,2015,1h 40m,PG-13,5.6,12K,"After breaking up with her boyfriend, a professional woman gets involved with a man who seems almost too good to be true."
49. Joy,https://www.imdb.com/title/tt2446980/?ref_=sr_t_49,2015,2h 4m,PG-13,6.6,149K,"Joy is the story of the title character, who rose to become founder and matriarch of a powerful family business dynasty."
50. Fantastic Four,https://www.imdb.com/title/tt1502712/?ref_=sr_t_50,2015,1h 40m,PG-13,4.3,181K,Four young outsiders teleport to an alternate and dangerous universe which alters their physical form in shocking ways. The four must learn to harness their new abilities and work together to save Earth from a former friend turned enemy.
51. The Hateful Eight,https://www.imdb.com/title/tt3460252/?ref_=sr_t_51,2015,2h 48m,R,7.8,684K,"In the dead of a Wyoming winter, a bounty hunter and his prisoner find shelter in a cabin currently inhabited by a collection of nefarious characters."
52. Focus,https://www.imdb.com/title/tt2381941/?ref_=sr_t_52,2015,1h 45m,R,6.6,284K,"In the midst of veteran con man Nicky's latest scheme, a woman from his past - now an accomplished femme fatale - shows up and throws his plans for a loop."
53. Southpaw,https://www.imdb.com/title/tt1798684/?ref_=sr_t_53,2015,2h 4m,R,7.3,266K,"After a fatal incident sends him on a rampant path of destruction, a champion boxer fights to get custody of his daughter and revive his professional career."
54. Insidious: Chapter 3,https://www.imdb.com/title/tt3195644/?ref_=sr_t_54,2015,1h 37m,PG-13,6.1,123K,A prequel set before the haunting of the Lambert family that reveals how gifted psychic Elise Rainier reluctantly agrees to use her ability to contact the dead in order to help a teenage girl who has been targeted by a dangerous supernatural entity.
55. Poltergeist,https://www.imdb.com/title/tt1029360/?ref_=sr_t_55,2015,1h 33m,PG-13,4.9,63K,A family whose suburban home is haunted by evil forces must come together to rescue their youngest daughter after the apparitions take her captive.
56. Jupiter Ascending,https://www.imdb.com/title/tt1617661/?ref_=sr_t_56,2015,2h 7m,PG-13,5.3,198K,A young woman discovers her destiny as an heiress of intergalactic nobility and must fight to protect the inhabitants of Earth from an ancient and destructive industry.
57. Sicario,https://www.imdb.com/title/tt3397884/?ref_=sr_t_57,2015,2h 1m,R,7.7,500K,An idealistic FBI agent is enlisted by a government task force to aid in the escalating war against drugs at the border area between the U.S. and Mexico.
58. The Man from U.N.C.L.E.,https://www.imdb.com/title/tt1638355/?ref_=sr_t_58,2015,1h 56m,PG-13,7.2,344K,"In the early 1960s, CIA agent Napoleon Solo and KGB operative Illya Kuryakin participate in a joint mission against a mysterious criminal organization, which is working to proliferate nuclear weapons."
59. Spotlight,https://www.imdb.com/title/tt1895587/?ref_=sr_t_59,2015,2h 9m,R,8.1,515K,"The true story of how the Boston Globe uncovered the massive scandal of child molestation and cover-up within the local Catholic Archdiocese, shaking the entire Catholic Church to its core."
"60. McFarland, USA",https://www.imdb.com/title/tt2097298/?ref_=sr_t_60,2015,2h 9m,PG,7.4,44K,"Jim White moves his family after losing his last job as a football coach, and at his new school he turns seven disappointing students into one of the best cross-country teams in the region."
61. The Gift,https://www.imdb.com/title/tt4178092/?ref_=sr_t_61,2015,1h 48m,R,7.0,178K,"A married couple, Simon and Robyn, run into Gordo, an old classmate. Things take a turn when Gordo begins to drop in unannounced at their house and inundates them with mysterious gifts."
62. Everest,https://www.imdb.com/title/tt2719848/?ref_=sr_t_62,2015,2h 1m,PG-13,7.1,238K,"On May 10, 1996, mountain guides Rob Hall and Scott Fischer combine their expedition teams for a final ascent to the summit of Mount Everest. With little warning, a storm strikes the mountain and the climbers must now battle to survive."
63. The Night Before,https://www.imdb.com/title/tt3530002/?ref_=sr_t_63,2015,1h 41m,R,6.4,86K,"On Christmas Eve, three lifelong friends spend the night in New York City looking for the Holy Grail of Christmas parties."
64. Krampus,https://www.imdb.com/title/tt3850590/?ref_=sr_t_64,2015,1h 38m,PG-13,6.2,90K,A boy who has a bad Christmas accidentally summons a festive demon to his family home.
65. Max,https://www.imdb.com/title/tt3369806/?ref_=sr_t_65,2015,1h 51m,PG,6.6,29K,A military dog that helped American Marines in Afghanistan returns to the United States and is adopted by his handler's family after suffering a traumatic experience.
66. The Age of Adaline,https://www.imdb.com/title/tt1655441/?ref_=sr_t_66,2015,1h 52m,PG-13,7.2,217K,"A young woman, born at the turn of the 20th century, is rendered ageless after an accident. After many solitary years, she meets a man who complicates the eternal life she has settled into."
67. Brooklyn,https://www.imdb.com/title/tt2381111/?ref_=sr_t_67,2015,1h 57m,PG-13,7.5,154K,"An Irish immigrant lands in 1950s Brooklyn, where she quickly falls into a romance with a local. When her past catches up with her, however, she must choose between two countries and the lives that exist within."
68. The Longest Ride,https://www.imdb.com/title/tt2726560/?ref_=sr_t_68,2015,2h 3m,PG-13,7.0,91K,"Sophia and Luke make an unexpected and fateful connection with Ira, a 90-year-old man, when they save him from a car crash. Ira's memories of his own decades-long romance with his beloved wife deeply inspire the young couple."
69. The Boy Next Door,https://www.imdb.com/title/tt3181822/?ref_=sr_t_69,2015,1h 31m,R,4.7,47K,"A woman, separated from her unfaithful husband, falls for a younger man who has moved in next door, but their torrid affair soon takes a dangerous turn."
70. Pan,https://www.imdb.com/title/tt3332064/?ref_=sr_t_70,2015,1h 51m,PG,5.7,68K,"Twelve-year-old orphan Peter is spirited away to the magical world of Neverland, where he finds both fun and danger, and ultimately discovers his destiny: to become the hero who will be forever known as Peter Pan."
71. Hot Pursuit,https://www.imdb.com/title/tt2967224/?ref_=sr_t_71,2015,1h 27m,PG-13,5.1,55K,An uptight and by-the-book cop (Reese Witherspoon) tries to protect the outgoing widow (Sofia Vergara) of a drug boss as they race through Texas pursued by crooked cops and murderous gunmen.
72. Concussion,https://www.imdb.com/title/tt3322364/?ref_=sr_t_72,2015,2h 3m,PG-13,7.1,102K,"In Pittsburgh, accomplished pathologist Dr. Bennet Omalu uncovers the truth about brain damage in football players who suffer repeated concussions in the course of normal play."
73. The DUFF,https://www.imdb.com/title/tt1666801/?ref_=sr_t_73,2015,1h 41m,PG-13,6.4,104K,"A high school senior instigates a social pecking order revolution after finding out that she has been labeled the DUFF - Designated Ugly Fat Friend - by her prettier, more popular counterparts."
74. Woman in Gold,https://www.imdb.com/title/tt2404425/?ref_=sr_t_74,2015,1h 49m,PG-13,7.3,65K,"Maria Altmann, an octogenarian Jewish refugee, takes on the Austrian government to recover artwork she believes rightfully belongs to her family."
75. The Second Best Exotic Marigold Hotel,https://www.imdb.com/title/tt2555736/?ref_=sr_t_75,2015,2h 2m,PG,6.5,37K,"As the Best Exotic Marigold Hotel has only a single remaining vacancy, posing a rooming predicament for two fresh arrivals, Sonny Kapoor (Dev Patel) pursues his expansionist dream of opening a second hotel."
76. Entourage,https://www.imdb.com/title/tt1674771/?ref_=sr_t_76,2015,1h 44m,R,6.5,84K,"Movie star Vincent Chase, together with his boys Eric, Turtle, and Johnny, are back - and back in business with super agent-turned-studio head Ari Gold on a risky project that will serve as Vince's directorial debut."
77. Paper Towns,https://www.imdb.com/title/tt3622592/?ref_=sr_t_77,2015,1h 49m,PG-13,6.2,110K,"After an all-night adventure, Quentin's lifelong crush, Margo, disappears, leaving behind clues that Quentin and his friends follow on the journey of a lifetime."
78. Chappie,https://www.imdb.com/title/tt1823672/?ref_=sr_t_78,2015,2h,R,6.8,276K,"In the near future, crime is patrolled by a mechanized police force. When one police droid, Chappie, is stolen and given new programming, he becomes the first robot with the ability to think and feel for himself."
79. Crimson Peak,https://www.imdb.com/title/tt2554274/?ref_=sr_t_79,2015,1h 59m,R,6.5,163K,"In the aftermath of a family tragedy, an aspiring author is torn between love for her childhood friend and the temptation of a mysterious outsider. Trying to escape the ghosts of her past, she is swept away to a house that breathes, bleeds - and remembers."
80. A Walk in the Woods,https://www.imdb.com/title/tt1178665/?ref_=sr_t_80,2015,1h 44m,R,6.4,31K,"After spending two decades in England, Bill Bryson (Robert Redford) returns to the U.S., where he decides the best way to connect with his homeland is to hike the Appalachian Trail with one of his oldest friends, Stephen Katz (Nick Nolte)."
81. Point Break,https://www.imdb.com/title/tt2058673/?ref_=sr_t_81,2015,1h 54m,PG-13,5.3,67K,"A young FBI agent infiltrates an extraordinary team of extreme sports athletes he suspects of masterminding a string of unprecedented, sophisticated corporate heists."
82. Sinister 2,https://www.imdb.com/title/tt2752772/?ref_=sr_t_82,2015,1h 37m,R,5.3,63K,A young mother and her twin sons move into a rural house that's marked for death.
83. The Last Witch Hunter,https://www.imdb.com/title/tt1618442/?ref_=sr_t_83,2015,1h 46m,PG-13,5.9,112K,The last witch hunter is all that stands between humanity and the combined forces of the most horrifying witches in history.
84. No Escape,https://www.imdb.com/title/tt1781922/?ref_=sr_t_84,2015,1h 43m,R,6.7,96K,"In their new overseas home, an American family soon finds themselves caught in the middle of a coup, and they frantically look for a safe escape from an environment where foreigners are being immediately executed."
85. Ricki and the Flash,https://www.imdb.com/title/tt3623726/?ref_=sr_t_85,2015,1h 41m,PG-13,6.0,25K,"It's been a roller-coaster ride for Ricki, a one-time wife and mother of three who left them all behind to follow her dreams of rock 'n' roll stardom. Now, Ricki must face the music when she returns home to reconnect with her family."
86. Run All Night,https://www.imdb.com/title/tt2199571/?ref_=sr_t_86,2015,1h 54m,R,6.6,117K,"Mobster and hit man Jimmy Conlon has one night to figure out where his loyalties lie: with his estranged son, Mike, whose life is in danger, or his longtime best friend, mob boss Shawn Maguire, who wants Mike to pay for the death of his own son."
87. Love the Coopers,https://www.imdb.com/title/tt2279339/?ref_=sr_t_87,2015,1h 47m,PG-13,5.8,28K,The intertwined stories of four generations of Coopers unfold right before the annual family reunion on Christmas Eve. Can they survive the most beautiful time of the year?
88. The Lazarus Effect,https://www.imdb.com/title/tt2918436/?ref_=sr_t_88,2015,1h 23m,PG-13,5.2,47K,A group of medical researchers discover a way to bring dead patients back to life.
89. The Witch,https://www.imdb.com/title/tt4263482/?ref_=sr_t_89,2015,1h 32m,R,7.0,327K,An isolated Puritan family in 1630s New England comes unraveled by the forces of witchcraft and possession.
90. In the Heart of the Sea,https://www.imdb.com/title/tt1390411/?ref_=sr_t_90,2015,2h 2m,PG-13,6.9,154K,"A recounting of a New England whaling ship's sinking by a giant whale in 1820, an experience that later inspired the great novel Moby-Dick."
91. The Gallows,https://www.imdb.com/title/tt2309260/?ref_=sr_t_91,2015,1h 21m,R,4.2,22K,"20 years after a horrific accident during a small town school play, students at the school resurrect the failed show in a misguided attempt to honor the anniversary of the tragedy - but soon discover that some things are better left alone."
92. Hitman: Agent 47,https://www.imdb.com/title/tt2679042/?ref_=sr_t_92,2015,1h 36m,R,5.7,98K,An assassin teams up with a woman to help her find her father and uncover the mysteries of her ancestry.
93. Project Almanac,https://www.imdb.com/title/tt2436386/?ref_=sr_t_93,2015,1h 46m,PG-13,6.4,86K,"A group of teens discovers secret plans for a time machine, and construct one. However, things start to get out of control."
94. Aloha,https://www.imdb.com/title/tt1243974/?ref_=sr_t_94,2015,1h 45m,PG-13,5.4,75K,A celebrated military contractor returns to the site of his greatest career triumphs and reconnects with a long-ago love while unexpectedly falling for the hard-charging Air Force watchdog assigned to him.
95. Secret in Their Eyes,https://www.imdb.com/title/tt1741273/?ref_=sr_t_95,2015,1h 51m,PG-13,6.3,53K,"A tight-knit team of rising investigators, along with their supervisor, is suddenly torn apart when they discover that one of their own teenage daughters has been brutally murdered."
