Title,Movie Link,Year,Duration,MPA,Rating,Votes,Description
96. Shaun the Sheep Movie,https://www.imdb.com/title/tt2872750/?ref_=sr_t_96,2015,1h 25m,PG,7.3,45K,"When Shaun decides to take the day off and have some fun, he gets a little more action than he bargained for. A mix up with the Farmer, a caravan and a very steep hill lead them all to the Big City and it's up to Shaun and the flock to return everyone safely to the green grass of home."
97. Eye in the Sky,https://www.imdb.com/title/tt2057392/?ref_=sr_t_97,2015,1h 42m,R,7.3,94K,"Col. Katherine Powell, a military officer in command of an operation to capture terrorists in Kenya, sees her mission escalate when a girl enters the kill zone, triggering an international dispute over the implications of modern warfare."
98. Paranormal Activity: The Ghost Dimension,https://www.imdb.com/title/tt2473510/?ref_=sr_t_98,2015,1h 28m,R,4.6,32K,"Using a special camera that can see spirits, a family must protect their daughter from an evil entity with a sinister plan."
99. Steve Jobs,https://www.imdb.com/title/tt2080374/?ref_=sr_t_99,2015,2h 2m,R,7.2,183K,"Steve Jobs takes us behind the scenes of the digital revolution, to paint a portrait of the man at its epicenter. The story unfolds backstage at three iconic product launches, ending in 1998 with the unveiling of the iMac."
100. Mr. Holmes,https://www.imdb.com/title/tt3168230/?ref_=sr_t_100,2015,1h 44m,PG,6.8,69K,"An aged, retired Sherlock Holmes deals with dementia, as he tries to remember his final case, and a mysterious woman, whose memory haunts him. He also befriends a fan, the young son of his housekeeper, who wants him to work again."
